大鱼心理咨询工作室,每个人都体会过抑郁的感觉，每个人都曾经、伤心、失望低落，阴郁的情绪和临床上抑郁症的区别就像是感冒和肺炎的区别。· 抑郁症是一个整体的疾病。它会影响身体，情感，思想和行为。抑郁症会使我们有一种请求帮助也没有用的感觉。好消息是80%~90%的抑郁症患者，可以从心理治疗中获得改善，但坏消息是有将近一半的人将抑郁看作一种性格缺陷——认为是想多了或者比较“作”，而不把它看成一种情绪障碍或者疾病。· 抑郁的反面，不是幸福，而是活力，是感知所有情绪的能力，包括高兴兴奋悲伤以及痛苦。抑郁本身不是一种情绪，而是情感的丧失，是将你与世界隔离开来的厚重幔布。它不是悲伤或者痛苦，它是一种疾病。当我们感觉到特别的伤心无助的时候，我们能够感觉抑郁症患者的感受，但不同的是抑郁症患者如果没有外界的帮助，就不能从中恢复过来。· 抑郁的标志——就是悲伤或者空虚情绪的蔓延，有时也表现为紧张或者焦虑，生活中缺少乐趣。中度抑郁的人可能会对吃饭性生活工作游戏等活动，感觉很空洞，失去兴趣。重度的抑郁患者可能会完全无法工作学习，甚至连日常生活都会成为问题。重度抑郁患者有的时候会连续好多天不能起床，不能清洗，不能睡觉。他们常常有一种持续的疲惫感难以集中，精神感觉生活没有价值。· 有时候我们也会因为失去重要的人或东西而感到悲伤。这种感觉有点像抑郁。但抑郁症患者可能更多的处于一种低自尊无助自责的状况。这些和我们悲伤的感觉是不同的。如果处于抑郁状态，你可能会感觉自己是命运的牺牲品，不配得到更好的，但如果只是悲伤，你通常明白自己总有一天会恢复过来。· 抑郁患者的身体症状——睡眠紊乱是主重要的。有些人可能会很难入睡，或者很早就醒，但仍然感觉不清醒。也有一些人可能会睡的很多，但感觉没有睡好。睡得不好可能会导致疲倦，情感感知力下降，甚至没有办法清晰地思考、常常健忘。· 自杀的念头会经常出现，有些人只是一个念头，有些人则会详细地计划做自杀的每个步骤，距离死亡越近，就越是需要求助。· 抑郁症患者看待世界的方式是扭曲的，他们会坚持认为世界是不友好的，自己是不被喜欢的，在与他人的交往中，他们有不切实际的期望，不能很好的表达自己的需求，将不同的意见视为排斥，为自己的表现而焦虑，不自信。最终他们将验证世界不喜欢他们的事实，它们会对人类的情感茫然不解，不知道正常的感觉应该是什么样的，以至于使他们害怕真实的情感，害怕与人建立真实的关系。公众号：大鱼心理咨询预约心理咨询，请联系助理，微信号：dayuxinlizixun微博账号名：大鱼心理咨询工作室喜马拉雅账号名：大鱼心理咨询工作室,6,2
匿名用户,离婚协议已写。姑娘我不想曝光你的个人信息，也不想到你们学校贴吧等人肉你。只是，下次别再做毁人家庭的事情了。真的很可耻。如果你看到这条回答，不用怀疑，说的就是你。……我不知道抑郁症是什么表现但是有一个学测绘的女孩子，小我先生几岁，借着找个吐诉的幌子哥哥长，哥哥短的，直到闹得我家鸡犬不宁 离前夫不远了。 她是一个说什么话都以“啦～啊～嘛～”结尾的女孩，或许她是一个可爱的女孩子，只是姑娘，你不知道他已婚吗？大半夜聊天那么久合适吗？你有问题不知道找医生吗？你没挚友吗？没有可说的人吗？这位漳州的姑娘，我在觉得我先生渣的同时，也觉得你真不自重。白莲花一朵。,4,1
元味,我个人的经历。最明显的一点就是，累。特别累，明明一天什么事儿都没做，就是特别累。困，想睡觉。恨不得在床上躺着睡到天荒地老。不想说话，就觉得跟人说话很累，很麻烦，就懒得开口。他们看我的状态就是觉得我整个人由内到外散发着特别疲惫的气息。然后就是自卑。做啥都觉得自己是个垃圾。是个废物。做什么事失败了都觉得是自己的问题。然后越担心越做不好，越做不好越担心，死循环。冷漠。觉得自己跟世界始终有距离。喜欢独处什么的就不说了，觉得真的不想找朋友。烂好人，不敢拒绝，怕起冲突。因为觉得吵架了，无论错在不在我，我都会把责任推给自己头上。,4,5
zhuhelin,我感觉好多回答都把抑郁症当成了段子在讲，毫无根据的凭空猜测简直算得上污蔑。有很多人就是喜欢把抑郁症这种生理学疾病扯成乱七八糟的玄学，凭空捏造，无中生有，没病硬是要创造疾病说自己有病，让人匪夷所思。抑郁症作为神经类疾病，病因肯定和神经细胞有关系，和一些玄而又玄的东西没多大关系。神经细胞产生的疾病无非不是太兴奋就是太萎靡，这里面除了一些人是由于遗传和外力受损，或者是受到了精神折磨，基本上患病的人不多，大部分神志清醒的人都是无病呻吟(和精神病同理)。所以有时候就真的很奇怪，为什么很多人有事没事就说自己抑郁症？甚至什么多重人格？精神病早期？你确定不是因为自己想逃避现实或者根本就是浑水摸鱼从中谋利。更奇怪的是居然还有人分析的头头是道，你确定你分析的东西不是给自己的心理暗示？心情不好就算是抑郁症？那样是不是太草率了。虽然鄙人不是业内人士，但是起码知道精神类疾病肯定会影响大脑的记忆力，注意力或者思考能力，也有的甚至会影响行动能力和激素代谢，但是哪天不高兴就说自己得了抑郁症是不是过于匪夷所思。可能还是在于抑郁症，甚至来说心理学这种东西，太过于学科交叉，一方面高端的神经学实验让人难以理解，而与之相反的各种类似于哲学的心理学理论几乎可以让每个人都说几句，而且还真的似乎有点道理。但是真的有道理吗？我看是毫无道理。只通过现象就得出结论是很多类似观点根源，但是稍微理智一点的人就知道，七点和终点相同，路径可能完全不用，所以现象相同就认为原因的想法真的很幼稚。鄙人不才，作为一个准备改行计算机的生物狗，有幸上过一门神经生物学，当然，课程很浅显，大部分的东西我也忘了。在神经系统中大量的关于生化和分子的机制我都忘得一干二净，但是我能够记住的是课程中将神级系统和计算机系统的类比，各个神经系统的模块之间的相互联系同计算机各部件通过总线想联系是极其类似的。所以来说，对于神经系统而言，其研究和其他学科一样是可以量化的。神经细胞和大脑思维就好比计算机的硬件和软件，区别就在于，计算机是我们人类创造的，我们全知全能，而神经系统还没有做到这点。但着并不意味我们永远都做不到，我们人类已经在这方面去得了较大成功，一些科学家正在尝试将人的记忆和思维复制到计算机里面，相信我们这一代人能够见到这样的奇迹。很多人评论这个问题并不是客观严谨的态度，他们往往以精神导师自诩，或者以民科，民哲自居，混淆视听，让人琢磨不透，把一个并不是无解的生理现象硬生生说成玄而又玄的东西。我们现在确实还存在很多无法量化的研究，这也直接导致了一些层出不穷的奇怪言论，很多人完全没接触过很多学科就枉自评论，甚至大有自己发现了什么了不得的东西这样的驾驶，真是让人唏嘘。以前有各种永动机，巧解世纪难题的大数学家，现在有各种奇奇怪怪的心理学专家，这些人不过是时代造就的神棍罢了。科学肯定会给所有问题一个合理的解释，这只是时间问题。如果你真的有什么疾病，不要在几乎浪费时间，去医院看病更靠谱，不然真的被里面的胡言乱语耽误了就迟了。如果你还想探索更多更远，图书馆或者实验室都是很好的选择。,4,0
坚持乐观吧,别人眼里，他们太懒了。,4,1
匿名用户,在某些时间段内，可能是隔一个星期，一个月，也可能就是因为今天天气不好。反感所有人，不论是朋友，亲人，男女朋友，同学，哪怕是陌生人。世间的一切都站在我的对立面，谁都不懂我，谁都没有打算懂我，他们只会觉得是我的问题，他们只知道站在一旁不闻不问，他们只知道问一些无关紧要的问题，他们做什么都是错的，因为没有人懂我。每次不知道什么时候才能走出来，心理医生说要多说话，多交朋友。但是真的到了那个时候，朋友又会被我一个个赶走，喜欢的不喜欢的通通滚开，我很烦，你们都走开，别管我。有时候真的想如果你们都不走开那只好我离开这人世。而这些，谁都不会知道，我只会试图微笑着和他们聊天交流，去完成该做的任务，同时在内心里一遍遍折磨自己，试探着自己的底线,4,1
