匿名用户,孤独无助无能为力力不从心求救自由就是这样人生是双面的，众人中开朗阳光，私下很压抑阴暗无数次想死一面是光明，一面是黑暗。每天走在路上都在想被车撞死会怎么样很无助总想控制自己的情绪但是没办法总觉得自己很没用，而且发作头昏脑涨，睡不着觉，夜间总是惊醒，而且总听一下很压抑的歌曲根本没法集中精力，玩手机又好像在虚度光阴自己很想调节，但是没办法黑夜里很孤独，很孤单，好像黑夜会把你一点点侵蚀掉，从心底涌上来的惶恐，压迫，紧张，压抑，喘不过气来。根本没有人理解我，懂我，感觉很无助他们看不懂，我的绝望下藏着的迫切，没有人理会是我的救赎。我想活下去，无数次在对外界求助“我好像不行了，快来帮帮我”“救救我吧”总感觉全世界抛弃了我希望未来会好一些。加油,6,1
匿名用户,迟钝，迟钝到什么程度呢？身体会痛，头会痛，每日浑浑噩噩，但不觉得有什么大不了——以为是找不出原因的普通毛病，谁都多少有的那种，就日常扛着进行工作学习生活。对很多事情丧失兴趣，无法启动自己。可以发呆N个小时不动，也可以在床上躺一整天。非常不好的时候，甚至都不怎么需要吃饭——但觉得是因为自己懒，懒到一定程度了。流泪，为自己的状态难过，伴随着自责。无法入睡，睡着了做噩梦。梦中在哭喊，醒了以后为又做了这种梦难过哭。精神在承受煎熬，许久许久，以为是自己比较矫情、感情脆弱、玻璃心。就连“你不是没事儿，你只是对痛苦比较能忍”，都是先经由别人告诉，然后自己才慢慢接受并承认确实如此的。因为不太会和别人交流痛苦，因此一些经历和感受无从比对。甚至，不懂得经历的一些事情叫“创伤”，会以为“别人也是这样，也会遭遇这样的情况”。直到有一天，终于明白了自己经历的一些事情是什么、对自己造成了什么影响以后，哇哇大哭，这一刻的眼泪才是哭得明明白白的。终于明白了自己跑着跑着忽然迈不动步，不得不停下来大喘气的原因——但这一刹那整个人却仿佛坍塌了，只想趴在地上不起来。然后一点点试着爬起来、从摧毁中重建。再到尝试着往前走，带着拐杖——盼望着有一天能把拐杖丢开自己走。这期间也会有反复，遇到的事情和人，甚至可能自己也不太清楚的原因，就会再趴下、重新站起，重复上面的过程。像走在一条好长好长的路上，不知道终点。但知道路会通往前方，是唯一的支撑和信仰。,6,4
匿名用户,特别能哭 脑子里乱七八糟的事跟放电影一样 然后就莫名其妙地流眼泪 画个画能哭 吃个饭能哭 骑个车都能哭 我自己都嫌自己矫情但就是控制不住 到了晚上就是整宿整宿睡不着 半宿半宿地哭 然后第二天早上起来眼睛巨肿 严重的时候会心跳加速 有股莫名的悲伤感压的人喘不过气 感觉心脏要被挤炸了 还有点呼吸困难 那时候就特别特别难受 太难受了难受的想死 （真的特别能理解为什么有人会自残 身体上的疼痛有时真的可以缓解心里的那种难受）然后我又是那种不喜欢哭出声怕被人发现的人 就会咬自己或者掐自己 最严重的一次是自己在家拿头撞墙。。脑子里想的都是怎么去死 现在马上立刻就是不想活了 但又有一丝理智告诉你有不能死的理由告诉自己要撑住 结果就是两股力量互相撕扯 脑子也疼反正就是从里到外都难受的要死 而且这期间还在不停地哭。。,6,8
匿名用户,不知道大家发作的时候会不会感觉到胳膊疼（…不知道为什么我胳膊会很疼，确切来说是很难受，就是割腕会割的那个地方，里面血管突突突地疼，好像有什么东西叫嚣着想要出来然后就是什么也不想做，头疼头晕，晚上失眠白天嗜睡（草觉得自己是个废物，辜负大家的期望，觉得自己一事无成就算有人安慰其实根本无关痛痒甚至会觉得我让别人担心了我果然是个废物会哭，试图想之前的一些美好的东西来安慰自己结果更难过了不想和别人交流，不想去人多的地方，只想一个人待着发发呆睡睡觉有的时候会想死，想着怎么死掉比较安详，后事处理不会太麻烦别人，不能在学校自杀，会对学校影响不好。不在公共场所自杀，会引起其他人的不适。诸如此类感觉活着太不容易了,5,16
As星砂,我不知道我是不是有抑郁，没去医院检查过，只是我朋友说我从17年生病（非精神疾病）之后就慢慢变了，变得很丧很没有活力。1.爱哭+不受控制的自残倾向：我自己都不知道我从什么时候起就开始在晚上熄灯后一个人哭，没有原因，就是特别想哭，每天起来眼睛都是肿的，一直到现在大四，压力特别大，我每天都很焦虑，不想出门只想缩在自己床上还必须要拉上床帘那种，不想被任何人看到，而且有一天我因为一点点与我无关的小事就想掐死自己，那个时候的手像不受控制一样自己就往脖子上抓了，我在大街上快哭了一边跟自己说不可以一边看见墙就想往上面撞。2.没有活力：双选会上找工作的时候，我一直想的是我不挑工作什么都能做，我要快点找工作因为找到之后我的生活就停止了，我可以不用思考了，就这样像个机器一样活下去，但是那些公司的宣讲会要求的都是有干劲有朝气有野心的青年，我没有，我太累了，我就像一辆破旧的车根本跑不动，我只想停着，停在每天按部就班的循环里不再思考，只有这样才能不耗损我所剩无几的能量。3.没有喜欢的东西没有目标：我没有任何喜欢的东西，不是因为我品味高，而是因为想到我觉得喜欢一个东西太累了，我不肯动手去尝试，缺乏好奇心和求知欲，因为我觉得太累了，具体哪里累呢，我也不知道。4.想死，觉得死是唯一的解脱：我是非常非常想死的，这种状态持续了已经一年多了。友善提醒一句，别因为一时的善意跟长期有这种想法的人说“请你吃东西”“全世界都爱你”“我们陪着你”之类的话，没用的，起码对我来说没用，我对吃什么这种事情早就不在意了，只要是能吃的，饿不死就行，甚至我对“被爱”都没有奢求了，如果一个陌生人说很爱我，我会受宠若惊，因为我知道爱是需要回馈的，你对我随便安慰一句，我恨不得说五十遍谢谢你，但我知道你们只是可怜我，不想看到我死罢了，所以我从来不敢在微博上说我想死之类的，我太怕收到一堆安慰的话了，过量的爱会加深我的焦虑。关于死，我有很多想法，我是自己想死的，但是我又不想表现出我是懦弱退缩后自己离开的样子，所以我总是想着我会生病、被人杀死之类的，直到有一天，我脑海里突然出现了一副画面：下雪天，屋里暖烘烘的，我窝在软绵绵的被子里，我妈妈坐在床边看着我，然后摸摸我的脸，接着我就可以死了。第一次想到这个画面我激动得哭了出来，这是这几年来我最幸福的瞬间。后来我想想，我大概是希望死在我爱的人手里吧，我不会爱自己也不会爱别人，我对一个人爱的表达方式就是希望被她杀死，能死在所爱之人怀里那将会是我最幸福的时刻。好像说太多了哈哈，就先这样吧。,4,4
特殊字符,你不知道什么时候TA突然就闯进来了，突然一下子你感受到了铺天盖地的黑色情绪。也终于懂了小学学的那句“黑云压城城欲摧”原来是这种感觉，是啊，快要崩塌了。每当这个时候我都在心里默念，我不喜欢这个感觉，快走开快走开。但是没办法，越来越强烈，只会越来越强烈。心里漏了一个很大的黑色的洞，抱紧自己全身都在抖，但是父母却还在无休止的指责你。父亲突然推开门，你坐在门后，被重重一击。母亲还在用各种脏话，各种抱怨的话倾盆而下。终于尖叫出来了……世界也安静了。他们不知道我有病。对，就是现在，刚刚，所以现在我也无法组织好自己的语言。是我矫情了，我对不起所有人，可是第二天我为什么还要醒过来呢？带走我吧，我最爱的姥姥姥爷，快点带走我吧。在那个世界，只有和你们在一起，我才可以活着。我喘不过气了，我好累啊，对不起啊。真的对不起。,4,6
匿名用户,匿了，避免某人看到六年了吧，感觉自己并不是发作不发作的问题，而是时刻准备着爆炸，长期处于一种难以压制的暴力冲动。这些年特别痛恨一种人：你要学会自我调节~我调节得好还会轮到你说？讲这个话最多：父母、前岳父（时至今日还在讲，不好跟他爆发而已）。跑题了…关于这种心理感受的话，个人通常是在“亲切的问候”过爆炸对象以后内心杀他/她/它一百遍最后不得不对自己做点什么否则难以了结的状态。如字所表，必须对自己做点什么，但是不会寻死。对此，现在自己的住所已经没有任何利器了，我必须无论如何活下去，自己一个人受伤也可能致命。同时也会不断考虑一死了之带来的好处，然后吃药。（事实上时至今日个人觉得药物已经没什么效果了，纯粹当安眠药了）我并非认为世界欠我的，我只是感觉世界的声音太嘈杂、令人烦躁。怎样对我个人而言的状态是最佳的呢？流浪去吧！想做点什么就做，我主动联系别人的时候不被对方嘘寒问暖，随便扯点有的没的，完美。目前就是如此的一个状态（借此机会成功打进了全球某M开头知名企业搬砖……）顺带一提……个人义务式副业是开导自闭少年少女……医者不能自医？,4,0
匿名用户,我不会割手腕，毕竟知道这样si不了，同理不会拼命磕安眠药，但我很喜欢撞墙，用脑袋用力地!“dang!”那种晕眩感，就算只有一瞬间能把一切都忘掉，那也值了，很担心有没有变笨，记忆力有没有变差，逻辑、语言表达方面等等有没有事，但又觉得，自己怕是活不到出事的那一天了。情绪反复无常，我可以上一秒还哭得感觉快崩溃天都快塌下来感觉真不行了，下一秒除了鼻音以及眼框等生理会暴露出来外，还可以嘻嘻哈哈地聊天开玩笑，然后笑完又继续关上房门继续哭，也可以每次早上说要努力，充满希望，一到晚上就失眠失眠失眠，太多事情会在脑子里反复回播刷存在感，一上头了眼泪鼻涕就收不住，然后就睡不着了。失眠然后第二天生理时钟就会乱，然后吃不下饭，要么很能吃(饿久了)，要么就吃不下，肠胃也有点问题……免疫力低下、皮肤瘙痒、偶尔脚部会像被虫子咬那样一抽一抽的，然后往皮肤一摸才知道是皮下的血管/神经在跳动，从别人来看，我这个人除了记忆力不好，冒失，说话做事粗枝大叶，整体来说不着调以外，大概，应该，还是一个健健康康的人。很难受，我想要活下去，求生的意志一直都非常顽强，但同时也明白这其实并没有意义。想要求救，但也不会有人在意的吧。,17,15
匿名用户,想写点什么，但又觉得很累，就懒得写了。可不可以告诉我，除了我死了我爸妈会疯掉之外，活着的必要到底是什么？,3,0
和抑郁握手言和,哭，一直哭,3,0
匿名用户,我不知道自己到底是不是抑郁症，不敢去医院，但网络测试每次都是重度抑郁，每次的分值都很高，脑子里没事就想着死死死，有时候我可以睡觉睡一天，有时候明明困，却怎么也睡不着，脑袋很疼，但依旧睡不着，我总想着试涂改变，但又无能为力，很多时候想着一死了之，但今天看了韩国岁月号记录片，看到家人们哭在一起的感受，我就有那么一瞬间不想死了，我怕家人会难过，我怕父母奶奶年纪大受不了，我怕对弟弟造成影响，我怕死后的流言蜚语，我怕很多，但却不怕死，渴望着得一场重病，然后去旅游一趟，好好的死去。……有很多想说的，又不知道该从何说起，我还年轻，我在坚持，真有坚持不下去的那一天，我会好好道别。,3,4
麦老师,1.感觉不到快乐，最早的时候别人会问怎么你从来不笑啊，因为很难感觉到想笑，后来就开始练习微笑，但笑了也没感觉快乐。但是别人就不问了。2.身体会出问题，没什么特别的原因。有段时间脖子上有一块说肿不肿的，说疼也不是很痛，不疼还总能感觉到，那会儿我经常想拿刀划开算了，出血疼也比这样舒服，发炎也行。但是不的，就那样，连续好几个月。连续好几个月的咳嗽也有，慢性鼻炎，浑身上下都疼，不能碰，桌子角碰一下就非常难受。3.起床，穿衣，出门困难。觉得自己出门也没什么地方可去，也没有人关心，还说不定惹麻烦，我在国外，路上经常会有人问‘你好吗’，我就更加不想出门。每一次说我很好的时候，都是骗人。4.跟谁也不想说话。因为觉得不但别人帮不到忙，还会把人家也说的抑郁了，总觉得自己让别人失望，没有用，不能给别人带来快乐和价值。5.随时感觉自己消失了也没关系，但是又不能消失，如果这样就消失了不是给世界留下的都是负能量吗？继续活下去也是负能量，死了也是负能量，感觉没有办法，躺在床上都是浪费空气。我现在已经走出来了，并且得到了抑郁症给我的力量。抑郁症不是一种病，就算是的话，这个负能量也不是我们自己一个人的，而是整个世界的。所以我想根据我自己的建议给所有在抑郁症里挣扎的朋友们，希望可以帮到你一点1.承认自己的存在价值。抑郁症的这个负能量，在谁的身上出现是一个几率问题，在你身上出现，说明你是坚强的，敏感的，有人性的。所以就算是你什么都不做的时候，只要呼吸，你就是这个世界上最珍贵的人性标本。起不来的时候，就潜下去也没关系。2.去寻找你自己能接受的解释。抑郁症是催促你去寻找自己的答案，去了解自己的情绪，能量波动，信念信仰，喜好，价值，如果不能找到，就先选择一个。3.自制。不要伤害自己或是别人，说话，做事，都尽可能不要伤害自己。比如当你想‘我真没用’的时候，马上提一个问题，我有什么用，想不到有什么用处，是从别人的角度，你自己的角度呢？多少总有一点用处吧，你身上还有很多寄生虫需要靠你活命呢。如果瞎想可以救命，干嘛不呢,3,0
我和抑郁那点事,泻药抑郁症发作有多难受？首先在于你是如何看待抑郁症的发作发病。抑郁症的发病是随机的，可以说是哪怕没有任何诱因，只是在一瞬间，那种天塌地陷的感受如同一座大山呈压倒之势压在你的身上，让你喘不过气。有人将这座山视为洪水猛兽，是善与恶的战争，你恐慌身边的一切事物，却又因此而怜悯，这种近似于分裂般的人格让你压抑恐惧，当你越害怕它，它就越强盛，你的难过也随之放大。十倍百倍，世间每个角落都向你施加着压力，这本书不应该放在这个地方、手机不应该只有百分之三的电量……不计后果的打、砸不光是为了释放你的压力，你的恶念，还是保护措施，你对自己的保护措施，只有这样才能让你放松下来，所以经常会听心理咨询师说，“在这个房间内你要做的一切都是被允许的”。当你觉得没人可以保护你，所有人都要伤害你的时候，唯独你可以自救。还有一种人，当抑郁发作的时候，就像是见到了一个多年未见的老友，是丘吉尔口中的黑狗，你会漫不经心地跟他打招呼，“来了？”只是从你匆忙找药不小心碰倒椅子的过程中会意识到你或许没有那么冷静，吃完药你立马把自己裹在被子里，害怕自己会做出伤害别人伤害自己的事情，你并不能睡着，就这么干瞪着眼熬了一宿，直到感觉胸口堵着的那口气悄然离去，你才能稍微安心一点，开始觉得这种生活好没意思，不如一死了之。第一种一定比第二种难受吗？第二种一定比第一种冷静吗？不 都是一样的。这种难受，像是一种慢性毒药，逐渐腐蚀你弱小的心灵，本来只是一个蛀虫，可随着越来越多的悲伤难过变成它的养分，你发现的时候它已经在你的心房中蛀了如此大的一个空间，挤走了你的快乐和安心，取而代之的是无尽的空虚、悲伤和难过。用知乎某大拿的一句话：有岩浆海啸，扑面而来，我一动不动。公众号：我和抑郁那点事我是萧何，五年重度抑郁患者，与您分享和抑郁的那点事，希望您不要重蹈我的覆辙，归来仍少年。,3,0
匿名用户,反正是烂掉的心。家庭没那么重要，婚姻更不值一提。就算会结婚也不想要小孩，生命的延续对我来说是扯淡。曾经迫切的想抓住一根稻草想去他身边，可惜他不是，他不是。我可以辜负人吗，快窒息了。我不爱人了，不爱人可以吗，我现在也想不通那些一直在寻找一个人一起度过一生的人。我肯定是自己太有趣，不需陪伴。两天前是25岁生日，自己买了蛋糕，吹完蜡烛就哭了，怎么就25岁了，我好想停留在这美丽的年纪里。生日愿望都没许，没有愿望，我想出家。原来我不会想死的事，现在我看的明白了。反正都要死，也没什么舍不得。只是我真的要请你再努力一点求你，你的龙猫十五你走了真的没人照顾他了，再努力一点，去看看银杏，去看你爱的日落。今天中午在图书馆晕倒了，摔倒楼梯，当时一直昏沉沉也不知道工作人员怎么给我朋友打的电话，一直都清醒不来，昏沉沉，话都讲不出来。晚上肩膀和膝盖感觉到痛，我朋友真好，可是我粗暴的伤害了他，我真是垃圾坏蛋。真对不起，心都是真的，希望有一天你会知道，最好的心祝福你考研成功。太爱落日了，看到落日就没那么想结束时间了。不要哭了，爱情没有对错，5年了，你们真的没有缘分不要再回头了不要再伤害别人了别再积累孽缘。你答应过的，要把爸爸剩下的人生那一份一起过好，你别忘了你做好了再死,3,0
小当佳,身体内像有黑影在吞噬你，心里像是被挖空了一般难受你想发泄却发泄不出来流不出眼泪，做不出表情，喊不出声音你只能在皮肤上划开无数个口子让情绪泄出,3,0
匿名用户,阴晴不定 头疼烦躁 我想那么做我害怕后果我又要，不想吃药，我怕我全部吃掉了，疲倦，空洞，厌烦，这个时候你随便对我说什么 安慰也好平常日常对话也好 我都好厌烦，烦躁不安根本拿自己没办法，也不愿意说什么 我害怕别人的不屑和同情击垮我。我还不想死，但我怕别人随便一个眼神一个动作一句话，有心也好无心也罢，我不敢赌。难受到恶心，哭也好不哭也好。可能哭出来更好吧，头疼茫然，自责无奈。我要怎么做能怎么做，你们又不能帮我我也不愿意别人来帮我，我怕，我怕你成为我的寄托了以后又令我难堪甚至因为能自残而高兴，不是为了什么，可能算是在惩罚自己？也许我笑着呢，但是感觉好累得很我不想别人因为我担心，往复循环 我害怕了。我累了所以我都会喝酒喝酒继续划伤自己，这样我就能轻松点不会想直接死去每晚每晚的噩梦，记忆犹新的恐惧身体本来就虚了，发现自己居然还有先天性心脏病这鬼东西 虽然不是很严重的，但一酗酒情绪一激动起来还是会疼，有时候想想就好笑，真 心 疼诶喝完酒就自残，我还是挺怕疼的，但是还能忍，但酒精麻痹大脑麻痹痛觉，割几个伤口就去睡觉，第二天照常上课生活，有时间害怕别人看到自己的伤口有时候又坦然的很我对自己的病情从未隐瞒，但又难以启齿，不是什么，是不想让他们多想我的家人害怕了，他们对我更加关心，小心翼翼生怕触动我的情绪，但我有跑远了，我想躲着，躲得远远的，不想被议论不想被关注不想被担忧就让我安安静静的生活或者离开吧。但是我还是想活着的对吗我想养属于我的猫猫，我想有个清净的住所简单的友人，我这一生不图些什么，也不图别人什么。就干干净净，谁都没有亏欠，我活的也开心死了也开心。,3,23
匿名用户,说说我自己吧，可能因为小时候家暴，有了心理阴影，现在工作了，什么事情都憋在心里，父母也不会问我的感受，同事说不太好听的话，可能对于他们来说没什么，可是对我来我我要难过好久好久，也不出去玩，不与人交流，直接来说现在有点恐惧社交，我想一个人待着，控制不住自己的情绪，我身边也没有朋友，我告诉我认为对我很重要的人我有病，我希望他能救赎我，可惜他不能，他只觉得无能为力，殊不知不需要做什么，哪怕陪我说说话也行，可是他让我吃药，我真的好难受，好难受，好像没人爱我了，父母不理解，一味的逼我，他们认为那些东西对我好，却不知道那些我根本不想要，我难过的是你可以救我，却放任我让我自生自灭，我不知道会坚持多久，自杀的念头越来越强烈，可能我哪天真的会离开，太累了，如果可以我也不想得抑郁症，我也想是个正常的人，我很努力的在跟我身边的人求救，可他们觉得这没什么，却不知道我快坚持不住了。叫我不要想太多，我也控制不住自己啊，我要是能控制也不会变成这样，我努力的想自救，他们把我推的越来越远，这种事情还是不要麻烦别人，他们只会觉得你打扰到他们了，没有人知道你会经历什么，人间不值得，下辈子我不要再来了，我对不起我的父母。————2019.10.20,3,6
僵尸新娘,肉体的痛，比精神折磨，温柔多了,5,1
老爹给你护法,生活在一个小城市里，从小心里就有些不正常。记得小时候我吞了半瓶安乃近，导致头晕无力，当时也不敢和家人说就挺下来了。上了初中心里总是压抑。想自杀，喜欢自暴自弃、颓废感觉。到了高中这种想法更严重了。毕竟我也高三了，最近一个月每天都浑浑噩噩，注意力集中不了，经常想自杀准备跳崖。我不知道自己是不是抑郁了，我看了心理医生确诊为中度抑郁。说实话我倒是挺喜欢抑郁了，好像习惯了。可是家人不信这个结果认为没有权威性。今天我来到了北京。明天去北京大学第六医院看。现在我的心情也挺压抑的！如果眼前有安乐死药。我可能会吃。我又回来了！这次真的受不了了！昨天晚上想着结束自己。于是买了把刀，准备gw。现在大拇指试了一下，确实很锋利。大拇指肌腱被我切断了，血贱的满床都是，心里一直忍着，一直哭。最后我家人在外面回来，才把我送进医院检查。昨天晚上也就是是双十一。我做了手术。一切都在恢复中，也劝说那些病友，别想不开。其实生活也还好。一起加油！！,2,4
