艺熙,今年确诊的重度抑郁和重度焦虑，我在去看医生之前虽然已经很清楚自己是这样一个情况，但是最没有想到的是居然到了要住院的地步，当时整个人懵了，眼泪一直在往下掉。我告诉妈妈说我不想住医院，因为我不想放弃和外界接触的机会，哪怕自己有多不想面对，我一直都在试图自救。在药物治疗期间，前男友无数次拦住我试图奔向车流的脚步，但却没能挽留住一颗离开他的心，也是因为我不想再耽误他了，他很好，也很努力，我想我会连累他的。我知道你们都很不喜欢负能量，谁会喜欢呢？所以我告诉自己要开朗要讨人喜欢，才不会孤单。一天一天地睡不着，只有依靠药物才能睡觉中途不醒来，我又开始嗜睡，记性也变得越来越差……慢慢地睡眠质量逐渐改善了，因为药物副作用太大，医生将助睡眠的药物减少了甚至逐渐停药。但是又开始发现我脾气越来越暴躁易怒，多次情绪失控进了医院抢救，因为情绪激动到呼吸困难，心率不齐。前几个月重新诊断为双向情感障碍也就是躁郁症。今年前前后后一直都在服药中度过，也进行了相关的心理干预，但有时候我甚至连说都不想说出来，不想回忆，不想去想一些事情，想把自己隐藏起来，就好像我自己都不知道自己是谁，自己在想什么……但是在最后我还是想感谢那些陪在我身边的人。我是一名约拍模特（在校大学生兼职），我记得有无数次，我拍照的摄影师就说让我笑一下， 然后又说 ，算了别笑了 ，比哭还难看……我拍的照片大多都是情绪、暗黑风格，其实拍照也是自己一个情绪的释放吧，唯有拍照的时候能真正做自己的感觉真的很好。也算是一个分享吧，嗯～,4,3
核桃鲤,我是双相，看了两次《少年的你》第一次去，回来的路上还在高高兴兴地讨论剧情，感叹易烊千玺真的很帅，到了晚上就突然开始毫无征兆地流泪。躺在宿舍的床上，看到关了灯之后的一片黑暗，我觉得我自己快要被黑暗吞噬了，不管怎么样都不能变好，手足无措的那一种。什么也不想做，就躺在床上流眼泪，哭了两个多小时。太难过了，对一切都失去希望，一秒钟都挨不下来，只是一直哭一直哭。第二次去，出来谈及我年少时类似的经历，提到很多遇到这种事情的人最后都没有得到解脱。越讲越激动，最后发展成巨大的难过，愤怒、委屈，在人来人往的大街上崩溃大哭。蹲下来抱住自己的头疯狂撕扯头发，嘴里还在大吼大叫一些宣泄的话。这些事情发生在短短的不到三分钟。明明三分钟之前我还在跟其他人聊一些无关紧要的事情，突然就情绪激动，一股怒火涌上心头，只想发泄出去。这是最近发生的比较大的事情。还有那种，莫名情绪烦躁，到需要砸东西来发泄，重重地把东西砸到地上还有那种，有一口气堵在胸口发不出来，只好一直叹气。我确实因为抑郁症这个标签，享受到了很多人对我额外的关照，它也让我免去了一些面对不愿面对事情的特权。但如果可以，我希望一切的抑郁症都只是大家拿来装样子的借口。,0,0
稚初,我是麻木的，感觉不到身边的人，身边的事，感觉眼前一面黑暗，很茫然，不知道怎么办，呼吸被压抑住，感觉自己快死的时候，轰，我又回来了，然后开始梳理我的脑子，在后面的半个小时左右，谁跟我说话我都听不进去，狂躁，暴怒，甚至出现过几次杀了他的想法，需要冷静，告诉自己没关系，我爱你，我在，一遍又一遍我才能缓下来。而让我发作的原因，很有可能是一件事，一句话，一个眼神，一个动作。,0,0
百川丶,19岁被确诊有中度抑郁症。有人问我抑郁症是什么感觉。其实还好。自己的世界一点一点在褪色，身边的人越来越远。我努力挣扎，看到冷眼和嘲笑，抓到孤独和无助。没有人会明白我的孤立和痛楚。我向外界去求助，周边的人都忙于打理自己虚华而又欢乐的游戏世界。最后也没有人知道我患了抑郁症。可以接受死亡，自杀是有勇气的表现。死亡就如同耳边声一样，一直都在召唤着我。自己的感情变得麻木，没有任何兴趣可言。对明天的到来并不抱有希望，每天活着就和做任务一样，反复而又匮乏。万念俱灰，还要艰难的生活下去。,3,3
杪秋,现在是2020年1月26日11:32，大年初二姥姥姥爷姨妈姨夫和表弟表妹们现在在楼下玩闹也快吃饭了我现在在被窝里就是这么个状态枕头是湿的 药盒是空的 眼前是混的我也不想大过年的去跟这个黑狗打架，但是由不得我。每天一睁眼就是在悬崖边，很不幸今天掉下去了，现在在深渊之中无力地挣扎。我抱着我爸哭了十几分钟，现在躺下了，眼泪还是止不住。我不想活了。我已经把这个世界看的透透的但是我还没有足够的勇气面对它有时候觉得，抑郁症可能就是一个脱壳的过程，看得出来每个人都带着面具，但是自己又无法适应这个大环境，我找不到合适的面具。眼睛哭肿了，心跳快的一匹，头痛，冷呼吸困难，不想说话，一跟人说话就哭。我想变成一个透明人，谁都注意不到我那种，但这却又是一种逃避。我真懦弱。没用啊你!怎么就让抑郁症找上门了呢!抑郁症是不能献血的啊!你今年暑假一定得好起来!空给家人增添负担!爸妈跟着你心情不好!厌恶大人，喜欢小孩。我不想把自己的这种状态让弟弟妹妹察觉出来，不想影响他们，不想让他们变得和我一样。所以我多渴望有个人能救救我，救救我心里那个小女孩儿。但是总要面对恶心的大人们。冠状病毒都没这条黑狗可怕。前段时间的转轻度是我刻意为之的，因为我不想花钱做没用的治疗了，也为了安慰一下爸妈，也为了不让身边的人对我特殊照顾，区别对待。杪秋：你有抑郁或郁抑症吗？先这样吧，我要睡了。2月17日，周一，11:54昨天晚上十点左右就睡了，但是醒的次数特别多，一直在做梦，还都是不好的梦。一群人在追着我要把我抓到一个地方我拼命跑拐角处突然出来一个男人拿着一把小刀特别小，但是特别锋利今天早上九点左右我是这样被惊醒的当然前面还有好多梦比如学校门口有辆大车失火了室友变成一条又丑又可怕的虫子......早睡的质量并没有比晚睡好多少我不敢睡觉了我没有一觉是不做梦的一做梦还都是不好的梦每次醒来心跳都巨快，满身汗我不敢睡觉了。2月25日，晚10:35不知怎么就和朋友聊到“家庭”这个话题这个话题可能是最不应该提起的它又来了我小时候的事好像都不是很美好的吵架，摔东西，无休止的埋怨和诋毁大人的世界都这样吗?好像并不是的只是我碰巧不幸而已爸爸朝妈妈摔东西我搂着被吓哭的弟弟我也被吓到了我也想哭但是不我能啊我得哄弟弟我哪还敢哭算了吧不幸福的婚姻为什么还强撑着我真的可以理解的，你们离婚吧。不用因为我再假装了不用什么都是为了我求求你们为自己而活吧家庭这个话题，谈一次哭一次，我要是能控制住，我就不用吃那一大推讨厌的小药片了。你家庭那么幸福，你怎么可能理解。但还是谢谢你做我朋友也求你千万不要离开拜托了。2月26日，23:24他说我qq个性签名太晦气了“熬下去了是幸运，熬不下去是幸福”我也知道很负能量现在改成了“温柔而坚定，辛苦了。”你永远不知道一个温柔的人经历了多少。太累了。一想到大家终归都要死，我就原谅了所有人,3,4
Joooo-o,顺便自己记录一下。20191026  就像心里一直有个内核，在某个时候不知道什么原因就让他慢慢慢慢散发出灰暗物质，直到自己受不了崩溃。明明白天好好的，一到傍晚不知道为什么心情越来越差。和家人聚会吃晚饭时，大家有说有笑，我也假装微笑，吃完晚饭，我妈走在前面，我走在后面打着雨伞默默哭了一路，怕我妈察觉还时不时回答她的话。回到家里洗澡时，终于一个人独处了哭了很久。出来怕我妈发现眼睛肿了，一直低着头不敢看她。现在躺在床上，心情好点了，那些散发出来的灰暗物质好像又回去了。但我很怕下次它又出现。今天回家途中拍了一些照片让我一瞬间觉得自己活得很没有希望这几天的重庆一直在下雨，到处都是灰蒙蒙一片20191027  今天白天心情还可以，下午逛街的时候妈妈紧紧拉着我的手我感觉很安心。吃了晚饭，回到房间，看看知乎，心情又变了。我多希望回到下午的时间，一直延长下去。啊，好烦啊，我一点也不想吃药，不知道为什么有一种不吃药也能好的执拗，可能是小时候偷偷扔了很多次感冒胶囊也健康长大了。查了查，这次不吃药好像真不行。现在的我觉得 及时行乐 没什么错，说我没有长远眼光也好，似乎他们有一种我能活很久的自信。这一年的闪光点只能以个数来算，庆幸今天下午有一个，希望早日汇成波光粼粼的湖面。20191028  今天重庆出太阳了，坐上返校的车上突然觉得心情明亮了不少。说也奇怪，以前的我不太喜欢有阳光的晴天，难道它还有逆转喜好的功能？所以给朋友一个建议，没事找找自己以前讨厌的东西，没准它能让心情愉快一点。在车上我一直坐得近乎于笔直，生怕错过好风景，毕竟对于阴雨好几天的重庆来说，有阳光的日子弥足珍贵。突然想起高中同学，一个男生，宁愿牺牲午休，做作业的时间也要回宿舍洗衣服，与我坐得笔直想比，他对太阳更加尊重。我很喜欢这个地方，觉得连绵起伏的群山像一首古诗，几乎只要一经过这个地方我就要拍照。今天刚坐上车我就想着一定要拍它，没想到经过时却因为旁边的大货车超车没能好好拍下来，一瞬间我就叹了口气，惹得旁边大叔一个劲儿向我这边张望。真是计划不如变化快，变化不如变心快（我当然说的是心情下辈子做什么好呢？我想过做一棵香樟树，不过那也太单调了点；做会飞的麻雀吧，我这么懒也不愿意到处飞；做桂花吧，可那还得让人摘下来包在汤圆里呢。嗯……我想通了，那就做妈妈爱用的护手霜。20191030  同租的学妹又未经许可带了一群人回来吃火锅。以前的我应该会和风细雨地劝她，这次实在让我痛苦了一晚上，我给她发了微信，语气略强硬。听蒋勋讲书，听到林觉民，不知道为什么一直流泪，莫名其妙哭，哭到喘不过气。我觉得我已经很痛苦了，为什么一次次违反规矩来烦我，那些声音能不能离我远一点啊。搬出来就是为了远离嘈杂，反而让我觉得烦躁。我真的很希望我的家人能够快乐，但我带给他们的永远是反面。我该怎么做？我这两天只正经吃了一顿饭。吃饭为什么变得这么麻烦，下定决心好好吃饭时，我又只吃了两口，每次离开的时候都会留大半碗米饭。真的很浪费！明天又要去医院，这该死的抑郁症！公众号今天更新了一篇，又是狗屁不通的一篇，但我希望坚持下去。熬夜熬夜，熬夜就是一切的根源。从十点哭到了十一点，不知道明天眼睛会不会肿，我只希望今晚不要失眠。睡觉这件事对我来说都很痛苦了，昨晚梦见我的家人拿着一把剑要刺我，还有压着我的头来锤打我。我真的很矛盾，我既不想要外界的任何声音烦我，所以我出门几乎都戴着耳机，又在每晚睡觉的时候放着蒋勋老师说书的声音，没有他的声音，睡觉这件事就会变得恐怖。我真的好喜欢他啊。20191031  艾略特说 April is the cruellest month，我觉得今年的每一个月都残忍，我的黑眼圈和痘痘可以为我作证。刚刚写了一大堆结果没保存上，唉，那就这样吧。合租真是烦死了。气死，眼睛又肿了，还附带两个眼袋和黑眼圈。今天没去医院，本来都走到挂号处，我又一转身溜了，我真怂。不，感情才是一切的根源。饭桌上，一个大我一两岁的姐姐很会喝酒，大家特别喜欢她，说她能力特别强，以后肯定成大器。我滴酒都不想喝，那我肯定成不了大器。（这样的日子还会好吗最近发现身体开始出毛病了，先是不断的恶心，然后指甲也出现白点，我是不是要生病了。不，我已经病了啊。（松了口气今天哭了吗，哭了，打卡。20191101  又要睡觉了，睡觉这件事可真烦！我什么事情都会搞砸，大概不要在我身上指望能做成功什么事了。我活着与不活只有一个差别就是我的家人会伤心，那既然这样，那我活着就应该拼尽全力啊。今天突然觉得，我不需要好起来，也不需要快乐，就这样一直下去也可以的，至少祸害不到任何人嘛。说实话，我真的已经忘了内心满足，开开心心是什么感觉了。人好可怕，那些有多面性格的人更可怕。那些说着只相信眼前的他，不在乎从前的他的女孩们好可怜。人与人相遇起作用的有且只有运气。女生男生们一定要擦亮眼睛才行！猪都特立独行了，我还不如猪呢。昨天晚上做的梦：租房的妹妹又违反约定来气我，果然早上醒来就很生气。虚伪的人太多。那些从来自己做主的人说，我父母不同意我们在一起；那些基本就没回过家的人说，为了孩子我不会离婚。前者有够无耻，后者不见得光荣。他们都跟我一样病得不轻。如果分手能让一个人身心更加健康，那最好还是分开。我喜欢短发就剪，喜欢长发就留，这是我的自由，你的嘲讽让我觉得忧郁不堪。当得知你是那样一种人，为你的才华感到可惜，可是世界上那么些有才的人品格不一定好，突然就觉得这个大环境可怕得很。今天穿了厚衣服结果又出了大太阳。学校里的猫猫好可怜，每次都看见在翻垃圾堆找吃的。还好很多人都爱她们，给了好多的食物。画家还是穷光蛋的时候对妻子说，我对富贵名利没有追求，只想好好画画。富家千金出身的妻子相信了，心里既满足又感动，他果然跟我想象的一样。画家卖出几幅画出名后，名和利都有了，结局是，他当然忘了曾经说过的话。人就是这样，当他说着不在乎自己从小就没怎么有的东西，他的话就像太阳下的一滩水一样。两个人在一起其实真是两个家庭的事（以前的我当然不这么想）但我说的不是实体，而且性格。如果生活在父母感情不好，甚至经常吵架的家庭，即使他平时说着“我才不会这么做呢”，特殊情况下也会受到影响。“就连滑溜溜的魔芋，浸在汤汁里也会入味，被家长抚养长大的你们又怎么可能不受家长影响？晒在外面的衣物，不可能完全不受户外空气的影响，对吧？”体贴也有真假。真体贴为的是让你觉得舒适，假体贴为的是他自己能从你这里获得更多的东西。头发又掉了几根，每次洗头发就掉，剪了短发也没用！改变的只是长度。20191102  我还期望别人能够真正了解我，这个世界没有一个人能真正了解另一个人。寻求别人了解的过程是痛苦和漫长的。病哪有那么可怕，可怕的只有自己过于敏感的心。我不想呆在这个出租屋了，我想回家！想回到老家去看看，虽然破旧。我喜欢大山，喜欢春游，喜欢大自然，她们比城市里的一切一切好太多了。我很庆幸小时候寒暑假回到老家帮忙割种粮食，拥有这样的回忆真的很幸福。到某种意义上又是不幸的，我再喜欢也不能回到那个时候。看吧，世界真的是守恒的。我很喜欢重庆，他们很有人情味，阿姨们总是亲切地叫我们“乖乖”。我故意开玩笑跟奶奶说，我要去纹身了。奶奶没有责怪，只是心疼地说，那得多疼啊。除了家人没人能忍受现在的我了吧，她们真的很好。我很烦，我看见什么都不开心，听见室友制造杂音，我想冲过去骂她。看见一个小孩踢一只流浪猫猫，我甚至想踢他一脚。什么时候我也变成这个鬼样子了？我就是垃圾制造者。你说的每一句话我都觉得难过，每一个表情都能压垮我～想开点啦，成熟点啦，做点有意义的事啦，别瞎想啦，事情有这么简单就太好了！我不配他的喜欢，他怎么能喜欢我呢，他在高中时说我脾气犟得牛都拉不回，这样他怎么能喜欢我呢，我曾经也说了很多刻薄的话给他，可是为什么还是要对我好，想跟他当面说对不起。我说，我得学点东西进脑子，不然我就真的废了。可是医生说，先别管学习的事了，好好放轻松一点吧。我觉得他说的有一点道理。你说，怎么就那么喜欢哭，可是我从来也没对外人哭过。不合适当然要分开，谁也没有义务一直喜欢你，这个世界的规律本就是这样！她们说，年轻时就应该多谈恋爱，这样才能遇到最后的人。也许真的是这样吧。每个人在成长过程中都会变的，就像一个转动的齿轮，我们应该找一个能契合每个齿轮的人啊！要死要活真不是我的风格！想到什么就写什么。可是还是没有想到自己也会有这么一天呐。GO TO HELL！！,3,18
蛋蛋,我直接吞了一盒劳拉,3,5
惜子,我只想说其实不用劝那些抑郁症想死的人不要死，活着，每个人都有他承受的那些苦痛，有的时候，没有站在那个角度，是无法体会到那些哭和痛的 ，况且每个人的承受能力又不一样，可能在你看来很微小的事情，但是却成为他的最后一根稻草人生很美好，但是对少数人来说很美好，对大多数人来说是伴随着苦和乐的，有些人生来就在罗马，而你穷尽一辈子努力奋斗也不一定能到罗马这个社会是适者生存，残酷而明显的法则，能力和野心不匹配的情况下，很容易做出过激的行为，也不是所有的付出都会有回报的，就好像曾经有人说过的那句话一样，我心地善良，坐公交车会为老人和小孩让座，平时与人相处也是小心翼翼的，不伤害到别人，但是为什么世界还是赋予我如此多的苦难和折磨要我选的话，我宁愿不来这世上一遭，因为快乐太少，折磨太多，有时候宁愿自己是没有意识的一阵风，不会思考，也不需要跟人攀比，更不需要违背自己的心去做不愿意做的事情我不怕有人喷我，如果那个人真的是想死的话，说明已经承受到极致了，留下来也只会是痛苦，比快乐多,0,0
咚了个咚,反正挺疼的,0,0
JAzmin,不要逃避自我，这里不是想告诉你抑郁症是多么难受，而是告诉你应该怎么做!你很快乐，你可以的，迈出第一步吧!。。。。。分界线。。。。。嗨，我觉得一部分是人格原因，友善型人格做的怪。另外就是你自己身体有点虚，可以吃中药调理，还有就是积极一点的心态。多看书，把自己注意力转移；不要再封闭的房间呆着。 我也是这样的人格，这样的人格比较偏向悲观，身体有点虚的时候，在封闭的地方的时候就会随便乱想。解决方法，多出去散散步，散心，找个人聊天虽然不能帮多大的忙，因为连自己都转牛角尖的时候，会比较压抑。你可能会有这么想过，这个世界上没有人理解你，怎么我就会变成这样呢！可是，你自己就是一个个体啊，不是和别人合体，别人是不会懂你的，所以学会着自己给自己证明价值，寻觅自己喜欢的事情，不是逼着做。需要自己向上，发自内心的接受相信迈出第一步十分困难，但是万事都有先开头，才会迎来美好的太阳。祝愿你迈出第一步，我在等着你蜕变。不要守株待兔，等到美好发生，而是自己去创造的哦我也是这样的，分手了突然自己的情绪问题犯了胃病，经过中药调理后三个月明显好转。其中也有一个重要的条件，主动而且有个关心你的人，帮助你迈出那一步虽然我也会想着在别人面前证明自己来寻找价值，但是十分刻意导致觉得很累。解决方法是，寻找向上积极的事情做，比如书中寻觅黄金屋，为自己事业奋斗寻找方法；学习画画；学习吉他。关于这个友善型人格哦，是个很有艺术天分的人格哦另外，给你推荐我在看的一本书吧《见识:商业的本质和人生的智慧》，像序言说的，人命其实是一个被定死的框，但是运气是可以帮助你过得好一点。然后影响这个“运”的是你做事的方式以及思维方式。来看一下吧，不用再在别人面前证明自己，学会享受孤独，寻找人生的真谛和自己的开心吧!你看看天上，虽然乌云密布，但是太阳其实一直都在的啊，把它找回来吧[红心][红心][红心][红心][红心],0,0
甜酸,我每天都想着过正常人的生活，有喜怒哀乐，但始终看向未来！我每天害怕太阳升起，因为意味着新的一天不知何时抑郁悄然爬上心头！我害怕凌晨半夜的醒来，万物静寂的时候，我想到的只有了结生命！我害怕接触亲友，因为担心我的悲伤的情绪会感染别人！我害怕听到安慰，其实死亡并没有想象中可怕，活着比死亡可怕得多！我害怕回想事情，脑子就像僵硬化的过程，很多东西已经逐渐忘却，而新的事物与东西记不住！我害怕失去一切，但我正在逐渐失去一切！,2,2
mhgtgt,心里说不上来的的痛苦和心脏的剧痛……,2,0
巴拉巴拉,我正坐在教室认真听课。忽然，一阵隐形的耳光把我扇醒，我从现实生活中猛的被拽出来。这时候我清楚地知道，它又来了。我感觉到心脏周围弥漫着一层浓厚的酸楚，四肢麻木，我被一股强大的力量一点点拉近深水中，周遭的空气变得压抑而困溺，我逐渐感到呼吸紧促又困难，心跳一会儿很快一会儿很慢。我的视线里的一切变成灰色，所有正在做的事情都变得毫无意义，整个世界被合成一句话反复总结给我：你去死吧。痛苦从心脏向全身蔓延开来。我无处可逃，只能在这沼泽地试图挣扎，我默默起身，镇定地向老师报告说去厕所，然后偷偷地，把美工刀塞进口袋。钻进隔间里，自残，看血水流出手臂，渴望痛感渐渐麻痹不可控的悲伤。我在隔间里呆了半小时。班级一个小姑娘来了，在洗手间门口说：“xxx，你怎么还没好？老师让我来看看你，你没事吧。”“哦，谢谢你啊。我没事，生理期，肚子痛。”麻痹失败，就像手术失败一样，我只能任凭病魔无情缠身，任凭它夺走我的灵魂，使自己变成不可控的躯体。硬着头皮回到教室。摊开的书本上曾经熟悉的数学公式像零散的元素，各自互不想干地在空气中漂浮。我抬头看向绘声绘色讲课的老师，那情景在我视野里持续很久都是一张一动不动的照片。世界被定格住了，如果说平时的我思维如潮水，这时候思维就被坚固的金刚石死死阻隔，脑海里仅仅能搜索到的人只有一个字：死。奇怪的是，当我接收到脑海深处发出的死亡邀请时，思维仿佛又恢复了活跃：【割腕死。可是找不到动脉，从来割不对位置。即使割深了，血液也很快凝固…跳楼死。可是我好害怕失重，过山车的失重都接受无能。而且跳楼死的死相太残忍了，还是给家人留个体面的样子吧。如果没死怎么办，缺胳膊少腿脑震荡的又增加家人负担…跳河/湖死。溺水是一个很痛苦的过程，据说溺水时人的本能是会挣扎自救的…吞药死。可是我手上的药量远远不及资料上的致死量啊，要是没死，又要花钱洗胃………】忽然，我在视野与想象的交界处看见了一团熊熊烈火，我义无反顾地走了进去。我感到四肢发烫而疼痛难忍，可是我依然保持分寸不动。大火越烧越烈，仿佛要吞噬我全身的每一寸细胞。我把自己抛在这里…下课铃声响起，我又一次被拽回现实，引入眼帘的是教室四周雪白又坚硬的墙。终于，我也义无反顾地向墙壁走去…跑去…狂奔去……到达终点前一秒，我猛的停下了，看了看班级同学聚集而来的好奇目光，我微微一笑。“我演的像吧？”…,2,2
April,重度抑郁症发作的时候，那就是人间地狱。灵魂活着就下了地狱。,1,1
至此流年各天涯,我真的讨厌新买的修眉刀，一点也不痛，血留下来好凉好凉，可我的痛苦怎么没有随着溜走呢,2,1
