囍囍,我不想再求救了，我想放开握在手中防止我坠入万丈深渊的绳索，我混乱迷失了，为什么白天就要有阳光就要让我看到世间万物，我不想啊我是多余的，不管在哪里我都是，没有我大家的生活不会受到一点影响，反而有了我，倒是一种累赘，一种负担，对不起我的身体要爆炸了，不止是头，全身上下，就像被会动的海胆包围着，疼吗，不疼，但是又很疼，烦吗，其实我也很平静，但是我也躁动的停不下来，我好累我只是想追求一个平静的世界我不想再每天活在被眼泪内疚感自责感包围着的世界上，我不想每天需要靠药物才能使我入眠，我不想每天哭到喘不上气需要捶着胸才可以正常呼吸，我不想感受着浑身的疼痛我确无能为力我想做一个甜美的梦，看看彩色的世界，我想正常得喝水，而不是努力得拿起水壶却洒满一桌子，看着流动的特疼呆滞着，我想跟你聊聊天，而不是说着说着就被泪水填满了眼眶，抢走你的光明，带给你黑暗，我不想污染了你的纯净，这些再正常不过的事情，对于我来说都好难，真的好难…我努力的拯救自己，按时吃药，忍受着药物副作用的侵蚀，按时吃饭，哪怕吃完以后转身就吐出来，摸着绞痛的胃，嘲笑着自己的脆弱，按时休息，哪怕我只能靠药物才能带给我平静，看着模糊晃动的世界看着曾经喜爱的食物平静的忍受着每日每夜的昏沉，我真的太累了我不想再努力了，我的脑子已经持续不间断的爆炸了，耳鸣的声音也停不下来，想吵架的力气都快没有了，心脏每一下跳动都感是我努力要做的事情当我有意识的时候，我会平静的把房间里得尖锐的物品都拿出去，但是心底总有一个声音在告诉我，嘿，你不想让自己冷静下来吗？不想拯救自己了吗？不想感受肾上腺上升带给你的美好吗？好的，他赢了我会藏起来一把刀，夜晚他的时间到了，他变成了我身体的主人，疯狂的撕咬着我的手臂，拉扯我的头发，他享受着血液从我身体里流出来的优美场面，他享受着呢终于当它享受体验完这一场盛宴，心满意足的走了…但是，突然他回过头来，笑嘻嘻的看着我说，看你还能坚持多久，美好的世界你不去，非要在这里挣扎着受折磨，哈哈哈大傻子我，回归了，我痛哭，我拥抱我自己，我轻轻的安抚着，感受着刚刚感受不到的疼痛，看着手间得发丝看着红肿的手臂还在滴血的指尖，走到镜子前，我好像不认识镜子里这个疯子一样的东西了新的伤口有点疼，旧的还很痒，手臂就快没有多余的地方供他玩耍了，像斯德哥尔摩综合症一样，我突然觉得他是为了帮助我，关心我，为我好，虽然方法不伦不类，他不舍得让我在这个黑暗的人世间，他为了告诉我，这些小伤小痛算什么，疼吗？以后还有更疼的呢。但是我爱我也恨，明明是他想要我的命，却要借我的手，要我亲自结束我自己，他却不沾一滴血，还告诉我这才是美好。我不想每天在心里喊救救我吧，求求你救救我，我还没有闻到今年的花香现在我只想大声的喊出来，不仅仅是在心底，我想告诉这个我放弃了的世界，求求你，让我走吧，救救我，我真的坚持不住了，我害怕了，我累了，我不坚强，放过我。我可恶，让我去地狱受尽无边的酷刑，让我贡献我的大脑供你们踩踏揉捏吞噬，而我，仅仅就像行尸走肉一般受着最残忍永恒的折磨就好了。我放弃了，我松开了手中的绳索，下垂在无边无际的黑暗里，黑暗的罡风凌迟着我的身体，血液也在黑暗中挥发，远离那一点点光明，恐惧无助将我包围，肉骨分离血浆混杂与黑暗彻底交融，是我最终的归宿。但是祝还能闻到花香感受到快乐的你，永远被光明笼罩感受美好。❤️,1,6
海棠,我看起来一切如常，但我尝试百千次，都再也回不去了。一切都不重要，此刻我可以笑，但不影响我觉得世界毫无留恋。活着也行，下一秒死了也行。我现在还能懒洋洋呆着，也可能有天突然不想呆了，就站起来拍拍灰走掉。不想去解释和诉说，不渴望被理解，喜欢被陪伴，然而同时也会觉得烦。我和世界隔着两层透明玻璃，要么你们是假的，要么我是假的。,1,0
Grox,每年，在中国，因白血病死亡：4万人因抑郁症死亡：14万人,1,0
girl,我现已经巨烦自己现在的状态，晚上洗完澡拿起手机就在哪胡思乱想，想那些满是负能量的东西。现在的状态已经不敢在看那些负能量的书和电影。每天祈祷着这tm敢死的疫情赶紧过去，我想开学，我想迟到，我想坐在最后一排吃东西跟班里的男生组团开黑。如果有人包养我，我真想一辈子呆在学校看我的电影，打我的游戏，打牌摇骰喝酒。这该死的疫情不仅让刚出社会的年轻人交不起房租，还让我们整天躺着床上思考人生的意义。我现在终于明白为什么那么多人家里好好的，生活好好的为什么就偏偏得抑郁症了。还不是因为睡不着啊！！！人在睡不着的时候最容易胡思乱想了。前段时间想那些东西想到天天做噩梦大半夜想哭。我现在学聪明了，想那些没用的不如想想。世界上到底有没有外星人？为什么12星座能那么准？为什么玛雅人的预言只有一个没实现？人到底有没有前世？霍金说的世界末日到底是不是真的？天又要亮了，我不敢闭上眼睛，不敢放下手机。,1,9
多喝热水,2020.1.17去了医院   被确诊   医生给我开了药真的很难受。。我怎么也想不到 ……我不敢接受这个事实。从六年级的那段时间，就是长胖了然后就经常被嘲笑……加上上了初中学习压力大成绩也不好。。渐渐的变了你知道吗?当初我以为我这样子是很正常的。我甚至以为身边的同学都是这样的……当那种情绪降临，我吃不下饭对什么东西都没了食欲  连我最爱的零食也是。很难受很想死。在心里一遍一遍的想我要怎样去死?很难受很想哭，有时候连续好几天这样，后面就哭都哭不出来了。非常难受。真的我不想再这样过了。我想找人倾诉。但是他们都是不理解我亦或是没有什么效果。。渐渐的我也觉得经常传播负能量也不是很好……我也感觉很惭愧。我很敏感。别人的一句话。我会惦记好久好久。比如晚自习的时候，同学开玩笑说我好丑好胖。就管我表面嬉戏打闹，但是晚上我会哭很久，很难受，那句话在我脑海里一遍一遍的重复。甚至在以后的日子无意中又想起了这句话也会突然难受无比。我真的好累，这么久了我都是自己一个人扛过来的……很累……常常在想活着的意义是什么。我觉得我还很小…………为什么会这样。好痛苦。我不想这样。我也好想体验…感受一下正常人的生活。太痛苦了。很难受很难受……。我想平平淡淡的过完这一生,1,0
孙晴,"抑郁症当然可怕了。很多人回答说，因为这很痛苦，痛苦的想死。因为抑郁失去生命的人的确让人惋惜，但是抑郁症让人感到可怕的却不仅仅只是死亡。他的可怕之处就在于，有很多人就因为抑郁症在最美好的年纪没办法上学，没办法工作，只能待在家里。在本该学习工作恋爱的时候，他的所思所想作做都和抑郁纠缠在一起，就这样慢慢的坠入深渊。如果得了胃炎，癌症，家人包括自己都会积极就医。但是得了抑郁症，其实还包括别的一些心理疾病（精神分裂，焦虑症，进食障碍，躯体化等）很多时候家人会认为你在作，要你坚强。更可怕的是还有些当事人也会认为“我一定要坚强”。“我一定要靠自己来自救”不是说自救不对。但是当自救了1,2年，还没有办法改善状况，没有办法去上学，没有办法去上班。那么，是否应该给家人一个机会，给自己一个机会。我一个同学的孩子，10岁的时候因为抑郁症而休学，父母说他压力大，让他在家里调整。这一年很轻松，调整的很好，但是当第2年回学校的时候，只坚持着一个月。在接下去的5年时间，父母亲和孩子就进行“上学不上学”的斗争。6年过去了，孩子还待在家里，家人也不再要求TA去上学，但是孩子却变得越来越绝望。这才是抑郁症最可怕的地方，让你慢慢陷入深渊，再也爬不上来。",1,0
随和,我初三时曾有一段时间有轻度抑郁我曾经是个挺乐观的人，考试考砸了，一节课后就继续该玩玩，该闹闹，但那天不一样我记得发病的原因：我的英语课文背不会，导致挨老师骂，有正好我之前考试失利所以开始抑郁那一段时间，我过得浑浑噩噩，早上没精神，很疲惫，看着镜子中的自己就想着去死，在家脾气很大，在学校也不会很开心早上我与平时不同，我坐在教室里就是沉默，脸上没一点微笑，整个人显得非常丧，我同桌当时还关心的问我怎么了，我挤出一个微笑说没事平时下课会找好朋友玩，但那段时间，我也就过去坐在她旁边，什么都不说，偶尔说几句话敷衍一下晚上回到家，就把自己关在房间里，父母一进来就开始发火，想学习，但没有拿起笔的动力，只有抱着手机，无聊的刷些东西，有一天晚上真的没有事做，于是那小刀划自己手背，看到血从伤口里渗出也没什么反应，就是疼，第二天到学校，用校服袖子盖住伤痕，被一同学发现，一开始她以为是我自己拿红笔画的，结果她“偷袭我”摸到了，然后才知道是真的，我也没什么反应晚上熬到好晚，真的就只是玩手机，想学习也学不下去但我现在好多了，变回原来那个我，生活很开心幸福（这算走出来了吧）不想自残，心态也好很多，现在回想起来也挺惨的，一个轻微抑郁把我变成那样，确实挺可怕的,1,3
良人,有多可怕呢。我说一件自己的真事叭。我是一个很普通很普通的学生。性格很开朗，很外向。不知道哪段时间开始，我好像变得阴沉沉的了。睡眠不好。但没有影响到学业。正常上学的某一天，我还是很开心，专心致志的听着数学课。就一刹那，我突然感觉喘不上气，浑身无力并且酸痛，眼前变得混黑。脑子里面只想一件事情，我想死。真的是，忽然一下，我还在笑着，突然变得阴沉沉沉，一点希望都没有了。只想死。等我缓过来。一天都过去了。我之前怀疑过自己会不会有一些心理疾病。这件事情以后我真的把自己吓到了。有人说，抑郁症就是想死。就是怎样怎样。我不知道。但我可能也有强烈的求生意识。一周过后，我跟家长说了，我强烈要求去精神医院，我不想再经历自我不能控制的对死亡的渴望。他带我去精神医院。结果比抑郁症还糟糕。双向障碍 混杂着重度抑郁症。,1,2
柴柴,精神上的癌症。谁也不知道我能活多久。生死于手，最近已经把自己打出淤青。却得不到父母安慰,1,1
引咎,窒息般可怕一点点小事情就能让你崩溃 一天崩溃好几次 跪在地上痛哭 真的控制不了自己 也没办法止住眼泪 每天哭每天哭 莫名其妙的那种 好像 掉进了一个深井里 里面又湿又黑 周遭的空气弥漫着尸臭味 你很害怕 你想出去 可你出不去 你想尝试大叫 大声呼救 可你发不出一点声音 你只能在里面不停挣扎哭泣 没有人提着灯来找你 ,1,2
涂佛,像是泡在水里一段时间了看上去像是爱水的小孩你清楚自己死了 别人还不知道呼救吗 可是一个死去的人 怎么救呢算了吧 就日升日落的泡着泡到哪一天胀开 变成细细碎碎的肉体痛苦就没有那么集中了谢谢,1,0
回首往事,众生皆苦，谁都有抑郁的理由。抑郁症真的很痛苦，但是大多数人还是在痛苦中勉励自己，继续前行。加油，别放弃能做普通人的每一个机会。生活其实没那么难。,1,0
三土先生,自己跟自己聊天吧，好久好久没有跟自己说说话了，希望不要吓到大家。,1,1
多的云朵儿,平稳期会觉得自己很多事情记不清楚，很模糊。处在一种混沌的状态里呢。爆发期哈哈哈哈哈什么傻逼事都能干出来，说哭哭说笑笑,1,0
Stella Ho,别人也许会认为我们在无病呻吟，或小题大做。就算别人可以体会到我们的痛苦，但也爱莫能助。,1,0
阿旭哟嘿,谁能救救我 给我一个安慰就好我真的撑不住 我好难受我都不知道自己为什么会哭 11.23 我的生活太糟糕了 我只是每天在欺骗自己“你很开心”活下去，但我发现这也终究是在骗自己，但真相如何，事实还是狠狠地告诉了我。其实我已经有了喜欢的人，但慢慢地我发现，我不敢去爱他了。这些日子，再也没好好吃过饭，没好好睡过觉，每天都活在厌恶自己中，睡眠糟糕，总被惊醒。醒来便是心慌，恶心，哭泣。什么时候结束这样的日子，我好疲惫哦。,1,3
匿名用户,感觉自己活不过2020的春天连度过这个春节都很困难凌晨3点半，我爬上阳台一个人站了很久，还是没有勇气跳下去。我是一个很懦弱的人，小时候被两个同龄亲戚接连猥亵，不敢告诉父母。长大了经历校园冷暴力，两次差点被围殴，同年级的男生发短信说找人轮奸我，第二天他们也真的叫了人来，我度过了胆战心惊的下午，挤在人潮里偷偷跑掉了。这次我告诉了爸妈，可是他们在短暂的惊讶后又陷入了忙碌中。我休学了，我害怕再留下一个阴影。他们每天都在尝试劝我去学校。哪怕我对那个地方有多恐惧。我知道妈妈很爱我，可她至今还认为把被猥亵的事情闹大是我的错。我告诉她几年前同样的事情发生在一个比我更小的女孩身上，她的父母选择了曝光这件事，最后罪犯被拘留，大家都在夸这对父母懂得保护自己的女儿。她说：“这样闹得名声好听吗？”我猜我父母也是希望我去死的。比如我在阳台上站了这么久，哭了这么久，他们在房间听见了却不为所动。我猜他们在等我自己跳下去。毕竟他们还有两个孩子，还有退路，我能带给他们的只是烦躁和药费。可是我真的不敢。我想到摔在水泥地上时剧烈的疼痛，全身血肉模糊会有多难受，我太胆小了。我连站在马路上等待意外的勇气都没有。如果世上有鬼神，我希望可以把我的死期提前到今天。,10,16
四两拨半斤,        我觉的最可怕的是，很多无知的人动不动就说自己心情不好得了抑郁症，导致大众对于抑郁症的看法竟然是这个人矫情，作，阴暗！然后动不动就劝人大度，你不知道郭老师说过，那动不动就劝你大度的人，打雷的时候离他远点。,1,0
结茧,暂时不是抑郁症，是别的。大概就是我知道要做什么，但我不做。我知道自己懒惰愚蠢又坏又烂，但不想去改变。我知道我可能错了，但不在乎，干脆利落承认然后就然后呢？我知道是我的不对，但我就是要气你。可能会产生误会，但不去解释。如果有哪个我在乎的人叫我滚去死我一定会去，虽然说并没有。如果旁人叫我去死想的是直接杀掉它。,1,0
一只猪,那种反反复复真的好讨厌，有时候我好像都觉得自己要好了，觉得自己会跟正常人一样了。然后在某个瞬间，突然崩溃，那种崩溃让你从内心深处觉得“完了，不可能，我不可能好的，快乐很难，一切都很难”,1,2
蔚蓝,我爱世上的人，但是我不爱这个世界。我在等，过完年。,1,1
彭地雷,抑郁症让我从此没有了妈妈，你说多可怕...,1,1
储小璇爱吃肉,不过是这个世界里找不到一个爱自己的人，哪怕是患者自己。我想，一个人如果能得到足够的爱，可能就不会有抑郁症了吧！,1,0
默默磨墨,我也不知道我为什么要难过，甚至因为自己的难过打扰到别人还有负罪感，其实我也很委屈。,1,0
大大小小的李艾,活着是折磨    死了是解脱   ,1,1
匿名用户,我有时候很奇怪我为什么没有抑郁。婚姻破裂，单亲妈妈，失业之后做小生意也没赚上什么钱。没车没房没钱还有一个初中生要养活，有时候心累的蹲在厕所揪自己的头发，这些事情居然没有打倒我。最近我深究原因，我发现人还是要有点兴趣爱好，我不爱泡吧，不爱抖音，不爱网聊，这么多年唯一坚持的爱好就是看网络小说，所有拍成电视剧的小说我大概早都看过了，我发现我看小说的时候什么破事都不想，看的眼睛睁不开倒头就睡。要是正常时间上床睡觉，就会从头到尾捋那些烦心事，越捋越心烦，越捋越睡不着。有些人会鄙视看网络言情小说的人，有个叫周冲的公众号还写文鄙视，我想说，存在即合理，只要不过度痴迷，过度代入，我估计我到老都会喜欢这种快餐文学。,8,2
匿名用户,我不知道问这个问题的人什么心态，这种问题也能过审？就像你感冒发烧生病一样，也是一种病而已。怎么感冒发烧也要到某乎求个安慰？看着这么多人鼓励你，还有少部分人被迫安慰你，你很开心。你感冒的室友不能吹冷风，那么就像，你YY症的室友不能受刺激一样，生理现象而已。别戴着有色眼镜看他们，别干涉他们的生活，别在这里装模作样的问，别揭开人家的疤。这就是对人家最大的保护。,8,0
阿雯,抑郁症让我对活着的欲望寥寥无几，对任何事情都没有兴趣，没有动力。无聊，烦躁，焦虑，痛苦，空虚，人类的各种负性情绪都被抑郁症患者最大化的体验着，经历着；一天中的每时每刻，每秒每份都是煎熬，煎熬的生活着。除了心理上无形的折磨，躯体化的症状如胸口发闷，心跳加速，呼吸困难，尿频尿急，手脚颤抖。不同的患者经历着不同的躯体化症状。总而言之，我们的世界是灰暗的，悲观的，一无是处的，就乌漆嘛黑的度日，熬过一天是一天。,0,0
匿名用户,很少能高兴起来，即使高兴，也未必是真的开心。很多人很多事都能把我惹得崩溃，在外面假装很坚强的样子，装作无所谓，其实心里快要疯掉了。我在我妈面前装作一副好好的样子，她明知道我有精神障碍，去医院确诊过，也找过心理辅导师，可她就是不能见我一点好，我只要稍微表现得正常一点，她就开始疯狂要求我。我的心理辅导师曾经跟我探讨过关于我的病情，后面一系列的人际交往障碍甚至在学校遭受学校暴力却不敢反抗都跟我的原生家庭有密不可分的关系，尤其是我妈带给我的伤害很大。她活的并不成功，却总想掌控我，我不想她毁掉我，做过反抗，但是无效。我现在不知道自己在语无伦次的说一些什么东西，生活太艰难了。今天 2019.12.30 我问了我妈一句，快要过年了，现在有没有人买年货？ 我妈就开始疯狂挑刺，你干嘛？你看看你，天天吃，给你买了吃的，没等过年就叫你吃完了，人都是来吃苦的，你说说你，以后要是上班了怎么办……真的，我就只说了开头那一句话。我妈就跟我叨叨出一大串。活着好累啊，你为什么不能对我宽容一点呢？算了，还是让我去死吧。回到房间把东西都砸了，可能过了一个多小时，心情稍微平复点，从地上捡了几块墨水瓶的碎玻璃，拿纸擦干净，割腕吧。血流了不少，可是都是小划痕，怎么就划不开皮肉和血管呢？,4,5
匿名用户,曾经身体很好 因为抑郁症得了神经官能症 现在膝盖和心脏会在情绪积攒到极限的时候疼到让我想一了百了印象最深的是高考前 那段时间已经是重度抑郁的状态了 有一次出去陪妈妈买菜 一边走心脏从被针扎的痛转变成窒息感和呼吸困难 同时心脏疼到像是随时要裂开 被我妈扛着回到家躺在床上喘息间 我在用手机给自己写遗书经常头疼 严重的时候会直接晕倒 高二的时候曾经一个人在路上骑自行车突然晕倒 后面被好心人救起来高考过后每天都睡十个小时 但是还是会感到疲惫没告诉过爸妈得了抑郁症 去看心理医生的钱是从自己的压岁钱里拿的 包括后面的医药费也是 曾经试探着问过他们对抑郁症的看法 得到矫情啊是个坏孩子啊诸如此类的答案之后真的一点儿也不敢告诉他们俩我有抑郁症 而且有一段时间有过非常强烈的轻生念头每一天都在假装开心 假装大笑 假装对任何负面事件毫不在意 只敢在公交车上 地铁上 凌晨的被窝里无声的哭 基本上第二天起床都要花半个小时给眼睛消肿主动把所有能对自己的肉体造成伤害的物品锁起来 不敢上天台 高二的时候情绪失控 一半身体翻过了天台的栅栏 打算从五楼一跃而下 被一通来自妈妈的电话救了回来我不敢在父母面前表现出一丝不对劲 我得认认真真扮演初中时期那个没心没肺天天开心成绩优异的好女儿最失控的一次我从厨房抢走了水果刀 想和父母同归于尽艺考时期没人束缚 终于抛弃了一切掩饰 我可以面无表情 可以抱着马桶哭 可以吃了吐 在呕吐的酸痛感里体会到我还活着的真实感我沉浸于戏剧表演 在戏剧里 我可以借着角色宣泄自己的情绪 很多人都夸我哭戏很强 情感渲染力强 特别适合演悲剧角色 因为我每天都在一场名为人生的悲剧里扮演一个悲剧人物高考过后见不到高中同学了+坚持每天吃药每天打游戏转移注意力 我的状态好了很多 从重度转到了轻度到了大学 一系列的糟糕事情+自以为已经变回一个正常人了断了药  结果前几天心理老师给做心理诊断的时候 又变回了重度抑郁写这段文字的时候 我正坐在高铁上准备回家去医院复查我又开始在没人认识我的地铁上哭我不知道看不见光的未来还有什么期待————————11.21—————————————那天之后查出来 确诊中度抑郁我又开始吃药了大学里又遇到了不好的事情 为了控制自己 开始不根据医嘱 过量服药不知道是不是过量的副作用 还是病情的原因 我开始加倍的感到疲惫 很困 没有食欲 提不起干劲之前失控了 在教室里自残的同时 想拉着那几个女孩同归于尽我知道我不是一个善人 但是我也不明白为什么会有这么多恶意扑面而来仅仅因为我和她们爱慕的对象是好朋友我明明 话少 降低存在感 表面上对谁都很温柔 只追求平凡的度过最后的学生时光就算是这样 那些把我推进深渊的恶意还是不停歇我找不到倾诉对象 一直陪着我的姐妹忙于学业 现实中的表面朋友交不出真心我每天都在疯狂的想逃回我原先居住的城市 哪怕广州和深圳其实离得很近 但我真的再也不想待在广州了好想一个人在没人打扰的角落里发呆好想放弃自己,6,6
匿名用户,我不知道别人怎么样我每天不想刷牙洗脸，不想吃饭，不喜欢出门，不想见到其他人，别人跟我问路我都会紧张，不敢接电话我能在沙发上坐好久好久，会胡思乱想，晚上经常做噩梦，对未来没有任何的向往如果，我死了，就好了但是，在别人面前，我还会笑，也会逗别人笑当家人一次又一次的逼我的时候，不想活着的想法会更强好在，我的还不严重,6,3
