匿名用户,我是一个26岁三岁孩子的妈妈，我是异地恋，结婚后跟我老公住在一起，离开了我的父母、朋友、同学，如果再给我一起机会我会选择永远不结婚，不知道是不是婚姻带给我的体验过于沉重，还是因为我嫁错了人，从生完小孩开始，我的情绪变得越来越糟糕，也许是因为产后的抑郁症一直没有好透吧，我的老公属于那种外人面前特别好的人，不管是谁都会夸的那种，但是他在家里从来就不会体谅我，他是家里的独生儿子，从小就是父母宠爱长大的，虽然当过三年兵，可是在婚姻里面他真的付出的有我多吗？生完孩子坐月子开始就是我一个人熬着夜喂奶，没有帮我带孩子，他在旁边睡得跟猪一样，从来不会起来帮我哄哄孩子，下班回家就是打游戏，而我晚上带孩子起来七八次，还有很多事情我是真的不想再说，要说他对我不好，也不能算是不好，高兴的时候能帮你带带孩子，也许是我自己咎由自取吧，其实就是想在上面发泄发泄而已，从结婚到现在我无数次的想死，有时候会自残，可是我想到我的父母还有我三岁的女儿我就不敢去死，我怕他们会崩溃，我爸妈也就我一个女儿，结婚这么久我从来没有跟他们说过我过得不好，只有自己慢慢熬，其实我的情绪时好时坏，好的时候跟正常人一样，坏的时候就是特别想自杀，会自残，而且我发现我是晚上的时候特别烦躁，脾气特别暴躁，很容易哭，第二天天亮又好了，然后晚上又开始，这样过几天以后就恢复正常，在过一段时间又会反复这样，我也不知道到底是不是抑郁症，我也想过离婚了，可是我总觉得是不是因为是我做的不够好，我也没有好好孝顺我父母，他们把我养那么大，我去从来没有让他们享福过，还离开他们身边，真的对不起他们，我感觉自己陷入黑暗里面，没有光照进来，慢慢熬，熬不住了，我就走了,0,2
曲终人不散,我怕被别人说，装抑郁症好恶心,0,2
根硕,活着对不起自己，死了对不起爸妈文不对题，就是想说这句话,0,1
南方有令秧,朋友抑郁症。我是她唯一信任的人，刚刚我睡醒，看她给我发的消息，她说很慌问我睡了吗，我眼泪就掉下来了是的我喜欢她，但是好像这一切都变得很渺小，我知道她内心，但我不知道怎么帮住她，我买了几本书，关于抑郁的书，我咨询过医生。我能做的好像也只有一个拥抱，答应她带她看音乐节，因为这次疫情，我没有假期了。军人向来为服从，我可能要违反纪律了。我知道你…没有把我当恋人，你告诉我朋友才长久，是的，你知道吗。当你好了，我就离开。,0,1
景蓉,我仍旧充满阳光的面对遇见的所有人，可是却再也没有阳光会撒在我心里。我仍旧相信身边的人非常善良友爱，可是我却再也不会相信别人，我仍旧每天勤勤恳恳完成工作，可是一分一秒对我来说都是煎熬。,0,0
匿名用户,也许会的   ,0,2
柒悦,我看了所有答案，我知道自己可能是患有抑郁症了，时至目前应该是重度抑郁症，我常常想哭，有一种莫名情绪涌上来，可是哭不出来，我想发泄，我想被确诊，想被所有人重视，但我又不想确诊，又不想被所有人重视起来，我只想逃离安安静静的。,0,0
川川,没有谁能够感同身受,0,1
Despacito,自杀太轻易，只有自残，一道一道的优美的刻度线，才是真正感觉到生的唯一希望。最喜欢的是看着血流过手腕一点一点滴落在水面的涟漪，一点一点，做一个未亡人，等着生命慢慢流逝，走向地狱的深渊，最喜欢就是看一切，看你的眼神，由放光到冰冷，浓浓的夜色，吞噬了眼眸，喜欢怼一个人怼到死的感觉，不喜欢被人抛弃被人不珍惜的感觉，像恶魔的笑，自由，有风流倜傥，我知道，我是很爱这个世界，这个下一秒就想鲜血淋漓的世界，辜负！失望！疯狂！惜命?“所谓魔鬼的天梯，是一条毁灭自己的路，而最后，门口的小鬼告诉我，欢迎来到人间。”像一个跳梁小丑一样讨所有人喜欢，世界，地狱，您好。,0,0
匿名用户,2018年底开始体重减少近10斤，从43或44突然减到了39或40，再也上不去了对生活中的一切失去兴趣，旅游觉得累，兜风觉得没什么好玩的，最近连游戏也不想打，累自卑焦躁不安躺在床上不想起偶尔耳鸣喜欢吃感冒药，因为吃完可以睡觉，感到放松。脾气开始暴躁，放飞自我开始摔东西。经常想吃安眠药或者跳楼一走了之，想好了把电脑手机信息清空，把房间打扫干净。觉得自己很失败，没家没车没房，一事无成很绝望，为什么生活看不到尽头。经常莫名其妙的哭害怕高兴的情绪，高兴起来仿佛就犯了罪，每次高兴之后都会伴随不幸的事情发生。想折磨自己，打自己，想躺在冰冷的地板上吹冷风经常生理饿，没食欲还不到30岁，已经没有生理欲望了全身疼，心里压抑我不知道这是不是，也没有去医院看过，日常过的很痛苦，怎么拯救呢,0,4
十七,我觉得我有点这种特质，怎么说呢，就是反反复复情绪不好，你要说抑郁情绪但是和以前的那种抑郁情绪感觉不一样，从18年和好朋友吵过之后还有知道一些事后就感觉自己的情绪不太对，先拿伤心来说可能比如这个月会反反复复的伤心几次但是之后可能就不会了，有时候受一些刺激哭了就会掐自己打自己（是不是特可怕），后来发现这两年会因为一点点小事生气，生气起来特别可怕真的是可怕有时候自己想起来也害怕，并且发现自己好想对未来没啥希望得过且过，甚至有时候感觉自己活不长，感觉谁都比自己有出息对生活没有期待，每天玩手机逃避，哎我也不知道咋了,0,0
小小芋圆,丧失快乐的能力以及对新鲜事物的兴趣,0,2
匿名用户,我是为了我的家人和爱的人活着，只要不辜负他们，我做什么都行，哪怕是在这个痛苦的世界挣扎着，除了偶尔会抱怨活着好累，我不会让他们知道我的意愿我的想法，只要他们高兴就好，我会继续为了他们的梦想而活着，成为他们希望现在应该成为的样子。,0,0
匿名用户,会感觉不到自己 感觉不到家人 会不想思考 却总是思考 不想动 想在很黑的屋子里面 不想说话 不想人陪 感觉不到自己…… 我到底是谁？！,0,1
廣西王祖賢,尽管做什么测试都显示我是，可是啊我就是觉得我不是啊。我很惜命的，可是我不知道为什么惜命？可能是因为妈妈会难过吧。可是一受到刺激总会克制不住地去想我死了该多好啊。不用漫无目的地活的像行尸走肉。发现自从我被测试为抑郁症之后我再也写不出美好东西写不出曾经令人羡慕的文字了。其实活着挺没意义的，因为你死的时候什么也带不走，你也没办法成为让别人永远铭记的人，你只是一个普通人，当世界转个圈你就像没来过一样，这个世界上不会专门留下你存在过的痕迹。你想体味什么啊？告诉自己人间的酸甜苦辣？然后呢？根本找不到你存在的意义吧。你不过有点意识有点思想你是你的全世界，可是对全世界来说你又算什么？一根芦苇而已。我和曾经的我隔着的是一整个世界。生命的意义在于它会走向终结。,0,0
匿名用户,念初中的时候就被父母狂骂我心理有毛病，说带我去看医生，结果说太贵了，没带我去。过去七八年了吧，没有去看过心理医生，在学校去找老师做心理咨询，他们的建议大部分都是听音乐、看书放松自己。我不知道自己是不是这样的症状，一开始以为自己能够控制，现在我22岁，我控制不了了。我会失眠，哪怕什么也不想，在非常困的情况下也睡不着，这种情况曾经持续了整整2个月。我是极度渴望一个优质的睡眠，因为能够让我第二天充满能量和好心情。出现幻听、幻觉。有点灵异的现象……偶尔听到房间莫名其妙的响动和女人叹息声，或者有人敲门。幻觉就是，起夜看见家里有陌生人。一开始很害怕，后来就释怀了。非常容易出现消极情绪，非常消极，别人怎么劝都没有用，需要我自己去消化。晚上常常会莫名其妙地流泪、哭泣，控制不住的那种。如果跟父母吵架，仅仅因为一句话，我就可以情绪崩溃，然后大吵一架，有时候哭得快呼吸不了、晕过去一样难受。。。平静后回忆起来，觉得也不是值得计较的一件事，为什么我会那么激动。家里条件不好，负债，而且父母给的压力很大，希望我能够担起来家里的一切经济。。。比如车房等等。心里常常会发生想自残、自杀、摔东西、伤害他人来宣泄情绪的想法，但是我往往都选择哭。因为这样是最低伤害。有时候也挺看得开的，很不同的人相处起来也挺乐观的，一年里大概会出现好几次持续性的情况出现，频率是少了，但是好像我越来越控制不住自己。我很害怕很害怕自己真的患上抑郁症，那种很严重的病理性的心理疾病。我想好好的，我也对未来充满憧憬，我也想好好过日子。,0,0
匿名用户,我想了很久，到底是什么时候开始的，也不重要了。我自认为我是一个生命力特别顽强的人，把我丢在荒山野岭也能存活的那种，我失败了一次又一次，再爬起来一次又一次，在各种对抗里我总能满血复活。生活里我洒脱，我积极，我目标明确，我有兴趣爱好，最确定的是我从小就怕死，很怕死，一想到死了之后就失去了亲人朋友，失去了很多有意义的事，失去了这个多彩的世界，我就惶恐不安，我应该是不会不想活的，我确定我一定不会抑郁。现在我的头很重很痛，这一周里睡前都会哭，确切的说白天也随时会突然想哭，我总是问我是有什么事让我伤心？没有任何事。其实最难受的是每一天醒来的那一刻，第一个想法永远是，这他妈又是不想活的一天。我不想醒来，醒来也不想起床，因为起床后的一整天没有任何事能激起我的兴趣，对，我的兴趣，我没有想见的人，没有想做的事，连曾经废寝忘食的画画，它都死了，是我杀死的。有没有想吃的呢，没有啊，我能想到的所有能吃的东西都让我难以下咽。我当然是很想摆脱这个状态的，用很多精力做一桌美食，去跑步，去逛超市，去跟朋友社交分享这一切。但是那条黑狗总是隔在这一切的中间，甚至在每一个互动的间隙，我就像个毫无瓜葛的旁观者，看着大家追求和释放各种欲望。而我，毫无欲望。我一无是处。我没有能力处理好任何一段关系，连好好说一句话都要耗费很多力气，而这些都会在我消极的对待下进入下一个轮回，我爱的人都会在我突然的暴躁和冷暴力之下饱受折磨，他们都太无辜了，一想到这里我就会陷入更深的自责，所以最好关上房门，永远不要拉开我的窗帘。前两个月和一位多年的好友相聚，快结束的时候她认真的问我，你是不是抑郁了。我依旧是自嘲的笑着说，怎么可能，我这种人啊……然后内心会接着说，我这种人啊……其实真的不应该存在。你不应该跟任何人说起这些情绪，在意你的人不理解但是会担心，爱你的人会因为帮不到你而感到无力和挫败。最可怕之处在于，你能预见到的未来所有的时刻都是这个样子，你会一直是这个样子，如果一直是这个样子，有没有办法提前结束这个样子，比如不要醒过来。我确定这个世界不是轰然倒塌的，是唏嘘一声。,0,1
Coconut,你所不知道的儿童抑郁症（二）重性抑郁症	我会详细列举并讲解九个重性抑郁症的症状，并对成年抑郁症和未成年抑郁症进行对比讲解。一，	抑郁情绪抑郁症让人感觉悲伤，难过，情绪低落。对成年人而言，大多数的人会直接表达自己的这种感受，而有一部分人，你可以通过他们的面部表情或者行为感觉到他们的悲伤和情感上的痛苦。而对孩子而言，他们可能会通过身体的不适来表达精神上承受的烦躁不安，例如经常性地头痛，胃不舒服，嗓子痛等。还有一部分孩子和青少年会表现出急躁和易怒而不是传统的情绪低落。从这里我们可以看到孩子和成年人的抑郁症表现有多么大的差别！我会看到或者听到很多家长说自己的孩子变得爱发脾气，变得暴躁或者烦躁，有时候跟他们多说几句话，他们会立刻火冒三丈或者避而不见。很遗憾，我们经常误会孩子的行为，然而我们并不知道这很可能是他们的求救信号。二，	对很多活动的兴趣或者快乐明显地降低对成年的抑郁症患者来说，往往对以前十分喜爱的活动突然地丧失了兴趣，或者不再感觉到快乐。而儿童抑郁症患者可能会表现为退出他们喜爱的足球队，兴趣小组，乐队或者合唱团。而青少年抑郁症患者可能会避开一直喜欢的聚会或者其他的学校团体活动。我们称之为快感丧失（anhedonia）。如果我们的孩子突然从热爱的活动中退出，不再热心参与曾经喜爱的团体，请一定保持关注并给予支持。对于未成年的孩子来说，这太重要了。三，	体重在一个月内剧降或者骤升超过百分之五成年抑郁症患者会出现明显的食欲降低。他们通常感觉不到饿，要在别人的提醒之下或者鼓励下才会吃东西。因为食欲降低导致了体重明显降低。还有一部分人会突然食欲旺盛，从而导致体重增加。而儿童和青少年抑郁症患者的表现是无法达到与年龄相匹配的体重，通常是体重增加低于同龄人标准。四，	睡眠状态的明显改变成年抑郁症患者的睡眠障碍通常表现为失眠。例如睡到半夜后突然醒来或者是在黎明来临前的几个小时就醒来，醒来后便很难或者无法再次入睡。还有一部分睡眠障碍表现为嗜睡。而对未成年人来说，失眠是大童和青春期抑郁症患者的最重要的预警。身为父母，如果发现孩子的睡眠发生了明显改变，尤其是失眠，请一定提高警惕，不要简单地认为仅是孩子着急上火了，乐观地相信孩子会自行恢复。   还有五个症状，我会在下次进行讲解，今天困了，我要去睡觉了，也祝大家晚安。,0,0
匿名用户,记录自己的抑郁症状，为了记录抑郁症给我的伤害，为了倾诉，也为了让别人了解抑郁症，所有的描述都是真实的情况，发毒誓。我恨抑郁症。1.说话没逻辑   2.脑袋后面懵懵疼疼的，如果你有睡懵了的感觉，想象一下再也清醒不了  3.记忆差，健忘。记住的东西，脑袋里突然一闪就忘掉。高中背一篇课文2个小时，痴痴的重复念那么几句话，背不下来，以为自己不用功，一下抑郁情绪就上来了，会疯掉会狂躁痛苦伤心绝望。4.读不懂句子，听不懂话，描述不出自己的感受。可能是语言障碍，话在嘴边说不上来，听不懂别人的话外意思，会重复问就是不懂，别人也懒的跟我解释，看英语每个单词都认识，连起来不懂什么意思，跟老师说老师也不知道就把我打发走了。语文阅读读不懂，对应原文选对错，选不出来，一句话只要变了说法就看不出来，看一大段文字我就会恶心头晕。5.心情差的时候智力也差。看有的回答说不要把笨怪在抑郁症上，澄清一下，我语文英语都在120以上，但是在快高考的100天特别焦虑，3和4就出现在这一百天。之前也有这样的状况，但是没这么严重。抑郁症绝对会让人变傻，像是智力受损，因为没得病前我也有正常过，但我病严重的时候理解东西的思维，问的那些问题，完全是上小学孩子的表现，虽然智力没有下降但那么低，但是跟普通同龄人相比智商差很多。 6.喜欢密闭幽静的空间。和外面接触给我持续的不安和焦躁，喜欢待在厕所。7.听不懂别人话外的意思。有看过一部烧脑的电影，如果有你看不懂的剧情，那种晕眩的感觉，并且听不懂电影里的人在说什么。想象一下，日常生活中所有人给你说话你都是这种感觉。8.如果有聊的来的朋友，是可以和他们正常说话的。9.讨厌别人的目光10.暴食缓解自己的压力，胖了40斤了，变得面目全非，自我厌恶。11.不能受刺激。会想s人。12.自我伤害。每天蜷缩在床上盯着窗外想要跳下去，不敢。最喜欢的s法是很安详的s在梦中。上课前在路上磕了一下，觉得自己很蠢笨，想要划烂自己的脸，忍不住只能拿出纸，用笔把纸划烂，想象是自己的脸。条件允许会打自己，打完会清醒一会。13.迟钝。没啥好说的，基本操作。脑子迟钝身体迟钝，思考不了东西，大脑锈住了。14.对恶意的仇视心很重，报复心强。看网络上低素质的人恶言恶语，觉得世界充满了恶意，希望这种人都能s掉，自己也会变得抓狂。并且想要看别人的抑郁症痛苦还说风凉话的也得抑郁症。15.不经意间排斥快乐。虽然极度渴望快乐，但是当自己开心的时候，会觉得这是罪恶的，绝对会有不幸的事情降临。16.眼睁睁看自己犯错。明确知道是错的，却非要做，像是旁观另一个人犯错，之后会极度懊悔。17.有时候你会突然变正常，但如果你意识到了，你又会立刻继续痴傻。18.性格变了。以前很阳光的，现在即使不抑郁心情好的时候，也忘记怎么变阳光了。19.不爱不敢交流，闷着自己憋着。20.思维逻辑思考方式被心情摧毁了，时刻钻牛角尖。21.你的心理问题会变成生理问题。如果你有很伤心的时候，你可能会思考不了东西，脑袋变迟钝之类的，想象一下我得病的时候，几年一直是这样的。22.会不知道自己怎么了，形容不出感受，现在是因为抑郁症好的很多，已经度过最困难的时候，才能描述出这些症状，最困难的时候，脑子里只有“一直很不开心”的感受，根本意识不到这么多。23.脑袋好疼啊。24.消沉，并觉得抑郁症是我的一部分。虽然讨厌抑郁症，但是经常沉溺在我的情绪里，体会不到振作和克服，听鸡汤会恶心，抗拒看医生和吃药，你会杀死自己的一部分吗，和你形影不离，虽然让你伤心，但却是你的全部。上面有些东西说的不是很准确，意会吧，我也不知道自己在说什么呢。想得起来再补充,0,0
匿名用户,其实抑郁症有时候还挺隐蔽的。刚开始可能只是一些抑郁情绪，可能是受某些事件引发的。受到一点刺激就开始伤心、大哭、情绪崩溃。再开始失眠，凌晨三点以前没睡着过。6点钟醒来，也睡不着，就是害怕起床，很害怕很害怕。然后发觉自己变得好懒，脸刷牙洗脸这种小事都需要很大的动力不断督促自己。坐到椅子上就不想站起来。看视频看书觉得都没意思，学习效率变得很低。也不知道自己到底想做什么。偶尔会有自杀的念头，只是找不到安全又相对舒适的方式，也觉得对不起父母。自杀不成再成了残疾更惨。我还经常听到耳朵里有心跳的声音，去检查都好好的。胃口变得特别好，一直吃东西。最最重要的，几个月内这些症状都没有减轻。最主要的，单纯抑郁的情绪，并不是常态，也还是会笑会乐观，只是那些让你快乐的事都无法让你变得有动力。,0,2
Lightz,曾半年心情都是谷底水平，胸闷压抑，食不知味，无欲无求，没有笑容。睁开眼的第一想法就是：“生活好没意思，还不如死了算了。”算是么？大抵就是如此，生而为人，我很抱歉。,0,0
匿名用户,   因为原家庭的不堪，父母都有对我身体和精神暴力，我小学一年级就有自杀行为，我在家里的角落端起一碗农药送到嘴边正要喝下，母亲从外面推门进来，我放下农药藏在一边。这是我童年距离自主死亡最近的一次。    而后，我一边天真单纯，一边阴郁，高中时候吃了安眠药家里各种药很多颗，睡了三天，家人以为我是赌气睡觉不起不吃不喝，等我醒来已经三天后，并且，虚弱到头晕目眩，走不到厕所去小便。    终于，我大学了，全新的校园生活，远离原生家庭，又情窦初开，长的甜美可爱，文艺气质，追求者众多，进去亲密关系给了我很多温暖力量自信。喜欢温暖开朗自信阳光的男生。     90年的我今年结婚了，嫁给谈了五年多的男友，他非常温柔单纯心理非常健康有爱的鸟男人。   今天，我又莫名情绪低落，强迫自己打扫了家里的卫生，躺在沙发上，再也不想说话动弾，老公上楼叫我下去烧烤，我说我不舒服，他马上上来问我怎么了，我说我情绪生病了不想动，他又温柔亲昵抱住我亲亲我，说道没事，我们下去烧烤。进入烧烤状态，我又快乐起来，生活很美好！,0,1
俊峰ccd,对生活中的大部分事情都毫无所谓，感官完全退化，麻木。遇上在乎的事情又让人痛苦不已。差不多就是完全体会不到做人有什么快乐了吧。,0,0
