卢瑟还能活多久,连续一周的失眠，凌晨3、4点依然无法入睡。在深夜里异常兴奋地胡思乱想。否定自己，觉得自己就是一坨×。因为一点点失误，在办公室里嚎啕大哭了一下午。咬到舌头，哭了一场。早起喘不过气来，心一直往下沉。说不出的绝望。只有大哭一场才可以缓解不适。不想吃东西，对食物提不起兴趣。双十一来了，什么东西都不想买。对任何美景提不起兴趣，面对着水天一色的湖泊，日光淡淡，群山如黛，同行的同事都在拍照惊叹，只有我盯着水面在想，水好深啊，跳下去一定很容易死。不爱捯饬自己。房间里垃圾成堆。站在阳台就想往下跳。感觉说话好费力，好累，说话都要耗尽我的所有力气了。微笑好累，面对领导同事，勉力微笑的样子丑极了。总觉得生活在以死相逼，觉得人间失格也不过如此。花了钱做抑郁测试，重度抑郁，一定是骗人的。想远离人群，缩在一个壳里。连最亲近的人也无法倾诉。害怕物品，总是会一晃眼把物品看做了别的恐怖之物，要么是影子一闪而过，要么是相似的形状，吓自己一跳。担心自己精神分裂。（家族遗传）我想我应该消失了。,0,1
我想,经常的头晕胸闷心悸喘不过气发麻对什么都不关心没兴趣没有感情没有感觉一但开始难过就沉浸在里面不出来不知道人生活着的意义是什么有自杀倾向但是又要坚持活下去想到要坚持活下去又忍不住掉眼泪不停的掉眼泪 特别考虑照顾别人的感受  会体会到别人的难过 而别人理解不了你 最好的朋友以为你只是开开玩笑 无处发泄 我真的没有希望了 她们只是不以为然地说那你就去死吧 久而久之什么都不想说了 完全封闭了自己 总是看不起自己不相信自己 没有自信 我是个废物。,0,1
好久不见,感觉以上的我全中，极度自卑，极度缺乏安全感，极度敏感，极度悲观,0,0
匿名用户,我不知道现在这样算不算抑郁症一个人在陌生城市生活有一份刚刚养得起自己的工作，无房无车，原生家庭很穷。女，33，未婚 每天心情都不是很好就是淡淡的压抑，也很少说话，除了工作上必要的交流身体也不是很好，有哮喘，不能剧烈运动也很难爱上一个人，精神上很孤独每天一个人吃饭，工作，睡觉，不知道为什么活着，像个僵尸特别难受的时候，会去没人的角落撕心裂肺一下，之后又恢复平静。,0,2
匿名用户,总有人告诉我我不是抑郁症。我也总分不清我是不是抑郁症。我只是觉得我像joker里面的Arthur Penny一样，很多时候都在强迫自己笑，也只差一个爆发点。不同的是，他周围没有人善待他，我周围有很多人善待我，但我感觉不到。很多时候很多负面情绪会涌现出来淹没我。下面这个图是我在非常非常非常难过的时候画出来的，很…不专业哈哈，但是我现在看起来，我把人物的表情神态，绘画的很明显。那就是我当时的状态了，觉得自己被所有人和情绪包围纠缠，周围的人有些虚伪，有些冷眼旁观，有些横眉冷对，有些事不关己。我一边哭一边画的这幅画，我现在的情绪比那时候稳定很多，所有难过得要疯掉的moment好像都不属于我。,0,0
匿名用户,我觉得我有抑郁症 但是我不敢和别人说,0,0
匿名用户,一直觉得自己抗压能力挺强的。但是我忘了，作为人，本身很多事情都是有限度的，近一年一直都是处在压抑，难受的状态，失去了我原有的开朗，乐观和笑容。最近感觉自己已经到了一个临界点，就差一点点，我就要崩溃了。每时每刻都想哭的心情，厌倦生活上班的情绪，不停往下掉的体重，夜晚的失眠都在告诉我，我要崩坏了。有一天又是一个失眠的夜晚，我突然产生了想要割腕自残的心情。许多次看着自己手腕，手臂上条条清晰的象征着生命力的血管，好想用刀子割开，看看血流出来的样子想去医院看看我是怎么了，可是又害怕检查出什么，我什么时候才能恢复正常啊,0,0
杏仁,昨天去检查得了抑郁症，来总结一下这几年的情况吧。大一从南方到北方读书，因为语言问题（我所在的地区不讲普通话，包括上课），第一个月基本上无法和别人交流，后面有所改善，但也第一次和寝室闹掰。大二重新分寝室，因为一些事第二次和寝室闹掰，我被孤立了。其实也不是我被孤立，是我主动不和她们再交流，所以整个寝室气氛和诡异，我在的时候寝室总是安安静静。大三有了新朋友，相处了一段时间，我走进她内心了，可她没走进我内心，是的，我抛弃她了，没有任何原因，她给我写信，写对未来的期盼，期盼我也能出现在她的未来，我无动于衷。与此同时，我认识了另一个同学，她能力很好，招人嫉妒，朋友很少。因此我就怀疑她是为了排解寂寞才跟我玩，也无法真心相对。再后来，我认识了我觉得是真心朋友的人，在一起的确相处的很愉快，这是我大学最愉快的一段时间了。但是好景不长，因为非常小非常小的事，我和她们闹掰。然后这次闹掰之后，我的内心彻底崩塌，从大一到大四，我接触的每个人都离我而去，我开始怀疑自己，怀疑自己的所作所为，也开始觉得自己是这个社会的边缘人，没有人在乎，就算死了也是活该。那时候真的很糟糕，我在课堂上会忍不住哭出来，会什么都不怕，会逃课，会走到一半突然停在路边，会整夜整夜失眠，会好几天不洗澡，会觉得所有人都在背后指指点点我，会觉得前几个被我抛弃的人都在看我笑话，会觉得我的存在把这个美好的世界搞的脏兮兮的，我那时候真的想死，我但凡有一个朋友我都不会怀疑自己，最后一个朋友可能是我的救命稻草，我也失去了。之后我上课无法集中精力，不是玩手机就是趴在那哭，也会发呆，尽量远离同学自己一个人坐在角落。因为之前我挺大大咧咧一个人，所以有人会来顺口问一句为啥我一个人坐这里。其实这就是很简单的事，但我听了就会责备自己，责备自己为什么坐在角落还会被人看见，为什么我要存在，为什么我不能不来上这节课。就是责备自己。因为自己是个怪胎。后来，我想起我爸很早之前说我人格障碍，上课的时候我就拿出手机查了一下人格障碍，我记得我当时看的是边缘型人格障碍，看了一个患者自述。我当时眼泪止不住的流，觉得我生病了，我就是边缘型人格障碍，我没办法控制自己，我是生病了，我很害怕，我病了这么久。当时有一位留级下来的同学特别关心我（我没把她当过一秒钟朋友，我觉得她关心我也是因为在我们班她没有朋友，拿我来消遣寂寞的），她下课就把我拖到学校心理咨询老师那去了，btw，我们学校是医科大学，心理咨询是靠谱的。老师让我们周三来，因为周三才是心理咨询日，但是又看了我一眼，说“看你情况比较急，你明天下午来吧，我等你”。我当时听见这个我就开始哭，边走边哭，我真的没办法了，我离家那么远，我感觉自己没有家，没有爸爸妈妈，没有人能帮我，我感觉自己在溺亡，我什么也抓不住了。我记得当时天空很蓝很蓝，但感觉我和蓝天已经不在一个时空了，我开始疑惑天怎么会这么蓝，白云怎么会这么白，路上怎么会没有人，总之那时候就已经开始思维不受控制，一切理所当然的事我突然理解不了。第二天我独自去了诊室，在心理咨询室哭了两个多小时。最后老师说我是文化差异太大，对我造成的冲击太大，专业名词我搞忘了，差不多就是文化冲击吧。其实我是怀疑的，但是当时就觉得不是边缘人格障碍就好，而且当时要考研，我也愿意选择欺骗自己。然后我就给自己讲，我没得病，我就是被南北文化的差异吓到了，这一切都不怪我，我回了南方回了家就健康了。然后我去洗了澡，这一切都不怪我，我不该怀疑自己。在那之后我孤独的度过了大半年考研的日子，中间也有人进入我的生活，但我怕我让她们失望，都是浅浅的接触，开始不敢结交朋友。一旦遇到让我不开心的事，我都会想我还在北方，环境对我的影响是持续的，不怪我，我没错。但从我推卸责任给文化差异的那一刻起，我就开始自卑了，我知道自己再也配不上那些美好的东西了。这是我抑郁的开端。我不想写了，我现在也不快乐，依旧被生活压的喘不过气，我说时间从不等我，我还是个小孩。真的，我没有那么大的能力。,0,0
南夜归,深夜睡不着翻到这个话题开始止不住的哭也不知道是为什么,0,0
The sun,2019.11.3  00:24 今天太晚了，明天一定来补。2019.11.3 7:44接上回首先，我认为自己并没有得抑郁症，只是情绪低落，我也相信我可以变得开心起来，并且这么做了，也获得了不错的结果。好了，故事开始了（搬凳凳）2019.8月底放假在家，那是我自我认为最为消沉的一段时间。我自己也不知道是什么让我如此难受，呼吸困难，感觉悲伤从未间断，就是想是最挚爱的人去世时心里的那种痛感，但又不像，因为它是连续不断的，毫不让你喘息，超级难受的那种。家里人也许是看出来了我的低落，他们觉着可能是我不想去学校（在北京上学），所以总是说没事儿，你要是不去也行，回来继承家里的“财产”就好……家里人总是不善于表达感情，我也是，我也懂。就这样难受持续了一周，开学了。在开学的前天晚上，我第一试图找人诉说这一切。我说:我好像抑郁了。好友说:怎么了？突然有这种想法？我说:一个星期了，很难受。好友说:也许是太空虚，迷茫了，没有目标吧。不要想那么多，可能开学就好了。我说:好吧，早点睡。那天是晚上十二点，反反复复一点多两点才睡着。在此之前夜夜难眠，一两点睡是常事，四五点起也是……我怕了我发现自己不再是个自来熟，变得焦虑，觉得和每个人多说一句都很累，越来越不想说话。但是开学这个时候，大家普遍很开心，很积极。我……我就得迎合着这个大环境。第一次感受到身体内部的激烈对抗。大家以为我生病了，所以我很庆幸，她们这么认为，因为这样我就能少说一句话，一个人安安静静的待着。开学很忙，事儿也很多，人忙起来可能就忘却所有情绪了。我也这么认为，但好像并没有，反倒是更加难受了。面对一堆不得不做的事情时，除了觉得很烦就是无感。石头越来越重，整个人没了精神气。室友说你最近好低落，怎么了，我说:还好吧。太费力了，死肯定不好受，活有很费力。不是身体费力，而是心累，心脏里面的血液好像榨干了似的，在往下坠……嗯……又持续了一周。我遇到了我的“药”。他陪我聊天，我不认为这会有什么作用，就“嗯”“好”来回答他所有的话。他任然没有放弃，天天沙雕，说有趣的事。一周后我舒心很多，他仿佛救了我。然后各自安好。故事应该还没有结束……后续,0,0
咕咕噶噶,1 价值感低。觉得自己没用， 除了父母没人对自己有任何意义 ，看不到未来的希望，极其厌恶自己2嗜睡。这点在我身上还蛮明显的，相比失眠，嗜睡能更好体验死亡，因为世界上什么都感受不到，可以逃避一切不好的3怕人。不喜欢很活泼很外向的人，不喜欢和陌生人说话，有些社恐4失去欲望。各种欲望5情绪波动大。敏感，容易对别人的言语产生极大反应，这点。。父母的言语恶意真的可怕，每次他们贬低完后我都会想自杀,0,0
匿名用户,1 短时间内情绪波动很大 有时候特别兴奋活泼 有时候特别沉默2 没有什么食欲 不想吃东西 懒得吃饭 觉得吃饭特别麻烦 基本吃的只够维持生命3 睡觉反复醒来或者严重嗜睡4 对什么都没有兴趣 严重者会觉得家人朋友爱人 都是无关紧要的人5 记忆力严重后退 刚刚做的事情可能下一秒就忘记了 而且怎么想都想不起来 6 反应迟钝 经常失神 明明脑子里什么都没有想 但就是走神 常常听不见别人的呼唤声7 四肢无力 无论什么时候总觉得特别疲惫 不想交流  拒绝沟通 上面都是我有的症状 这样已经算是很严重的抑郁症了吧 ,0,0
匿名用户,自我感觉没有抑郁症，但是，心情长期处于萎靡状态，但也不是难过到伤心欲绝的地步，只是觉得每天心情都很堵，没有任何让我打心底里开心的事情，间歇性地会进入极其伤心的状态，而且特别冲动，自尊心较强，平日里看起来是比较温顺的人，但其实会有攻击性，发作起来判若两人，会无理取闹，即使知道自己做的事是错误的。对生活中的许多东西都没有兴趣，或者三分钟热度，极其容易厌烦，对未来的生活也没有抱太大希望。不喜欢人，不喜欢沟通，认为人类不可能通过语言互相理解，所以选择放弃沟通，认为自己不属于这个世界，而是作为第三人视角旁观这个世界，喜欢袖手旁观，喜欢倾听，不爱参与，冷漠。讨厌光，喜欢黑黑的地方，讨厌吵闹，喜欢安静的地方，从小就恋旧，喜欢收集老东西，能保存很久，但后来会突然想要毁掉一直保存的东西，比如保存了很久的自己的画，四年的qq空间说说记录，几年前的照片，日记，珍藏的朋友送的东西，别人写给我的纸条，以前喜欢看的书…删掉毁掉扔掉。生存欲不是很强烈，但不会刻意寻死，一直抱着“既然活着那我就顺便活着好了”的心情，如果哪一天面临死亡，也不会有太大波动，也不会挣扎求生什么的，就觉得“既然都死了那就死了好了”。记得有次和朋友爬山，在山路上，身边是悬崖，大家都在怕高或者感叹景色，然而我在沉思从这里跳下去的人会怎样，尸身会不会被找到，适不适合葬身，对他人有什么影响，但是只是认真思考这个问题本身，没有考虑过自己跳下去。还有一次生病了，流了很多血，以为自己得了绝症（其实并没有），当时误以为自己有绝症的我，没有恐慌没有害怕，而是马上有计划地考虑自己余生要做些什么。现在想想，我冷静地有点可怕。总之就是抱着，活着我也接受，死了我也接受的想法。,0,0
Theon,结合自己的状态，还是去医院检查一下吧……不知道多少天这样失眠了,0,0
匿名用户,茶不思饭不想不是不饿，很饿也吃不下去东西，吃了东西唯一的反应就是呕吐睡前无论干什么，当放下手机，闭上眼，什么都想到了，睡意全无就算勉强睡着了，第二天也感觉没有任何休息的感觉身体一直疲惫，而且会出现莫名的疼痛感很多想干的事，该干的事都没有任何心情去做都说回过去的，但不知道我能不能坚持到过去的那个时间点了,0,0
Fiona,我不知道自己有没有抑郁症，但现在有合理的理由怀疑自己有抑郁症的倾向。目前正在准备考研，虽然目标院校是普通211，但复习过程中一直按照高分标准要求自己。考研对我来说应该是一种逃避：三年前来到离家差不多两千公里的地方上大学，大一被室友冷暴力，一度精神崩溃；想换宿舍、想退学，最痛苦的时候一个人上课的路上边走边掉眼泪，十二月的江浙城市湿冷无比，晚上宁愿呆到图书馆不管也不想回宿舍。从此对学校，对这座城市产生深深的厌恶，想通过考研逃离苦海，所以才会连平时学习也对自己要求很严格。因为这一年的遭遇，我整个脱胎换骨，对人极度不信任，做什么都留了一百个心眼，心里极度敏感，觉得别人做什么都针对自己，别人的行为脸上表现一套，心里想的又是一套，总之觉得自己就是个道貌岸然的伪君子，内心阴暗面完全被刺激出来。当然这种种情绪我都明白，我只不过是自陷无端苦恼，根本谈不上抑郁症，虽然父母都很爱我，但我和他们的矛盾冲突也是随着年龄增长越来越激烈，从小也是个自卑的性格。让我意识到自己可能有抑郁倾向的，是已经决定考研开学后的某一天，晚上情绪完全崩溃，觉得活着没有意义，满脑子都是寻死的念头，觉得人生是黑暗的，在微信上和父母哭诉到凌晨三四点才累得睡过去。（值得一提的是，每次我和我妈哭诉，她都会说我不够坚强，内心不强大。但生理反应很自然地让我落泪，本来委屈的心理变得更压抑痛苦。现在哭之前还要提醒自己：你先坚强一会，坚强到不行了再哭）从三月份复习到现在，每天都在失眠，一个月最多有三四天是十二点前入睡的。后来开始吃褪黑素，已经吃了快六个月了，因为中午不敢睡午假，白天靠咖啡硬撑，导致现在肠道功能紊乱，一喝咖啡就肚子疼，褪黑素吃到现在也只能保证我两点前入睡。在离考研还有六十多天的时候，有一个礼拜每天都想哭，吃早餐都不觉得早晨是美好的，也忍着不敢给家里打电话。直到有一天背书边背边落泪，打电话回家哭了两个小时后，至今都提不起精神冲刺，每晚失眠到两三点，觉得人生没有希望，前途渺茫。现在离考研还有不到六十天的时间，我已经快两个礼拜没有出门了，每天不想说话，不想学习，也可以说是无法集中注意力看下书，情绪很低落，对什么都没有兴趣，这段时间每天一餐就可以饱腹。会找一些鸡汤来看，精神上的刺激持续不到一小时，又自动懈怠。无故沮丧这么多次，压抑到哭泣，也是第一次觉得自己过的真的不开心；自杀的想法之前也有过好多次，上大学后就开始有，今年最频繁。想过很多种，也试图自残过，但很怕疼，自己下不去手，如果有无痛死亡的方式，我觉得我可以抛下一切立马死去；今年家里老人病重，我甚至会冒出希望自己也身患绝症，要不就是已经活到半截身子入土的年纪，第二天立马死亡。想到自杀，我不会有什么年纪轻轻，还有很多事情没体验过就死去的可惜；在情绪最崩溃的时候，觉得死亡就是可以一了百了的方式；家人不理解你，他们觉得你就是矫情，太闲了不够忙，他们那个年代多苦多困难都能扛过来，你为什么不能？以前看到关于抑郁的话题，不能理解为什么正常人说“没事的，会过去啦”“你想太多了，压力别那么大”，对抑郁症的人来说是多么无力。我不想和任何人透露自己觉得有抑郁的心态，得不到理解的事情说出来就像自戳伤口，还有一个礼拜后请假回家，打算偷偷去精神科挂号。心态最大的转变就是人生没有意义，做什么都没意义，不仅是考研，成功了失败了又怎样呢？死亡反正是最终结局。,0,1
酸豆角,如果有知乎的网友想在这个问题下面找到自己出现的症状，甚至企图对号入座 自发给自己贴上抑郁症标签的建议去正规医院检查！真的不麻烦！真的不贵！不是说你真的患有抑郁症，抑郁症真的和感冒发烧一样，是病，只不过自己感触更大，旁人不那么容易发现和理解。得病了 配合治疗慢慢就好了。别拖着，也别疑神疑鬼真的怎么样，去检查，有病治病，没病别瞎想。祝健康 祝开心,0,0
立冬以来,现在的人就是惯的，稍微有一点不顺心的事统称抑郁症。都是青春期，自我意识这么活跃？,0,1
匿名用户,可能没有推荐我自己却要来搜这个话题的时候吧，这种表现已经很抑郁挂钩了，到底是不是，应该说已经开始有了，希望有个温暖的人拉我一把。也可能不是抑郁症，我也说不清。不知道抑郁症的人会不会有这种表现，连自己是不是都不知道。但我确定不严重，也是最近才开始的，工作十分的不顺利，还有一个不爱我的女朋友，我知道她不是给我温暖的人，反而会处处瞧不上我，我不是优秀的人。所以没什么，不优秀的人得不到爱情也正常。在距离家一千多公里以外的地方找工作，压力很大，工作很难找到的可能就保不住，试用期还在。还有贷款的压力，我很快住不起房，吃不起饭。她不会说加油，她会说你什么时候才能变好，对我很失望，我以为有她在，可是我还是一个人。一个人在远方。所以会抑郁吧。我原来是一个从来没有想过会跟抑郁有关系，现在看来，工作。爱情。希望变好吧,0,2
戏子,我自己抑郁症有近五年了，从小学开始一直到现在初中，重度抑郁没有人知道我有抑郁症，除了小学的时候自残被老师发现给送到心理辅导室。我也曾想过自救，后来还是算了1.体重暴跌2.没有食欲，我重度抑郁之后每天基本只吃一两餐，后面因为顾及比赛，逼着自己吃3.头晕，不是那种哐当倒下去的那种，是感觉眼睛聚焦不了，什么声音也听不到，严重的可能不能学习不能看书4.心悸，真的就是心脏那块地方死疼死疼的5.我也不懂什么原因，反正就是眼前突然发黑，脑袋一直响，听不见声音，路也走不好6.手机不离身7.有自残自杀倾向8.特别敏感，一有什么就鼻子发酸想哭9.很难过，就是没有原因，突然觉得难过,0,0
星河9.25,现在我又复发了。,0,3
匿名用户,没办法深度睡眠！很早就会自然醒，经常凌晨3/4点突然醒过来。然后继续睡也是6或者7点醒。对任何事情都没有兴趣，封锁自己不愿意跟外界交流。  没办法专注，容易分神。经常怀疑存在的意义，思想特别空洞。不过我这些都是轻度的抑郁而且没有焦虑症。应激性抑郁  目前看医生应该问题不大,0,2
匿名用户,1，困倦，是真的躺床上就睡。2，不饿，有时候忘记吃晚饭，到睡觉前完全不饿，肚子也不会叫，次日会想起来昨晚没吃过东西。3，每天晚上两三点醒来。4，焦虑。5，每天脑中盘旋着痛苦的记忆。愤怒，悲伤，哭泣。6，性格改变。会和所有人吵架。7，健忘。无论如何也无法回想前天的事情。,0,1
可爱崽崽,图图图图,0,0
北城相戀,不开心，一天板着脸,0,0
匿名用户,对任何人都没有期待无喜无怒，面无表情，眼神波澜不惊，像一摊死水了无生趣情绪隔离，正如太宰治《人间失格》里：“没有猛烈的欢喜，自然就不会有悲痛的来袭”经常性失眠，有时候甚至害怕夜晚的来临，早早在床上躺着意识却越来越清醒，而且容易胡思乱想对什么都提不起兴趣喜欢独处，讨厌去人多的地方不希望有人关注自己，极力降低存在感有自闭倾向极度自卑，感觉配不上她人的爱，不配被喜欢看到这个问题的其他答案发现自己可以对号入座，原来自己有这么多同类有点欣慰又好心酸，大家都有痛苦过往，希望你们早点遇到那个可以治愈你们的人，日后顺遂安乐，再无烦忧,0,0
