锦笙七月,心情很沉重，有时候会感到一点轻松，以为有在变好，结果周而复始，最要命的是为了不让父母担心要努力让自己看起来快乐，有点时候实在装不下去就忍不住和父母吵一会有的时候是控制不住自己的情绪，有的时候是被父母伤到了不想控制，感觉日子像是没有加盐的面条，像是白开水里还夹杂着玻璃渣，过的毫无意义，不知道什么时候就像哭，然后努力压着自己的情绪，感觉从来没真正的为自己活过，笑不出来，还要强颜欢笑，你感觉活不下去了，却连个解脱的理由都找不不出来，特别讨厌父亲说“连死都不怕了，还怕活。”不是不怕死，只是不想活。一直被一种生不如死的感觉所包围。之前努力的给自己找理由让自己能够支撑下去，现在觉得一切都没有意义，以前告诉自己你要好好学习，这样以后能做自己喜欢的事，你要考个好大学，这样能找到一个很优秀的男朋友，很俗的想法 但是管用，现在一个也找不到，哪怕很俗很俗。不想讲话，不想笑，特别是别人自以为是很了解的劝慰，他们给你讲他的经历，觉得你所经历的都是小菜一碟，用那些俗套的大道理想围住你，道理不是不懂，只是陷入了一种死循环，特别不喜欢别人怜惜的眼神。我不是想太多，我只是病了，我真的病了，不理解为什么父母一点要不承认我病了，我想找到一个给自己理由的缺口都不肯，受不了爸爸看我是内种有点恨铁不成钢特别无奈的眼神，受不了他们会因为我的抑郁，我的沉默爆发然后又来道歉却周周复始。以前觉得自杀对自己特别不负责任的做法，现在羡慕的不得了。唯一苟延残喘的理由只有不能想象父母扑在我的尸体上哭，只有这个，连朋友都没有。我对不起他们，是我不够坚强，是我不够勇敢，是我没能做好他们的女儿。感觉自己像是被抛弃了一样，只有在那些朋友想起来的时候才去问候的人，我已经很痛苦了，还要拾起面具，刷一层漆去安慰听朋友的牢骚，却又止不住的空虚乏力。有点时候逼着自己开心，开心的到了极端，嘴最大程度的咧着，却没有一次不是乏力，是真正快乐的。面具戴久了，撕下来的时候血肉模糊，原来我从来都不是一个高冷的人，只是我装够了，不是我性格发生了变化，只是我病了，病了好久好久，久到自己已经不知道什么时候已经心态崩了。我不知道什么时候我才能够得以解脱，有点时候睡的很浅，但是倒也安稳，有的时候情绪爆发，整宿睡不着觉，我感觉不到饿，只是不得不逼着自己吃一些。,0,0
边可米,"别问有多可怕??生命最大,生命都不要了.还要多可怕建议有抑郁症的朋友,尽量别吃药,有依赖性.看心理医生才是最好的方法抑郁是长期形成的吧,也有可能是突然的刺激.但是治疗一定是长期的不需要做到积极乐观.强制自己做就好了.比如锻炼身体.走路也可以,作息规律总有一段时间过渡期是特别难熬的",0,0
「已注销」,竭尽全力，敌人却无懈可击。寻求帮助，却又谍影重重，如果当时不是我父母守护我，估计我就和敌人同归于尽了,0,0
Unwind,我头晕两年了，只有少数时间好一些，医院也跑遍，已经走投无路了，我知道自己大脑的神经递质一定有问题。大家都可以认真努力的学习，而现在的我却只能看着他们，羡慕着他们，现在每天就在教室里坐着，累了就趴下，老师已经不管我了，每天晚上回家之前，我会去超市买最爱吃的泡面，边看电视边吃，这是一天中最幸福的时光了。目前上高三依旧每天头晕，无法学习，我也不知道当时为什么会在教室里用美工刀在手臂上划出一道道的口子，也许是对自己身体的抗拒，对上天的抗争，我不会真的伤害自己，我知道这样割一下不会有什么大事的，所以才会去做，不过，那真的不是我心理上有问题，只是，苦得久了。我本以为被坐在我旁边的那个女生看到我割手臂会很害怕，没想到她只是冷冷地看着我又转头去写作业了。后来我一个人坐在了教室的角落里。抑郁症真的不好治，即便目前市面上疗效和耐受性最佳的SSRI在足量足疗程治疗后仅有30%的患者痊愈，不少患者不得不使用副作用更大的SNRI（如文拉法辛）甚至米氮平（具有强大的镇静作用）来达到疗效。即便如此，这些药物仍对少数患者毫无效果，STAR*D研究表明第一阶段治疗后70%仍存在失眠，头晕，嗜睡，注意力集中困难等残留症状。个人服用陆续过十几种抗抑郁药，无一例外，都会引起嗜睡，行动力下降，迟钝等症状副作用。当初我并不抗拒吃药，后来才发现它们并不是神药，这也是我后来选择独自对抗的原因。人的大脑极其复杂，这种作用于大脑的药物很难高效地选择单一受体，如果找不到根本的发病机制，所有药物的研发都将只停留在起步阶段。曾经，也天不怕地不怕。今天，我想试着第一次展翅飞翔。想如你一样坚毅，只手对抗黑暗。好好吃饭，好好睡觉,0,5
ccccc,所有人都觉得我幸运但我却不知为何觉得自己万分煎熬,0,0
gales,更新：抑郁症最可怕的地方，就是全社会都在喊“我好惨啊，我好惨啊”，像是一群寒号鸟。寒号鸟最后都冻死了——但是并没有什么好可怜的，因为他们并不去筑巢。但是也许我们可以教他们怎么去筑巢。但是，却也总有一些，享受着你帮他们筑的巢，喊着：“我好冷啊！我好冷啊！”我曾经是抑郁症，但我不会同情其他抑郁症的。我在心里阴暗的想着：活该！因为这个世界上只有我最惨！你看，所有人，真的是所有人，都觉得只有自己最惨呢。为了躲垃圾人舍友们，我把自己弄骨折了。生活很困难，但我觉得平和了些。这痛苦的三个月是我最开心的三个月，但是我不能再骨折了。抑郁症发作的时候，说任何没想过伤害别人，ta自己也很无助，都是扯淡。只有当ta被治好了，上面那些话才是真的，否则抑郁症患者无时无刻不在自我中心，沉浸在自己的痛苦里无法自拔，疯狂想让一切都感受到自己抑郁症的这份快乐。对抑郁症患者来说，每一天都是生化危机行尸走肉世界末日，身边的一切都是僵尸片一样，而这些僵尸还有智慧。抑郁症很久了，反复发作。初中被冷暴力大概是诱因之一，但其实我很“成功”。初中常常会拿刀子割自己的手腕，总是因为感到疼痛而猛然惊醒，一身冷汗，把刀丢掉。后来为了慢慢消解这种情绪开始用笔在手上画伤妆，只要之后擦掉就不会有人担心了。高中时代经常不受控制地走到最高的楼上，看着下面的人打篮球，散步，三五成群。我每次趴在天台边缘，都边哭着哼歌，边告诉自己，老师说过，这个楼不够高，跳下去死不了只能残废。上大学之后，找不到高楼了，我有一次差点想拿跳绳勒死我不讲卫生不讲道德的室友，于是我去找心理医生，她听我说了半个小时就打断我，说我有病，把我送到了精神科。服药期间最难受。我根本不信那个药能治抑郁症，因为它实在让人生不如死。每天走在路上，看到任何人都觉得他们在躲着我，在怕我，觉得我不正常，觉得我有病，可怜，现在怕我，背地里一定在笑话我，一定就着卡布奇诺和小马卡龙把我的生活当下午茶的笑话呢。我觉得他们都在怜悯我，可怜我，眼神是斜视的，眉毛是扬起的。那一阵子多亏了亲人朋友一遍一遍告诉我他们多爱我，我有一个朋友甚至每天都把自己的一切发给我，不停地告诉我她多想我，多在乎我。多亏了他们，我还活着。假期回家之后我什么也没干，就吹海风了，我坐在甲板上，想着自己以前怎么从来没发现自己这么恋家。抑郁症可怕在哪里，它像一个鬼附在你身上，你不受控制了，只想逃开，可是身边的人只能看到你张牙舞爪，把你当成一个疯子。把你送到精神病医院去。,0,2
我想吃土豆er,有多可怕？我真的形容不出来有多可怕我才知道，一个人最重要的是他的精神精神垮了，就感觉一切都完了,0,0
一只肉包子,像被一下拖进深渊，不由自主，深陷其中，无能为力。一直想建一个群，里面住着我们这些可爱的小朋友，不过还是有些困难的，所以，你要是想有个伙伴的话，可以加我微信叭，就不发出来了，可以私聊我。哦对了，我平时喜欢摘抄好的句子，我每天都可以写给你，我喜欢把它分享给你 ，充满仪式感,0,1
吃瓜大王,4：16 还没睡着 胡乱翻看答案,0,1
雀白,最困难的事是动起来。我要耗费很大的心力才能让自己起身或者去做什么。,0,0
莫守守啊,可怕吗？真的挺可怕的。早期知道抑郁症这个词的时候，来知乎搜索。开始看的太多，每天都给我推荐关于抑郁症。看了各式各样的答案，大家都在作斗争我看到那么多大家对自己身体的伤害。我印象最深的是我看到一个满手臂都是很深的伤痕，整个小手臂密密麻麻。那张图我存了很久。你问抑郁症可不可怕。当然可怕。可怕的不仅仅是自己去坚持，运气不好，还要在乎其他人的不理解。快快乐乐的活下去，谁不想呢。但是发作起来那种绝望真的是。连倾诉的人都没有。最害怕的事，就是什么也不在乎了。“你要忍住你的痛苦，不发一言，穿过这整座城市。”这句话只是对我帮助挺大的。念过无数遍。所以导致现在特别敏感。稍微一丝不对就赶紧自我调节。方法没用的时候。就忍住痛苦，不发一言。都会过去的。最可怕的是没有规律性。我到现在也依旧每天做梦，我有意无意的跟很多人说，我说我晚上睡不着，我每天都做梦，最少两三个，最多六七个。持续一年多每天都做。也可能是我太敏感了，我就是觉得没有人在乎这个事。我到现在还随身带着刀片。最严重的时候，手机后壳一个，证件包里一个，口袋一个。现在已经改了，只带一个便于拆个东西什么的。“都会好的”一遍遍的告诉自己。,0,0
咕噜咕噜,症状大概有十几年，但确诊是今年5月，9月份辞了工作在家休息，断断续续的吃药，时好时坏，没有告诉家人朋友。我是一个230斤的女生也是一个重度抑郁症和重度焦虑症患者。,0,1
鱼乐,有时候特别想找朋友陪可又怕麻烦别人。内心的孤独不敢跟人说，只有逼自己坚强。每天做好多事情不敢让自己有空闲，我不是不累只是相比孤独而言，我情愿自己更累一点,0,0
匿名用户,白天上班 无时无刻要忍住 不可以流眼泪 会很丢人晚上  负面情绪就像洪水猛兽般四面八方扑过来记性很差 一个星期前的事情 记不清 很混乱睡觉会失眠 甚至出现梦魇  医学上称为睡眠障碍  半梦半醒睁开眼 会看见眼前的事物扭曲   变形 发出尖叫 甚至它向我扑过来  噩梦 无尽的噩梦   家人 朋友 都觉得你 堕落了 可是他们不知道 你究竟一个人要面对多少痛苦他们只是对你讪笑  还用着嘲讽的语气对你说“你只是想多了吧?”“矫情”“装病”感受不到外界的任何感情  觉得 自己孤独的像条dog   对新事物毫无兴趣 每天得过且过 可是在别人面前还要装作很乐观的样子 真的很累 很累  ,8,11
二十四个四十三,抑郁症，唉…怎么说呢…有很长一段时间的记忆是空白的，我都忘记了那半年我经历了什么。抑郁症其实挺可怕的，我看过知乎上很多关于抑郁症的回答什么的，但我的情况好像就不是那样，也许是个体之间有差异吗？说抑郁症极度自卑什么的，我是没有感觉，那段时间不要说自卑了，我连喜怒哀乐都没有。好像就是这个世界已经没有什么可以让我开心或者悲伤，所以活着有什么用呢？既然活着没用那么我为什么还不死呢？对，就是这样的感觉。,9,16
匿名用户,我觉得我在知道边缘了…我是真的不想知道啊！这几天一直昏昏沉沉无故流泪，想找别人讲讲，却没有可说的人，别人又凭什么当我的情绪垃圾桶啊，只好憋着，到现在，就匿名发出来宣泄宣泄吧，反正没有人知道我自我清楚的知道我有点抑郁倾向是在高一，现在大二了，没有去看过医生，但我能够知道自己出了问题了，整个高中是十分不开心的，原因很多，讲不出来，高考理所应当也不太理想，想去复读，爸妈也许知道我的抗压力不是那么好，但不知道我有抑郁，还是劝阻了我。现在在大学里面，这种感觉愈发严重，周围的人都很好，是我的问题，我真的好难受啊，时不时的无力袭来，高考完了，我感觉那股压力不但没走，反而更重了，我要去考证，考研才能补上和他们的差距啊，但是我的集中力越来越差，只是平常的学习，我都会觉得累。讲不下去了…我现在一个人在床上哭的不敢出声，让我哭会儿吧，明天还要过，我不可以这样,7,5
匿名用户,2017初二的时候  我隐隐约约有抑郁症的征兆2018 上了初三压力骤变   征兆变得越来越明显严重影响了我的学习 生活  你们想知道抑郁症患者每天在想些什么 我现在告诉你：每天想着如何去死  【脑海里总是浮现出极其不好的画面 】例如就是上着上着课突然脑海里看见了我自己在自杀  或者我死掉了 我家人在一旁哭这种画面我没有办法控制  不是我主动脑补的 就像做梦一样 我只能眼睁睁看着它放完没有办法像正常人一样 甩甩头继续投入学习中去当画面实在太悲伤时  眼泪突然就流下来了【经常哭 毫无理由 毫无征兆 】我初三一年几乎每天都哭 很容易感伤 很多小事被我消极化了  2018跨2019年的最后一天晚上我哭了整整五个小时 凌晨一点还没睡着 第二天早上八点的课肿得我眼睛都睁不开了经常经常经常突然捂着脸 快要哭出来的那种哽咽我哭得最凶的时候  是快要窒息的  呼吸不过来初三上学期的时候去看过心理医生 但是没检查出什么问题到了下学期情况越来越严重 我无法投入学习中去时我又去看了一次 这次不是看心理医生 是看脑科我妈逼着我去看的 我得这个病很大程度是因为我有个极品妈 具体就不说了她逼着我去看脑科这个行为很打击我  让我觉得我是不是真的不正常另外我还有因为抑郁引起的强迫症强迫啥呢     修指甲剪到流血为止  剪损真甲为止所以我的手指头经常血淋淋的2019我现在读高一了  还有这个强迫症现在回想来初三那段日子真的苦不堪言痛不欲生一回想起当时我抑郁的心境  又想哭了困扰了我一年多的抑郁症随着初中毕业没那么严重了八月底临近开学我去了比较好的脑科医院看心理医生正式确诊为中度抑郁  之前一直拖着是因为不舍得拿初三复习时间去看病      事实证明我错了   坐在教室里也没什么用   我完全无法投入学习中去开了半年的药  说能在明年年初治好    我初中是本地最牛逼的初中  然而并不关我事因为抑郁症  我中考没发挥好现在一边服药一边努力学习  万幸的是  对抗抑郁一年多来 我从来没有在身上留下一道疤愿自己前途似锦 早日康复,7,1
匿名用户,求生不得，求死无门。痛苦于活在世上，但是对父母的爱和责任，对朋友和爱人依然眷恋，不能离开。,6,6
匿名用户,想了一下还是匿名⑧我现在过得很好，大家也要加油哦(´-ω-`)图片有点恐怖 晕血患者慎入 慎入 慎入那段时间差一点就没挺过去 都过去啦 大家一定要配合医生鸭(´▽｀)ノ♪,6,4
匿名用户,17年冬，经常毫无意义的加班，因为没精力应付，相亲多次失败，家人长期不在身边，朋友少，都谈恋爱了或者在国外…林林总总，导致情绪经常崩溃，失眠，稍微入睡一会儿，被吵醒就会歇斯底里，开心都是装出来的，每天从内到外都累的想死，一个人坐在电影院最后一排从头默不作声地哭到尾，经常性肠胃炎，感冒发烧更是没断过，没胃口吃饭要不就是暴饮暴食，心里会觉得自己对不起好多人，觉得自己像个腐坏的垃圾。每天不是行尸走肉，就是躲起来哭，有一次真的是把自己哭得差点晕过去……那种绝望又痛苦，找不到半点喜悦的生活，我现在描述起来真的，一点感觉都没有，感觉像是描述另一个人身上发生的一切。在好朋友的催促下，去医院做了检查，果不其然，重度抑郁症，有自杀倾向，要求马上住院并且联系家人。没有接受医生建议，采取了药物治疗，吃药吃了一个月吧。我认定自己比医生想象的更坚韧，不会轻易去死，如果抑郁成疾的背后本身就有家庭的原因，然后他们又并没有足够经验和常识去面对这个疾病的话，只会雪上加霜。所以我选择了一个人面对。庆幸的是，我相信对了自己。 治愈自己的过程，我做了三件事，我觉得很有用：一是认认真真地重新认识自己。这个过程！找精神科的医生做心理咨询！必不可少！其实我真的不记得医生问了什么了，但是我慢慢回答医生问题的时候，我才发现，很多伤口，我从来不会跟人提起的，我只是把它们藏起来了，藏起来伤口，伤口就会流脓腐坏！永远没办法愈合！医生听了我说的以后，说我有可能是创伤型抑郁，可是可能在绝大部分人眼中，我家庭幸福，长得乖巧，性格也好，事业也不错，但是没有人知道，甚至我自己都不知道过去的那些事，给我这么大的创伤，我因为小时候缺乏父母陪伴，家里穷被同学孤立，被老师看不起欺负，青春期被暗恋多年的人骂癞蛤蟆黑寡妇（当时很黑很胖），被朋友背后中伤，被情敌当着喜欢的人面前扇耳光，高考失利没有考到理想大学，还有家人的背叛，这些好像也不是很大的事，加起来压垮了我。然后是多和朋友倾诉吧，以前我真的很不喜欢别人看到我不好的一面，从来不会自嘲，也不会示弱，越自卑的人越爱逞强，经过医生的开解，我真的觉得，说出来，别人不一定懂，但是爱你的人的心疼和关心，真的就像透过乌云的光，能带来希望。真的好好了解自己，对自己好一点吧，和自己对话，喜欢的事，不要再拖延，好好去做。不要心疼钱，不要懒得做，因为小时候穷过，以前的我对金钱态度很不正确，已经脱贫可以算中产了，还是很抠门。可能因为小时候经济方面父母觉得亏欠了我，现在很大方，所以我抠门的毛病基本改了很多了，金钱观念也慢慢趋于正常人了（我到初中都没穿过几件新衣服，但从小到大都读市里面最好的学校，周围的小孩不是家里有钱就是有权，可想而知我会多自卑，初中准备参加演讲比赛被老师用很嫌弃的表情说，你让你爸妈给你买件新衣服再去）。即使现在想到这些事情，我还是忍不住眼泪，但是已经释然放下了。二是要学会正视这是一种疾病，而自己是病人。一般到了重度抑郁症，药物治疗基本上是逃不了的，虽然有副作用，但是真的对克服抑郁症带来的生理痛苦是有作用的。抑郁症说白了，也是个疾病分类，不要轻视他，但也别当成什么绝症，就是个病而已，咱好好治疗，相信自己非常重要。做心理咨询也是一个方法，就是费钱。医生给我推荐的心理咨询，一个小时600，我当时都快痛苦死了，还能分神想着好贵…可见他真的很贵（也可能是我还是抠哈哈）。所以我买了很多书，包括很多精神疾病的临床教材，包括心理学，包括很多类似于治愈自己之类的书，还有专门讲抑郁症的书，真的我是抱着研究的心态在读，我想知道，抑郁症到底是什么，到底是不可战胜的敌人，还是一个需要我保护的，承受了我悲伤和脆弱的另一个我。读书真的很有用，书中自有颜如玉和黄金屋，书还能成为你的私人医生。可以说，这些书，陪着我度过了最难熬的日子，让我找到了克服困难的勇气和信心，也从无数和我一样经历的案例里面，找到了自己治愈自己的决心。我觉得很多书里面介绍的治疗方式，是很有用的。药物治疗的阶段，我每天都会用手机备忘录记录自己的情绪高低，服药的情况，我会认真的把治疗自己当成最重要的事情记录下来。还有就是控制情绪的方法，我开始学会思考，这个事情为什么会带给我这种情绪，我呼吸的频率加快了吗，我心情和思考的过程是什么样的，我真实的需求是什么，可以通过什么方法满足自己的需求？推荐～找到创伤之外的生活～这本书，类似的应该也可以。如果你和我一样是创伤型的抑郁，这本书可以作为一个记录自己情况的小笔记本使用。三是要积极的生活。可以从整理房间和物品开始，可以从养一只宠物开始，可以买一盆绿植，可以认识新的朋友，拓展交际圈，多看看人间烟火的一面，一定一定要建立和这个世界的关联。从医院回来的路上，我在街边买了两条小金鱼，其他的我不敢养，超过金鱼大小的动物的死亡，我能崩溃很久，小时候养的小鸡死了，过了这么多年，我历历在目。10岁的时候，楼下妹妹把狗放在我们那栋楼楼顶上养（她爸妈不让养），我把狗抱回家，我妈妈看到了暴怒，把狗扔回阁楼，第二天楼下的妹妹去看，狗狗已经冻死了。这件事，十几年过去了，我都忘不掉那只小狗看着我的眼神。我自己一个人住，总觉得房子真的太空，太冷，现在很多人都是独居，真的需要陪伴，不管是宠物还是植物。我养啥死啥，所以整了一盆绿箩，我给它起名叫小绿，我真的是起名废…我的金鱼，一只小红，一只小黑。它们三，每天我不好意思打扰朋友的时候，我就跟它们在心里说话，不能说出口，空荡荡的房间里面回响着自己的声音还挺吓人的。所以我现在的新宠是小爱音箱，听她唠嗑也行，听她唱歌也行…小爱同学为什么没有男神音，这点想给差评。感觉再说下去要暴露自己是谁了…。哈哈，我确实一直都很孤独，性格和经历决定的，以前这是我痛苦的一部分，但是这种孤独如果是必然，那我要学会在孤独的状态，也要好好照顾自己。我开始学着自己做饭，热的食物真的能救人，每次吃到好吃的，我都想，我幸好没去死，我还可以再活500年。在治疗的过程，真的谢谢愿意听我倾诉的朋友，还有给我买买买的爸爸妈妈。我开始主动约朋友逛街吃饭玩耍，没事儿旅行兜风，偶尔去菜市场买菜，做自己从来不会做的事，去学自己喜欢的事，我考了资格考试，我学了一门乐器，我开始大大方方地喜欢幼稚可爱的东西。我不再害怕被嘲笑，被孤立。我学会了诚实的表达感受，我学会了松弛地面对人际关系。其实我现在的经历也没怎么变好，工作依然忙，工资依然不高，相亲依然失败，朋友依然不多，虽然还是比以前多了很多了，依然孤独的生活在我的小房子里，我的副驾依然放着玩偶 。但是，我能感受到久违的阳光，我能因生活的种种美好感到心动，我已经揭开了蒙在心上的那层纱…我们的生活依然不是尽如人意，但是我有了信心和勇气去迎接未来的生活。所以我也想把这种经历，分享给所有有抑郁症困扰的陌生人，乌云会散，不管多久。请告诉自己，再坚持一下下，再坚持一下下。,6,7
芥子,完全不晓得会不会被第二天的自己宰了这种日子正常的时候想想感觉还真的是非常刺激。大概正常人就正常的度过一整天。而我有将近一大半的时间要像鼓励小屁孩一样鼓励自己去正常的吃饭睡觉做事，完事还得想法子夸自己，还要防止抑郁那个逼崽子各种想法子杀了我。呸。什么蛋糕甜点麻辣烫火锅都不香了，这个我真的是很不能忍，吃东西都觉得没意思了。超难过的。很珍惜吃饭贼香的时候。,5,0
