匿名用户,今天刚从医院回来。做了一大堆检查后，医生说我有严重的抑郁症，需要住院治疗。我先是崩溃了，然后觉得没什么，我本来就是来看抑郁症的。然后我纠结是不是要住院，特别纠结，决定困难。之后努力努力平复心情，分析住院的利弊，太害怕被别人当做精神病人，前途也毁了，决定不住院。医生开了几样药，文拉法辛之类的，让先吃一周。我纠结了好久要不要去拿药，还是微信告诉了妹妹和闺蜜，她们都是医生，让我一定要去拿药。原本已经走出医院的我又回去拿药。出了医院蹲在地上哭了。不知道打车还是坐公交回家。站在公交车站台，纠结了好久，好几辆公交车都错过了，发现没有零钱，决定打车。终于打到车了，师傅问我到哪里。我说到某某路桥下。可能还有一两公里的样子，师傅问我，是这里吗?我说前面路口。前面路口明明还没有到目的地，因为我已经说了前面路口，感觉不好意思让师傅送到目的地，让师傅停车了。停完车我走路，下了地下通道后，我迷路了。然后从容原路返回。大概一公里是的距离，我走了一个多小时终于到了。期间家人打电话我不想接。发短信我不想回。看到未接来电，不管谁的，都不想理。以上这种状态一直伴随我很久了。无论做什么事情，心里会先琢磨一万遍，最后多半是什么也没做，逃避了。逃避以后，会有各种各样的借口。孤独。感觉没有人真的懂我。很多事情自己看不惯，心里很不爽，但懒得说，憋在心里。所以从来没有和人起过争执。看到熟人我不想打招呼，能躲过就躲过。幻想了一万遍离婚后的生活，幻想了一万遍我死后的场面，幻想了一万遍与所有朋友绝交。。渴望家人的关怀。但当他们真的关怀的时候，我总觉得不够真诚。和朋友在一起，怕麻烦他们，不想欠任何人人情。有些时候为了推辞朋友的盛情不惜撒谎。所有社会交往的能力都欠缺。往往不知道如何回答别人的询问。分不清玩笑还是认真。不会主动找人聊天。不说八卦。听八卦不知道怎么反应。不会拒绝别人的请求，哪怕这个请求很过分。喜欢自责，喜欢反思。从不做违背道德良心的事情。即便厌恶到死的人，也从来不敢表现得多么厌恶，还客客气气生怕得罪别人。但是有些事情却又无法包容，容不下别人的一点点小错误，投诉别人可以不过脑子。失眠。尤其是心里有事的时候。对什么都没有真正的兴趣和热情。对未来生活不那么向往，哪怕有人给你描绘得多么美好。从来没有敞开心扉高兴过。哪怕陷入热恋的时候，心中也有疑虑。时常莫名其妙崩溃到哭。却没有什么事情真的感动我，哪怕爱人郑重许下的承诺，哪怕特意安排的浪漫，哪怕我孩子的到来。即便失去亲人，每每想起泪流满面，但葬礼当天却是怎么也难过不起来，没有眼泪也没有悲伤，只能哀嚎式的表演。明明已经如此难堪，如此难过，如此明显，在不了解我的人眼里，我是一个乐观开朗，心地善良，彬彬有礼，有点孤傲，也很真诚的优秀的人。工作中民主选举从来都是得票第一，年年被评为优秀。生活中我是一个好女儿，好姐姐，好妻子，好母亲甚至是好媳妇。我做到了对所有人的好，唯独对不起自己。极少有人知道我经历了什么。没有人知道我走过什么样的炼狱。,1,0
匿名用户,打了一长串字，又删掉了。我觉得还是把记录下来的情况复制粘贴好了。2017-11         18:17现在，我陷入了抑郁还比较轻，大概是4分（我会把自己的抑郁程度划分为1—10方便记录）为了想赶紧记录我心里感到焦急导致我腹痛并且起鸡皮疙瘩我刚刚想到了以前甚至是就在刚刚发生的美好的事情能让我开怀大笑的事情刚刚还在微笑着回想的我在这一瞬间脸就僵下来了我刚刚仿佛看到美好的过去都像镜子一样全部碎掉了“那些只是过去，未来不一定像刚刚那么好”“美好的总是转瞬即逝”“不要憧憬那些东西，他们会消失的”“你不能握紧它”巨大的绝望向我压来。我感到难过和心疼。心脏真的能感受到一阵一阵的疼痛好悲伤，好难过明明没有音乐却觉得自己的心里已经响起了悲曲越来越觉得没有希望就是这样的感觉2017-11  星期五下午有9分的抑郁一直持续到晚上00:00和信任的人连麦才结束。这半年以来最难受的一次    决心都动摇了，让我想到了死亡以上。我将我的发病情况记录下来只是为了更好的了解自己并想找出一些规律去思考。曾经最痛苦的一段时间（10—20分）我会用小刀划手臂或是脚腕，但因为开始接触心理学并广泛社交我的病情算是减轻了很多（至少我不会再想死了）最近我的抑郁总是会在下午五点和六点左右出现。比起和人倾诉我更愿意自己写一些东西靠抽烟喝酒和疾走来发泄自己内心的悲伤，这段时间我不会和任何人接触，我希望我能变得更好，但这样的念头在傍晚开始难过时就烟消云散，根本不会再出现了。因为那种悲伤是真的能让你像沉入海底一般真的喘不过气，让你脑子一片混乱。,1,0
匿名用户,感情冷漠，感觉对亲人都不知道怎么面对。什么也不想做，宁愿躺在床上失眠。对什么都没兴趣，包括性。也想开心，可是怎么感觉那么虚伪。,1,0
匿名用户,从第一个回答一直往下看 心里感到没那么孤独了 我们的症状真的很像很像 我也不那么自责了 我确实是抑郁症 但我一直认为我没有那么严重 但是看了这些同病相怜者的一个个回答 我发现我真的病得不轻 好多症状都很像 我早就被确诊为抑郁了 第一次查就是重度的 但我心里一直认为不仅仅是这个病的错 我觉得我意志力不行 该死 但看了这些回答 我释然一些了 真的 病魔太可怕了 我大概有一年没有接触文字也没怎么和别人交流了 不知道我打的这段文字是不是有点语无伦次 其实要我描述我的症状 我这些年的痛苦 一万个字我都能写得出来 但是我累 我好累 我懒得写 好累 但我还是希望我在活着的时候能好好记录下我这几年的经历 看那天精神好一点 再打字吧 我要打好多好多字 在不暴露自己的情况下 好好地诉说自己 不管有没有人看 因为我这个是更多地是写给自己 既然不能做些什么让自己少遭受些折磨 我唯一能做的就是记录下它 给自己一个交代 打了这么多字 真的好累 那我给自己总结一下 如果用最少的字来概括我的抑郁症症状 那我可以总结为一个字 累顺便一下 如果有神看到我 请救救我 不胜感激 救救我 ,1,1
wanderlust,帮忙回答下吧谢谢自残过每天没理由的想哭想哭哭不出来有时自卑有时自负我闻见味道 朋友都说没闻见每天睡不够想死又不敢就算有开心的事刚笑了几秒就又不知道原因的想哭嗜睡每天都睡不够一点点都不想学习老爱发脾气在床上躺着的时候感觉什么姿势都难受(纯洁点谢谢),1,0
匿名用户,今年13岁，感觉自己抑郁了，正在想要不要告诉父母，如果告诉他们我的抑郁治好了怎么办,1,1
REVIVE,那不谈恋爱就好好的   一谈恋爱 就会有其中的一些症状抑郁症？？？不是zuo吗？星期五该去找你!!!,1,0
王木木,并不想要评论任何事情。看看就好了。,1,1
笑看世俗,时刻感觉做什么都没有动力！对什么事情都提不起兴趣！很在乎别人的想法，负面情绪很多！做事情拖拉！一件很普通的事情就很容易往负面的方向想！,1,1
此间少年,上大学之后每年都会有心理普查，我大一的时候查出来是有点问题，然后被叫去谈话，当对面的心理老师问我有没有想过自杀的时候的确很震惊，我有这么严重吗？后来又有一次谈话，我觉得说完也没有什么用，就没再去了。也上过一些心理有关的课，或者有些课堂上老师会让做心理自测，每次测出来都是轻度抑郁，后来大二大三做心理测试的时候因为不想再被谈话了，就一直按着看起来正常的答案填。其实身边的人也没有觉得我抑郁，我平时跟她们也能一起玩一起笑。就是觉得我情绪来得比较频繁，容易烦躁容易焦虑，而且那种时候不想说话，就不爱理他们，朋友就觉得我很冷漠，他们约我吃饭看电影也很费劲，因为我总说没什么想看的，没什么想吃的。室友说到毕业旅行我也说没有兴趣，没什么想去的地方。会突然有一段时间做什么都没有动力。平常不爱等人，不喜欢很多人一起行动，更喜欢一个人，久而久之，他们就会觉得我这个人真的很没意思，或者是我会觉得他们认为我没有意思。可是我又比较敏感，别人对我有什么意见我都能看出来，然后就会生出一种没有人懂我的感觉，会觉得很忧伤，有时候想多了会一个人在晚上难过得哭起来。上次生病了，一个人去吊了四天水，其实就是简单的上火发烧，但是一直都不好，心里也特别难过，晚上一直睡不着一直哭，第二天醒来又觉得自己怎么会这么脆弱。不知道这是不是算抑郁症了，其实也不知道一个心理完全正常的人应该是什么样子。写得太乱了，就是看到这个话题挺难过的，想写点什么。,1,1
Alice,人能理解骨折的人没法走路，却不能理解抑郁的人无力生活 道理我都懂阿 可真的看不到希望 没人能理解抑郁者的痛苦 我真的很讨厌这种感觉 每天就觉得心很空 很痛苦 可每次自杀都是欠缺哪一点勇气 总感觉自己舍不得 可自己舍不得的人确永远不理解自己为什么这样  安慰自己会好的天快亮了 可天亮以后生活还是这样...,1,0
Kira,emm我把我的感受写一下，希望大家能帮忙判断一下1.对别人对我的看法极度敏感，自己会想他们觉得我奇怪之类2.早上起床心情特别不好，但是晚上很精神3.不敢去学校面对同学4.会反复想自己做错的事情，然后否定自己5.有时候会手抖6.有什么感觉比较好的事情发生就感觉我根本不配7.非常悲观，觉得希望永远不属于我8.自己大概是世界上最没用的人9.偶尔会有胸闷和呼吸困难的感觉10.经常不想跟人说话11.很容易崩溃，经常在学校憋着眼泪12.怕别人对我有看法，所以一直不发脾气，但是心里不舒服13.喜欢看负能量的文章或者书籍希望没有抑郁嗯应该没有,1,1
匿名用户,希望 我 会很 快 死去 ,1,1
匿名用户,像一个失去味觉的人，尝了很多颗糖，却感受不到糖是甜的。,1,0
李知恩阿,身边有个男的特别恶心，我三月份被车撞眼睛看东西有重影.好几次我说想死，我就自残啊  用的是刀片.这男的就说你割给别人看的咯？看到池子就说：你不是想死吗？跳下去啊。就算你不相信别人抑郁什么，你也不该拿别人的事说笑。不用激我。后来我把这男的删了  ，我死不死关他什么事啊,1,3
留恋夜晚, 想哪天被车撞死或者得个无法治愈的癌症一了百了,1,2
持戈者,奔溃痛苦自残，麻木封闭，压抑窒息，等等等等，每天想死，吃药割脉，烧炭，一直没死成，一直想捐献器官，所以没跳楼,1,10
特朗博,首先，我们需要把“感觉很抑郁”和“得了抑郁症”区分开来。但凡是人，都会有情绪非常低落乃至抑郁的时候，比如一觉醒来，窗外全是雾霾，感觉待在北京就命不久矣，于是抑郁；早起上班，晚上加班，累得像条死狗，工资跟一到下班准时打卡的傻逼领导差了5000块钱，于是抑郁；晚上到家，洗澡遭遇停水，上网遭遇隔壁下毛片，每到晚上12点，公共卫生间传来歌声…于是抑郁。这些都属于感觉很抑郁，和得了抑郁症完全是两码事。感觉很抑郁的人，可能在微信群里抢了个超过50元的红包，就能瞬间高兴起来。抑郁症则不同，它是一种精神疾病，持续时间往往较长，且不会因为你的个人意愿主动消失不见。抑郁症一般有如下症状：1、 对平时喜欢做的事情失去兴致2、 觉得自己一无是处，活着毫无意义3、 嗜睡或失眠，注意力难以集中，常常感觉筋疲力尽4、 经常有自杀的想法但是，即使你满足上述情况的多种，也不代表你有抑郁症，想确认自己是否得了抑郁症，请去正规大型医院进行专业检查。世界卫生组织对抑郁症有过如下介绍：1、抑郁症是一种常见的精神疾患。全球有超过3亿人患有抑郁症，遍布各个各年龄组2、抑郁症是世界各地的首要致残原因，它是导致全球疾病负担的一个重大因素3、抑郁症患者中女性居多4、最严重时，抑郁症可以引致自杀5、抑郁症可以得到有效治疗目前有一些医疗方案可以有效治疗抑郁症，且不会让人产生药物依赖，或者让人失忆，让人变成白痴。如果你已经确诊得了抑郁症，请求助于医学的帮助。请你明白，抑郁症不是个体软弱的表现，也不属于你的性格特征，你只是需要专业人士的帮助，仅此而已。如果你身边有朋友得了抑郁症，请不要认为抑郁症是玻璃人有颗玻璃心，或者是吃饱了撑的没事干，ta需要的是你的关心，而不是妄下断言，甚至是诋毁。无论自己、或别人有没有抑郁症，人和人都是可以交流的。请打开自己，请向他人释放你的善意。哪怕我们做不到完全打败抑郁症，至少也要做到心平气和地与抑郁症同行。资料来源：世界卫生组织官网：http://www.who.int/mediacentre/factsheets/fs369/zh/科普视频：What is depression?传送门：https://www.youtube.com/watch?v=z-IR48Mb3W0李松蔚《如果一定要传播抑郁症，不如传播一点有用的》,1,0
匿名用户,请让突如其来的意外夺去我的生命吧！很累很绝望。,1,0
劉雨晨,看看崔永元就可以大概了解了。,1,0
楊一啊,每一天都是一样的，很累很累，连眨眼都很累，吃什么都想吐。每天下午情绪泛滥的时候看到别人的笑脸，我都觉得，世界离我太远太远了。,1,1
匿名用户,无邀，强答一波吧。没看过心理医生，自己感觉应该就是吧。最严重的时候是十一年前，其他没什么印象了，就是不敢去阳台。有点恐高，但主要还是怕上了阳台就抑制不住翻过去的冲动。后来慢慢地就好了，偶有反复吧。感觉就是，经常和别人相处时知道某个时刻自己应该笑，应该有所表情，就努力把应该出来的表情，动作表演出来。而心理上真的没有任何感觉，就好像死水一样。有点累，而且如果对方冷会场的话，就会很茫然无措。心疼儿子，会看到茫然无措的我。虽然两岁的他还不懂什么。,1,1
匿名用户,基本对一切事物没感觉。,1,1
生性薄凉,【抑郁症的症状; 】   一，经常失眠，记忆力下降，思维迟缓，对什么都不敢兴趣，非常自卑，很多悲观觉得自己做什么都是失败的情绪，逃离社会大众不愿意和别人打交道，情绪波动较大，老觉的活得没意思等等，在情绪低落到自己无法承受的时候尝试自杀来获得解脱。,1,0
匿名用户,害怕出门 路上被人看一眼都受不了,1,0
Bojack,之后的我生命里面我不希望看到他们出现我的内心认定为死的事物 我都不会再有任何感情 哪怕我们曾经有多么的熟悉和接近一旦我的内心下了定论 连我自己也无法更改他们在我的心里与死人无异我没有必要去在意死人的感受感情这种东西已经很久没有给我任何影响了曾经一段时间 我确实患过抑郁症就算在旁人面前可以不作修饰的笑我的表情也可以在一秒内切换那段岁月我就像是掉入了深海的海底从能感受到海水的冰凉到无法正确的确认感知好像 我被一团薄膜罩住了我的感觉被夺走了至今我仍旧觉得最残忍的惩罚 不是死亡 而是剥夺感觉的能力如果时间可以倒退我相信每个人都有自己的存档点那就是幸福的瞬间而我的存档点 是一个人吹着夏天晚风的瞬间 因为这时 我断了所有感情仿佛这个世界上 只有我存在我的抑郁症从来就没有完全治愈吧希望 是多么奢侈的一种东西,1,1
匿名用户,1、动起来，去做你该做的事。2、不要轻易有自杀念头，自杀不能解决什么事情。3、生活不是充满消极，有很多开心的事不是吗？4、你很棒，你多好啊，你要爱你自己。5、一定要找周围的人倾诉，不说出来的话只会更严重。6、也许只是一时的困难，不要想太多，过了这段时间就会轻松很多。7、实在不行去找医生看看吧，能够治疗的。8、你以前不是这样子的，想想你以前是如何开导别人的，难道你不能做到吗？9、你的情绪太波动了，冷静下来，这或许只是你的心理暗示。10、这些我都知道。,1,8
匿名用户,，,1,0
Reality,    其实抑郁症症状百度百科一下都会出来，但是我觉得并不是那么的极端。会出现一部分的症状，或轻或重。其实那些症状任何人都会有，大部分人能够尽快摆脱抑郁的状态，只是有些人自己没法解救自己。    抑郁症，难免恐惧，对很事情变得敏感！恐惧死亡，却又不能避免，变得更加沮丧与恐惧，会觉得只有死才能摆脱这种痛苦，这像是一个死结，把自己捆在里面，出不来。    作为一个曾经患过抑郁症的人，当我回首那段岁月，眼角依旧会闪着泪光。很多时候其实自己很想得到别人帮助，但又害怕别人知道。在那个对于抑郁症还不是很广泛，很被别人关注的年代，抑郁症并不同于其他的疾病，是一种精神疾病，得病的人也自然成了精神有问题的人。其实也无可厚非，因为没有亲身经历过，也很难理解。就像越来越多的自杀，虽然以我现在的认知去理解，我并不赞同这样做，但是我能理解他为什么这么做。很多人会说连死都不怕还有什么过不去的，其实我想这是站在正常的认知看待这个问题，死亡是生命最后的终结。但是在那一刻，我想这个顺序是颠倒过来的，痛苦与死亡的顺序～我一直坚信着真的有舍身取义，杀身成仁的存在。在绝对的信仰面前，人的精神变发生很大的变动～每个抑郁症患者都曾渴望得到帮助，但有难以启齿。我想随着人们对抑郁症的了解，不再把抑郁症作为一种特殊的疾病看待，它就像感冒发烧一样，只不过治疗的方法不同而已。这种状况也许会好很多。走过这一切，我想说的是，其实抑郁人人都有，抑郁症也并不可怕，每个人都会遇到困难，也终将走过那段黑暗，只不过过程比较痛苦而已，哪一种疾病治疗的过程不痛苦呢？经历无数的痛苦，希望能有成长，可以自信地说，我曾经有过抑郁症，但我现在很幸福！,1,3
随便磕磕,我不知道自己怎么了，头痛，易怒，朋友说的一句话一个眼神我可以生气一天导致失眠，然后一天到晚只想躺床上。不想和任何现实中的人交流，有人在旁边说话会导致我情绪暴躁，然后忍着，然后头更痛。无缘无故就想哭，我真的不知道是为什么哭。然后就是想死。初中的时候也有过自杀，不知道那时是不是抑郁。,1,1
匿名用户,感觉自己活不长了，总有不好的念头,1,2
匿名用户,敏感易怒暴躁脾气古怪自卑焦躁胆小懦弱孤僻惧怕交际，对什么事情都没兴趣，小时候也是有梦想哒但是长大变得越来越认清现实但是不想面对现实，为自己的逃避找借口，因为一点小事就被压垮，无缘无故的崩溃大哭，有的时候生气到极点控制不了就反复的打自己耳光让自己振作清醒可是没用，上了大学回来以后发现初中高中的同学没有一个是可以玩在一起的 害怕别人因为我的性格讨厌我所以不敢尝试交朋友，有时候孤独到大哭 心里想就这性格 活该没人喜欢活该没朋友 可能心病还要自己来拯救自己 不知道是不是患上了抑郁 害怕精神类疾病真的 怕自己走上我爸的路 因为我知道身边的人会有多煎熬，想要重生，想要被拯救，想要积极的活着，想要交朋友，想要勇敢做自己喜欢的事，想要变得让自己爱上自己，怎么就这么难呢？,1,0
匿名用户,还在读小学的时候，产生了很严重的厌世情怀，还记得当时拿着考了75分的英语试卷，在卧室里尝试憋死自己的画面到现在依旧清晰，那时候，我不知道什么是抑郁症。到了读高中的时候，习惯性失眠，整三年的夜晚睁着眼看月光，疲惫到奔溃却无法入睡，每天早晨头发大把大把掉落。我跟我妈说：我晚上老是睡不着，带我去看医生。我妈说，你不要整天想那么多。那时候，我不知道什么是抑郁症。直到我出来社会工作，偶尔会心跳加速感觉窒息，明明什么事情都没发生，明明没有什么大悲大喜，但是心头憋得难受，无法呼吸，感觉下一秒就要倒下了。我甚至去医院查了心电图，医生说，你没病，就是熬夜多了，年轻人不要总是熬夜打游戏！到了那时候，我依旧不知道什么是抑郁症。从小到大，一直都有暴饮暴食的恶习。每次自杀的情绪非常强烈的时候，每次胸闷到无以复加的时候，每次整夜失眠依旧无法闭眼的时候，我就去吃，吃很多东西，想要让食物把这些空给填满，一个25岁的女孩子，这么多年，吃成了一个142斤的大肥婆。从高中到现在，习惯性失眠仍然伴着我。一个星期总有三四天睡不着，身体很差，皮肤很残。直到现在，我知道什么是抑郁症，但是依旧不知道自己怎么了，怎么总是无缘无故厌世，怎么无缘无故失眠，怎么无缘无故奔溃。我想用哭来缓解这种感觉，但是我一直哭不出来，连一点点眼泪都憋不出来。活到25岁了，我自卑，我自弃，我抬不起头正视自己肥硕的身躯。这些年过得都特别累。但是也没人知道。我知道我可能病了，我没办法去看医生，因为，,1,2
WalkingDan,一碗毒鸡汤http://miaopai.com/show/IlUzGv6ersjvjV0n3XYlnQ__.htm,1,0
毛毛君,看到镜子里面的人，觉得不是自己，不想再看到她。无法集中精神来娱乐缓解情绪，总是忍不住自责，吃饭觉得不香，不想和人现实交流，一晚上睡觉醒4 5次。要不然就是失眠睡不着，放大身上的病痛，时而焦虑紧张，感觉自己就是个垃圾，不配活着，因为活着给周围人带来痛苦。,1,1
heeee,我不知道自己是否真的抑郁。做过两次量表 上次是轻度，这次是中度。刚看到一句话，幸福的人一生被童年治愈，不幸的人一生都在治愈童年。联想到我的童年生活，我现在能想到的来自父母的鼓励寥寥无几，我从小就被他们否定，几乎没有得到过夸赞，童年于我而言不是快乐的。慢慢的长大了，或许习惯了，就觉得自己不行、笨，现在也是在一直自我否定中，习得性无助。说说最近的情况吧：失眠，从来没有过的症状，现在已经大半个月了，我很难受也不知道该怎么办。平时在家里，父母在家我都会缩回自己的房间，不想面对他们，我感觉很压抑，喘不过气来。与我妈矛盾最大，她总是看我不顺眼，我也不知道哪里做错了，就是感觉没有爱。很陌生。她住的卧室我一般进不去，她出门就会锁上哪怕我在家，我不知道她在防范我什么，她对我很好，但总我们之间的关系不够亲切，我也很少和他们谈心，根本不能理解我，我不爱说话。父母在我考试不如意的时候不会骂我，嘴上说着没关系下次再来，可是我能感觉到他们是不开心的，是，我让他们失望了，我不够优秀。每次放假回家不到两天，就让我学习学习学习，从小到大也是，我不能和朋友出去玩就只能呆在家里，一刻也不能放松，我笨，我不配放松不配玩耍。我的发型、我的衣着我也决定不了，我只有身体是我的。初高中自杀过，割腕，流血了，那一刻真的想离开这个不美丽的世界。高中那次，当时我妈在我面前，看着我的举动不但没阻止我还对我说：你又故技重施了。多么可笑啊，真的太寒心了。最近几天也是这样，接连而来的失败，六级第三次没过，教资不知道能不能过，我不知道该怎么面对他们，很焦虑很无助。打完这些字我已经泪流满面了,1,0
