啊嗷西,仅作为病人回答问题，仅供参考一、最难意识到的就是躯体化此时的躯体化理解成生理疾病把此时的躯体化归结于其他原因二、生活中的具体事件（失去亲人、客观生理疾病影响等）导致情绪长期低落，容易被看作是“还没放下”、“太过在意”等等，无法意识到此时已经处在抑郁状态中，需要开始接受治疗。三、谈论抑郁症的频率增加，（随便乱）说自己患了抑郁症的人增多。抑郁症离我越来越近，以至于我不敢确认我真的得了抑郁症。一、躯体化抑郁情绪有时比躯体化后到来，有时同时（认为潜在抑郁不能说成潜在抑郁症）。（转载神经学社区“可能出现的躯体症状”系统总结）① 神经系统：全身乏力、发僵、持续性的疼痛、头痛、头晕、头昏、头脑不清晰、记忆力下降、焦虑、不安、注意力不集中、睡眠障碍、持续疲劳、乏力；② 消化系统：食欲减退或增加、食后上腹部不适、消化不良、无饥饿感、口干、口苦、口中异味或口臭、恶心、腹痛、便秘；③ 心血管系统：心慌、心动过速、胸痛、悲痛、心前区疼痛、胸部压迫感或紧缩感、血压波动；④ 呼吸系统：胸闷、憋气、气短、常长吸气或叹气、气管/喉头/胸部的压迫感；⑤ 内分泌系统：异常的怕冷或怕热、体重减轻或增加；⑥ 生殖系统：性欲减退、性快感丧失、阳痿或闭经、“更年期综合征症状”、外阴瘙痒、月经不调等；⑦ 肌肉关节：肩颈酸痛、四肢乏力、肌肉/关节发冷、感觉异常；⑧ 皮肤、汗腺：皮肤干燥、多汗、手心和脚底多汗、毛发改变或脱发；⑨ 眼：疲劳、睁不开、流泪、视物模糊等；⑩ 耳：耳鸣、耳塞、听力下降等；⑪ 口：口干、多饮、口腔疼痛、味觉异常等⑫ 喉：喉咙发痒、吞咽困难、异物感等；⑬ 手：手抖、麻木、僵硬、酸痛/胀痛、精细动作困难等⑭ 全身：全身倦怠、易疲劳、漂浮感、发热等。看作生理疾病除了胃口不好、性欲不佳、睡不着等，大量的躯体化症状会让自己（和身边的人）觉得只是身体生病了。作为抑郁症资深患者。我经历的“生理疾病躯体化”有：发烧（每几天就38度上下）；手抖、无法完成精细动作（学服装的，假缝（手缝）的时间成了我花费最多的时间）；眩晕、漂浮感、胸闷、心慌、心动过速（反映在脉搏和血压上，有约半年时间几乎每天高压50-60，平静时心率可能超过120）；恶心、上腹部不适（频繁呕吐、胃疼、腹泻等）期间曾去过各大医院做个各种检查，西医大意是：没毛病回去好好休息（没有生理病变。西医每次下这种结论都让我觉得很受打击），中医大意是姑娘；你病入膏肓啊（脉象不好）值得强调的是，躯体化症状在第三次抑郁症复发时特别明显，感觉得了绝症一样。神奇的是，出现以上不适6个月后，才有人开始怀疑是不是抑郁症复发，包括我自己。此前并没有情绪变化的感受。归纳为其他原因以上躯体化症状中，有太多相关的症状常引起周围人和自己的误解。例如，失眠后，用看手机等方式kill time，早上起来后身体乏力、疲惫会觉得是因为没睡好。失眠时间增加后，认为是长期熬夜导致心慌气短等（赶紧在水里加了一把枸杞）。睡眠不好自然容易引起食欲不佳，紧接着腹部不适也可以被理解了。此外，肌肉关节、呼吸系统、消化系统、内分泌系统、五官、皮肤、全身等等，都能比较容易的形成逻辑自洽。开始责怪自己。也可能会有身边的人对我经常请病假、经常说不舒服产生怀疑，认为我每天这么丧（不出门不上班不上课）是因为我不努力，我太懒。一想到西医确实判定我没有生病，是我太娇气吗，是我对自己要求太松吗。自我怀疑糊一满脸。二、其他情况导致的情绪问题也有可能是抑郁症？误解1：可理解的情绪低落不算抑郁症。 实际上，持续两周以上自我调节不良致情绪低落的，也要考虑轻度抑郁发作的可能。 误解2：慢性躯体疾病伴有情绪低落是正常的，不需额外治疗。 高血压、冠心病、糖尿病、脑卒中等慢性疾病中出现情绪低落、心烦失眠，会加重和影响躯体疾病的发展，仍然需要治疗。三、其他人说他有抑郁症首先，必须承认的是，抑郁症患者确实在逐渐增加。 据世界卫生组织研究显示，目前抑郁症已成为世界第四大疾病，预计2020 年可能成为仅次于冠心病的人类第二大疾患。专家介绍，10%~15%的抑郁症患者最终可能死于自杀。另外，信息化发展让更多的人知道了“抑郁症”这个名词。心情不好就说自己得了抑郁症；随便看几个症状就说符合，认定自己得了抑郁症；甚至把抑郁症作为躲避一些事情/麻烦的借口。仿佛抑郁症理我很近，但他只是个玩笑词，事实上他理我很远。这是社会环境导致个人不敢怀疑自己开始进入抑郁状态。曾根据“文献资料”（报纸期刊）总结了一篇比较干的文章（公众号内）和抑郁症相关的Q&amp;A抑郁症·03&amp;gt;那些关于抑郁症的问（gān）题(huò)（不过这个公众号不会只说抑郁症的事，还要写家里6只奶猫怎么长大什么的。不过之后也会分享抑郁症的发现、门诊、服药、住院、无抽搐电休克等等体验。基督教系更新，如果感兴趣，也可以关注的）以上可能很多名词表述不准确或者语病等等。先说对不起了，最近说话就是这个样子。图：复制自我公众号本回答好多内容也是摘自链接文章中的几个问答。,3,0
凉性青年,“雪崩的时候没有一片雪花是无辜的”  1.暴食：胃口特别好什么都吃，胃都要撑炸了，还是想吃东西，每次吃不饱就会心慌、心乱只有吃饱了才会觉得舒心，就算心情很差也吃的下去。2. 焦虑：就算是不工作休假的时候，每天的生活状态也是非常焦虑，莫名其妙的发慌，挠头，烦躁心情郁闷。3. 睡眠不好：长期饮用褪黑素，经常半夜醒来玩会手机看着房间的天花板放空、发呆然后在继续睡，半夜能醒好几次。4. 丧失兴趣：明明是以前很喜欢的东西，却怎么也提不起兴趣，对什么事情什么物件都不敢兴趣，一切都变得索然无味。5. 社交障碍：不想出门只想宅在家里，对人群多的地方有恐惧心理，以前喜欢热闹的地方，人多的地方，现在只想清净不想社交。6. 记忆力下降：忘性很大，经常不记得自己说过什么话，有时候安排好的计划过两天就忘记了。7. 迟钝反射弧边长：对感情理解能力下降，别人跟自己说话要好一会才能反应过来，对亲情、友情都持有不看重的表现。8. 懒惰：很口渴但是杯子就在自己三步不到的地方，就是提不起手去拿，什么事情都不想做，也懒的去做，拖延症很强凡事都拖到最后一刻才完成。9. 喜欢哭：有时候想到不开心的事情会哭，一点小事感动的会哭，莫名其妙的眼泪就掉了下来。10. 经常沉溺在悲伤中：喜欢回忆一些不愉快的事情，经常情绪低落做什么事情都没有动力，不开心，沉溺在痛苦里，别人也无法走进你的心，你也不想去接触其他人的心意。11. 太敏感情绪波动很大：在路上你总觉得别人在看你，别人讨论个事情你都会怀疑是不是在议论自己，不相信别人说的话，很难信任一个人。12. 缺乏安全感：离不开人，没有人陪伴心情就会低落，如果和一个人待久了对方的突然离开心里会觉得空落落的像是被抛弃了一般。13. 消极想法：工作事业成绩全部都会往最坏的想法想，什么事情都做好最坏的打算。14. 放大矛盾：恋爱中，喜欢把矛盾无限放大。举例，你俩一起做饭，你淘米只淘了一遍。普通情侣，都觉得没什么，如果希望你淘2遍，直接说出来即可。15. 拥有讨好性人格：力图让所有人高兴，总是拔高别人而贬低自己，而且极力希望获得这些人的认同，这样让自己得到一种“自己也如他们一样完美”的安慰，同时又因为自我评价非常低而觉得别人是不会接受真正的自己的，所以会努力按照自己想象中的方式去讨好别人，哪怕做出很多牺牲也在所不惜。16.自我评价下降：自认什么知识和技术都没有，毫无用处，对实际上的成绩也不认为有任何价值，或者几乎只看到自己的错误和缺点，似乎什么长处和优点都没有，过去引以为豪或者可以自慰的品质也在心目中日渐消失。17.对生活不抱希望：觉得生活没有意思，对什么事情都提不起兴趣，人生没有意义，充满了负能量抱怨生活、抱怨人生。希望大家能光顾我的公众号“凉性青年”加入我的大学社群。生活上学习上我都希望能成为你们的小哥哥。回复“规划”对于如何高质量的走完大学四年，希望对你们有帮助回复“新媒体运营”我也可以教大家做公众号，因为我也在前行的路上。回复“PS教程”以后工作会点PS是一定加分的。回复“C4D教程”都可以学回复“副业”有36个解析行业的内幕。,4,0
非期,1.睡眠状态很差，晚上十二点睡觉，凌晨三四点就醒了。2.害怕被抛弃，一到晚上情绪就失控，不敢睡觉，害怕第二天所有爱自己的人都离我而去。3.吃不下饭，再香，再可口的饭菜总是吃一点点，就算没有吃饱，也吃不下了。4.讨厌天亮，又要开始面对生活。5.无缘无故流泪，发脾气。别人对自己太好，会哭，觉得自己不值得，别人对自己不好，会多想。总之就是有点精神分裂的样子。6.无时无刻提不起对生活的欲望。7.头疼，脑子它有自己的想法，你根本控制不了。8.又开始蹦出自杀的念头。9.觉得自己是个神经病，并且觉得别人也是这么认为的。10.社恐，不想见人，也不想让别人看见自己。11.和亲人、恋人、周围的朋友关系迅速恶化，觉得他们不理解自己。12.莫名烦躁，下一刻又跌入深渊，开始悲伤,4,0
Kevin,我都轻度抑郁症很多年了，不愿意社交，不想接听电话，只想一个人呆着，严重时晚上每隔一小时就睡醒。对人性感到绝望。认为社会就是个充斥着各种各样的骗局和套路之中。,31,21
儿魇,首先，并不是所有抑郁症都会厌食，很可能是另外一个极端，就是暴饮暴食，甚至有些人吃吐了还不会停下。心里没有一点安全感，注意力会下降，过度敏感和疲劳。然后，身边很多人的劝诫方式一般都是:“你想想xxx，你想想美好的事情，你想想挂念你的人……”说真的，压垮他们的，往往就是你们口中这些应该想的人和事，因为说白了，抑郁就是无法感知到活力，无法体验美好。击垮了的人，要想再活过来，真的很难。,3,1
匿名用户,有些性格气质的人比较容易得抑郁症1.内向者。不喜欢麻烦别人，也不是很喜欢被别人麻烦。有心事不会对亲近的人说，容易自责。2.完美主义者。做事追求完美，对自己要求严苛，过于专注，一点点瑕疵或者发挥失常对他们来说是一种折磨。3.缺乏灵活性和适应能力的人。当环境变化时，无法适应环境的人容易被困在自己原有的认知里，认为他人不理解自己，产生孤独感。4.喜欢诗歌和戏剧的人！！！生活中的诗人通常拥有丰富的情感、较强的感知能力和共情能力。而不写诗的人，也会因为读懂了一首诗，内心在不断消化诗人的情绪。写诗歌和戏剧的人当中，罹患抑郁症甚至自杀的不在少数。5.肠胃不好的人。从我身上总结出了一些经验。今天第一天吃药，虽然医生说两周后才会起效，但是感觉好受了一点，也有心理上的作用吧。现在处于“活着真是没意思啊”的阶段，还没有具体想下一步，在失去意义和死亡之间还隔着一段距离，挺好的。没有想过死亡的问题，以至于医生问我“工具和地点选好了吗？”我还笑了一下，还没到那一步。曾经因为喜欢戏剧被老师夸，她非常惊喜“哎呀喜欢戏剧的学生不多了啊”。曾经因为完美主义、好胜心，我每年都是专业第一，比赛成绩也不错。曾经因为性格沉稳、认真踏实，老师称赞“真的是搞研究的料”但是那些成就了我的东西，也击败了我。现在我人前微笑，背后流泪。自负也自卑。,11,4
池木,利益相关：抑郁症患者 服药两年其实我自己的情况和普遍回答最大的区别还是睡眠就是嗜睡由长期的疲劳感导致的嗜睡，加上晚上入睡困难经常凌晨才睡着，早晨是药物反应以及本身症状最严重的时候，再加上潜意识里也不想醒来，有逃避现实的倾向，所以很难醒来。由嗜睡导致的另一个问题就是醒来以后的不适感，加上本身的焦虑，经常醒来一看已经中午了，加之记忆力下降经常忘记事情，就陷入自责和痛苦。家人对嗜睡症状非常不理解，因为这件事还多次有过冲突。坚持认为是我自己懒惰，主观上不愿意醒来，同时咬定只要我自己有毅力就能撑过去。其实我内心里也一直认为这个症状是为自己的消极行为找借口，更加自责焦虑，形成恶性循环。其他症状多多少少都有，一段时间还出现了躯体化，但是都没有睡眠质量下降让人痛苦。其实心里是想一觉睡去不要再醒来了吧。,5,2
Kill depression,5.15  回头看这个回答，从积极配合治疗到擅自停药再吃药再停药这样也很久了。现在处于迷茫的阶段，说实话我总觉得自己没有哪里和正常人不一样，我就是个正常人。我一直在寻找让自己舒服的生活方式，想随心所欲的生活。毕竟能活着已经很好了，是否逃避现实对我来说并没那么重要。我承认我确实有病，焦虑，抑郁，但是都是我。       看那些描述失眠善良敏感等等的回答时，我并不反驳。       因为我也会自己对号入座，而那种巴纳姆效应的认同感会上瘾。一种短暂的解脱感，仿佛世界上有很多和我相似的人，过得和我一样不幸。我们互相鼓励，互相倾诉。。。     可我仍很清楚的知道真相。今天的我又在刷知乎浪费时间，去看那些或真或假的回答。我面前摆着一堆待处理的任务，而这些告诉我你是因为得病了才会这么颓废的回答对我来说像是毒品。       短暂快感之后回归现实，没有人会为我的拖延症买单。也没有人会体谅你不成熟的情绪。没有人会理解我的性格缺陷带来的痛苦。毕竟失败的人大多相似，而成功者不会理会我的泥足深陷。      应该是都不想面对现实吧。毕竟面对自我的时候，会因为太了解而觉得恶心。可是人性本身就是丑恶的。你看，短短几段话我用了多少个我字，所有人都是天生自私的。       那么，既然大家都这么难看的话，就别太在乎自己那些微小的不足了，毕竟别人连自己都自顾不暇。至少我对自己要求变低点世界都变美好了。        最近一直在试着接受自己。不用厚粉底一颗一颗遮痘印不用总用长裤长裙掩盖巨粗的腿美瞳也全扔了，出门走在路上干脆不戴眼镜。近视有时很棒的，看不到别人的目光自己就是一个小世界。        其实除了你爸妈根本没人会在意你，有时候爸妈都不会。活着有口饭吃还能刷知乎挺好的了，不是吗。虽然严重跑题，了我就是想说，你咬我呀哈哈,3,0
十九,性欲减退或者超强早泄或者阳强这些都说明你五羟色胺递质有问题吃抗抑郁药有效，抗抑郁药对普通人无效，你吃半片左洛复，如果有效果，呵呵，恭喜你而且那效果真的特神奇，相信我，别去尝试,3,7
SK月影骑士,我观察得到的：1早醒，长期的睡眠不足。2经济压力大3过度敏感，感觉别人说什么都是针对自己4无论做什么都提不起兴趣每天只想趴着一动不动,0,0
咪咪会飞,对别人的态度会很敏感，很怕别人叹气，怕别人和自己待在一起觉得无趣，有人讨厌自己就会歇斯底里地哭。,28,1
边河,看到这个提问的标题都会流泪。,1,0
匿名用户,在抑郁康复后简直是否极泰来，会有一段时间情绪特别高涨每天都很快乐，但那也只是一种表象的、暂时的快乐罢了，大概是嗨了半年吧，又丧了.......我这才知道原来我还是那个极端绝望的我吧，再多的美好都敌不过迎面袭来的坏情绪，只要头脑一空就会想起那堆破事，并后悔不迭，忘了自己的实力和野心了  家庭经济困难很大程度上会使人自卑，并且无法融入人群，尤其是你过早地了解到你与周围人天生的差距时，这种自卑会一直延续下去，对我来说无解  还有，不信任别人  特立独行，与别人想的不一样，做的不一样  还有，因自卑带来孤独，如果无法享受这种孤独了，便会特别难过，知道自己在这个世界上没有一个知心的朋友因此就会怀疑自己的价值，否定自己的一切，想放弃这一切了  本质上，是因为渴望爱，但是却没有人说爱你啦  我心里有一个小孩，从初二到高二，陪了我很久了，现在仍然存在我的心上，她是我幻想中的姐姐，有时又是我的妹妹，反正她是爱我的就对了  嗯，我最好的朋友其实不是人，是我的枕头，从我有记忆开始起就陪着我了，现在在我的宿舍里，感觉这么多年已经渐渐没那么爱她了，但是我会一直留着她的，因为那是爱和温暖，可不能扔啊  如果有人能看到这里可以留个评论吗，我现在没那么绝望，只是有时候情绪低落，无法控制自己，但是我还能笑出来，我还能感受生命的美好，我还有我的救命稻草，我肯定能活下去，去看看我的小妹长大了是个什么样子  （我的小妹就是我哦）,6,11
红尘客栈,我是讨好型人格，遇到一个抑郁症患者，圣母心泛滥以为可以帮助和拯救，后来才发现以前的自己想的太天真了。一开始还挺好，她倾诉我会听，无条件去支持她，帮助她，带早饭，请假，巴拉巴拉。我没觉得自己牺牲太多，只希望最后能换来一个好的结果就好。但是后来事与愿违。我渐渐累了，因为我总是无条件的帮助，抑郁症本来就性格多疑，所以我的动机总是被误解。被以为和辅导员一伙的，听到真的很难受，但是因为我本身也是讨好型人格，有啥委屈肚子里咽，心里火大但还是一声不吭，不知道为自己辩解。我害怕被人怀疑，然而却总被怀疑，或者说被怀疑的多了，当别人没被怀疑时我也在想，自己这个举动会不会引起对方的怀疑？我问一句，你怎么了，的时候，自己内心总是在想，她该不会以为我又要去向辅导员告状了吧？但事实上是，和她靠近陪伴她完全是出于我个人的意愿，和任何人都没有关系，我由衷的希望她可以好起来，哪怕只是有个人陪伴会感觉到好一点也好。这就是我只是单纯的初衷。当辅导员问起来我也总是帮她打掩护。这些她都不知道。也许正因为我太好了，所以总被人怀疑动机不纯吧。何况抑郁症本来就多疑。有时候挺讨厌自己这个性格，被误解了也不知道辩解。没有一个坚定的立场去告诉别人，我认为你做的好，还是我觉得这样不对。她说，感觉我是个没脾气的人。这句话挺让我生气的，虽然我表面上表现出来从不生气，鬼知道我给自己吃了多少黄连。再后来，我们就疏远了。也许是因为她的多疑，也许是因为我的疲惫。后来，我们都变成了一个人。她说，别人对我不好，我会生气，我觉得别人应该对我好，把我当做中心人物。但是别人对我很好时，我常常会想，他为什么要对我这么好呢。很矛盾对吧。如果你和这样的人相处会不会觉得累呢？能不能给朋友多一点信任，别把爱你的人越推越远了好吗？,6,6
匿名用户,有次加班到深夜，一个人拖着疲惫的身躯回到漆黑的出租屋里。面对着冰冷的四堵墙和孤零零的一张床，没有开灯，蜷缩在黑暗的角落里，无声的抽泣了很久。其实我肚子好饿好想吃我妈做的饭我好想跟我爸一起看电视我好想跟我妹妹一起抢遥控器我好想我们一家人在一块吃饭我好想抱抱他们我好累房价压得我喘不过气来我好痛苦我好无助可我已经24岁了，这个年纪不允许我做出哭这个懦弱的举动，所以我只敢无声地抽泣，不敢吵醒隔壁的房东阿姨然后第二天，正常的工作，正常的吃饭喝水……没有人知道，这个笑起来憨憨的小伙子，昨晚上一个人躲在角落抽泣了一夜。,4,2
匿名用户,羡慕自杀死去、突然死去的任何人，觉得他们解脱了，不用在人间受苦。羡慕说死就去死了的人，于是心里有罪恶感，觉得自己畏缩不前不去死是耻辱，却又心底存着明知无望的侥幸的希望。控制自己在住处不放任何刀具，避免情绪低落失控时半夜给自己再割几刀。上次凌晨失眠翻遍屋子找不到刀，平静后很恐惧当时那种偏执和无法自控的焦躁，其实也不是奔着死去割的，只是想感受痛，痛了，疼了，就觉得自己是活生生的。觉得不快乐，却怕带给人负能量，从来不说，昨天和朋友聊《父母爱情》印象最深刻的场景，我说是欧阳懿生气安欣要去给安杰伺候月子那段，是安欣从房门外听见安杰跟葛老师说的那段话，是德华在屋顶大哭自己喜欢的人不喜欢自己那段。我朋友听完后说：“我看了这部剧好几遍，我一直把它当作是喜剧，也一直以为是喜剧，为什么你在一部欢笑温馨的剧里偏偏只注意到了仅有的几幕最悲伤的点并印象深刻到完全让你想不到其他喜剧的部分？我很不明白”我愣了一下，狡辩道：“不是都说，喜剧的精髓是体现出的悲剧嘛。”她很认真的说：“但是一个正常人即使知道喜剧的精髓是从喜剧中体现悲伤的内核以升华，但是也绝对不会像你这样——带有某种阴暗。”我无言以对，也许天蝎座的人都是如此敏感吧。我想我应该是潜在的那一种吧，即使有天确诊，我也不会惊讶，但身边的人会。毕竟我温和好脾气，理性派，众所周知。,6,10
佳明,我越看越像我是潜在抑郁症,14,5
STELLA,求你们别这样 碰到那样的状况不是应该先给自己下个“潜在抑郁”的定论 而是赶紧想办法把苗子扼杀在摇篮里 否则一旦陷进去 一旦确诊开始吃药 只会在抑郁的道路上越走越远 并且这个病就像悬崖一样望不到底 要治起来不知道要耗多少年 所以拜托了 发现了苗头就赶紧积极的行动起来 把它们都扼杀在摇篮里 记住 你命由你不由天 不要和抑郁症共沉沦,5,1
