匿名用户,突然的非常难受，像是心脏泡在水里完全喘不过气来接着就是有自残的冲动周围一切的噪音都会让我变得非常难受，哪怕是细微的那种，难受到手抖整个人都像纸一样被揉成一团，想摔东西或者毁灭一切噪音的源头想自残。高中几次考试考场有人抖腿，腿撞到桌角发出细微的声音我整个人都崩溃了。直接从考试位子上起来昨晚凌晨底楼的狗叫了两小时。我差点整个人从六楼跳下去或者是立刻下楼把那只狗掐死或者是毒死。即使，我很喜欢狗，可是我的狗早死了厌食写完了几本厚厚的日记。记完一本撕一本。把那些丑陋的悲观的见不得人的奇怪的思想全部给扔到深渊里去永远都不要回来。我还没有进行治疗。甚至家人也不知道。所以目前我不会特别明显伤害自己。我讨厌别人的关怀又渴望有人亲近。没有任何想要做的事情，觉得一切都是无意义的事情。可能最想做的就是快点离开家人到一个不知名的地方然后在某个角落死吧整个人都是悲观的 。我人缘挺好，在朋友间说话很幽默，但知道我有抑郁的只有两三个朋友。我不知道可能是从小性格使然。小时候非常懂事，一直都不喜欢说话，父母忙，自己可以一个人呆在别人家，身体从小就很差，所以越发不喜欢家人过于的操劳，有什么病一直憋在身上。我讨厌别人用这种话来劝做人不要太自私，考虑考虑你父母。我想自杀的确是对不起父母的方法，可是每个人价值观不同。我知道失去我他们会难过，这的确是一种只顾自己的想法。我会尽力补偿，可我希望我能为自己活一次。一个人的出生是不由自己决定，难道死也要他人决定，或是由天决定吗。我想我后面不自杀，大概会病死吧。因为我的身体。是真的差,0,0
明天,能让你在爱的族拥下想追寻死的解脱让你觉得诅咒你会死是一种恩赐然你觉得你是这世界的过客让你觉得镜子里的自己令你恐惧让你觉得别人的笑容是那么得令人羡嫉让你觉得的活着比死去需要更大的勇气但其实，这都不可怕因为，抑郁症是病，是能够治愈的病思想是会撒谎的，所以抑郁症给你的感觉全部都是假象，尽管他们那么真实的刺痛着，但他确确实实事可以治愈的。只要抓住最后一丝想活着的渴望。只要活着，活下来了，光照进来了，人生会慢慢走起来的,0,0
匿名用户,疫情期间，它回来了。不想社交的我甚至希望隔离的时间再长一点，名正言顺的享受不见天日绝望的日子最近经常哭泣，悲从心来。那天吃着中午饭，忍不住了就去了卧室抱着枕头恸哭，后来忍不住哭出了声音，不知情的他过来问我怎么了，我一言不发，无从说起，也不知道如何表达，脑中盘算着杀死自己的100种方法。我哭完了，坐下吃饭，他问是不是他哪里做的不好？想了很久说：不是，是我不想活了。他没再理我。活着的意义到底是什么？死者一无所求，生者营营不休。,0,0
Amarata,就像其他可能会夺走生命的疾病一样 但它更难治愈,0,0
匿名用户,我想死可我不可以。我不可以可是我想死。我不想死可是我不可以。不可以，可是我想死。,0,2
白鹤,可怕到，你上一秒可能很高兴，下一秒可能就想跳楼，情绪难以自控，对什么都不感兴趣，以前可能喜欢的东西，现在都不喜欢了，整天只想一个人窝在一个小空间里不想动，没有理想，没有动力,0,0
知了,自从不好的感觉发生不断来临海浪一样，一直折磨着自己它不会消失，因为想法在思维在它就在不只是抑郁症病因更重要的是，身边的人，也许是无关紧要的人又也许是因为一些人而得了这个病那些身边的人。可能会比抑郁症更加折磨。因为他们让你想起自己绝望的时刻。数次的折磨，可能是因为家庭可能是因为环境，让你意识到，原因不会有任何改变。他他们永远也不会改变，永远都会折磨着你。有时候仅仅是生活在一个缺德的家庭里面，而活活被逼死。这并不是自己的错。但你有很强的自卑感。明明不是你的错所以活下去不要绝望起码我要慢慢活下去去看看未来是怎么样的。推荐书活下去的理由。《伯恩斯新情绪疗法》亲密关系,0,0
乖乖的大琪琪呀,内心会崩盘，人会难过到极点，没有斗志，想什么事情会悲观,0,0
东之既白,突然间感觉一切存在都是无意义的，一切都不在乎，极度焦躁，极度恐慌，所有的消极情绪涌上心头，手足无措，觉得只有消失于此，变得无意识状态才好,0,0
小梦和我,抑郁症是疾病，抑郁症是疾病，抑郁症是疾病。重要的事先说三遍。社会普遍对抑郁症有两个误区：一是把某些情绪问题当成抑郁症。在我的一些教练个案中，很多客户一上来就说怀疑自己得了抑郁症，对话进行了一段后发现实际情况上是困在一些情绪里不知该如何处理，在处理了情绪后，对方也就释然了。二是简单的把抑郁症当成心理问题。虽然以目前的研究还无法完全搞清抑郁症的发病机理，但大量案例表明，抑郁症是存在遗传的，这就说明抑郁症不仅是心理层面的疾病，更是生理层面的疾病。生病请找医生！回到问题，我个人觉得抑郁症最可怕的地方在于，很多患者只在患病初期有向外界寻求帮助的想法，而到中后期，随着患者逐渐丧失生活的热情，向外界求助的意愿会变得非常低，甚至掩盖病情。很多患者就是在外界完全没有察觉的情况下结束自己的生命的。所以，尤其是家属请注意，患病请及时就医！,0,0
16443,不可怕我只是想知道自己是什么样的人,0,0
图仔推推百货店,"我很讨厌这个题目。很讨厌。“抑郁症究竟有多可怕？”这样的题目，潜在的台词是在说什么，说抑郁症就是可怕的，那多么可怕呢，你们这些患者来告诉大家一下，这是一个多么吓人的事情。可能我是有点玻璃心吧。这样类似的话，我听过太多次了。不要这样问。抑郁症不可怕，就是得病了，需要吃药，需要治疗，需要看医生，和其他病一样。我改变我的看法，是一次去看胃科医生的时候。在波士顿排了很久，终于预约上（其实国外看病的事情真的是个悲伤的故事，国内医疗系统真的及时又全面）终于见到我的医生，也影响了我很多，他让我称呼他Dr.Plaut。左检查，又检查，我的胃都没有问题（十天前也去过急诊，那又是另外一个悲伤并且伤钱的故事了）他开始问一些关于我最近状态的问题，很和蔼，很温柔，不会像我的朋友们觉得“你怎么那么消极”“大家都生活那么难/为什么只有你过不下去。”也不会像我的爸爸说“这是你情商的问题”“这是你不会处理人际关系”“你要思考一下自己为什么这样消极”“为什么别人不这样呢”“人怎么会得抑郁症，这都是生活的失败者”我把那些难以启齿的过去告诉他，告诉我曾经如何的差点让自己离开这个世界，如何的小心隐藏一切消极情绪，如何默默落泪，如何一下子抓起充电线在厕所偷偷尝试自杀。他说：Do You Trust Me?（你相信我吗？）You can’t trust them or your dad, it is not right(你不能相信他们或者你的父亲，你要相信我）It is normal. (这很正常）Trust Me, only if you trust me, I will tell you the truth. Your life is ahead of you.(相信我，也只有相信我，我才能告诉你真相，你的人生的长度比你想象中更长，Ps：我是这样理解的，可能翻译不太精准。不知不觉，看着他的眼睛，我就开始掉眼泪。他怀疑我是焦躁症/抑郁症，给我预约了医生。我见了心理医生，开始咨询，开始吃药。这件事情不可怕，很正常，我和你一样。你只是病了，这很正常。Your Life is Ahead Of You.这句话他送给我，现在我送给你。我还要看好多剧，我还要见好多人，我憧憬无数地方的风景，我还要活着，至少完成这些目标，为了自己不遗憾，多活一会儿，再多活一会儿。还有，感谢那些觉得抑郁症不可怕的善良的人们。",0,0
匿名用户,个中辛酸，不足为外人道也。,0,0
慕容风吟,不太确定自己是不是抑郁症，也从来没有去医院看过，万一确诊了多不好，只会让关心你的人更担心，但他们又不会理解你的状态，种种纠结下只会让自己更加难受，让他们也更难受，还不如就这样，装着正常，大家都好。简单说下自己的状态，当年毕业，从小到大没遇到什么波折，然后在去单位报道的前一天早上就莫名其妙的自杀，具体就是在洗手间给自己脑袋上套了个塑料袋，然后就失去意识了，后来可能是时间太长，或者摔倒声音大？反正被家里人发现并救了起来，然后第二天坐火车去另一个城市上班…家里人从来不提这件事，也许他们以为是小事，也许他们以为只是低血糖之类的眩晕？这么多年估计早就忘了吧。其实无所谓了，只是我感觉自己现在对所有的事物都非常的冷漠，仿佛这个世界和我没有关系一样…虽然我努力的装出一副热爱生活的样子，不知道还要装多久，也不知道什么时候就装不下去了，走一步看一步吧,0,0
匿名用户,抑郁症可能是那种怎么说，如果人有灵魂，大概是灵魂无法正常依附在身体上，想撕裂又极力忍住，矛盾，难受，无法得到救赎，没有肢体上的痛，但心里很痛苦。如果你是抑郁症患者，我想对你说如果有些事不想做就不要去做了。你太累了，不要去想别人的感受，大脑放空一下。想想自己，回忆一下人生里曾经有的开心的瞬间，想想有没有想做的事，想吃的东西，想见的人。放下包袱，成全自己。最可怕的地方在于，很多人抑郁的根源是父母,0,0
匿名用户,这个问题真的毫无意义 我觉得在回答里把对自己做的各种伤害拿出来说一遍也很令人费解 ,0,1
匿名用户,其实有些人药物反应也挺严重的，说下自己的经历吧。17年上半年开始，由于感情上的问题，开始失眠，情绪失控，爱好全部消失，做不来几乎所有事，比如像现在这样打这么多字，比如每天洗漱，后来失眠变严重了，每天大概两个小时左右睡眠，开始幻听，不认识镜子中的人。有意过量服过一次安定，没死。六月去过一次北京某医院，感觉很不好。十月去了北京六院，诊断是重度抑郁中度焦虑，开始吃药。可能体质问题，对药物很敏感，结果就是药物效果很好，副作用也很严重。我身高170，开始吃药时候体重50kg，吃药一个月掉到了38kg，伴随着比较严重的躯体疼痛，不过我还是很感激，药物还是救了我一命。现在是20年2月，已经持续吃药两年多了，去年下半年又开始工作，不知道什么时候才能告别药物。最近天气各种变化…疼痛就像天气预报2.29更新，看到有人说每天做噩梦，忽然戾气很重，那真心不是个事，我这两年也每天都做噩梦，每天，从未断过，基本上是被追杀，还跑不掉，跑不动，各种死法，各种残疾，飘来飘去，经常是死的一刻醒来，严重那会儿偶尔分不清梦和现实，活着的人不一定有死了的轻松。你可以在这打字，说明不是太糟，有的人就是矫情，无病呻吟博取同情有什么用，有病看病，积极治疗就对了。抑郁不是一个逃避的借口，不是你脆弱的掩饰，比你惨比你痛苦的人有的是，有的死了有的活着，在我看来活着的就是坚强，也是运气。得了这病，谁都是活着只有痛苦没有意义，得病的时候谁能静下心回答这个问题，这个话题招不来几个真正严重的患者,0,1
人生若只如初见,看到这个问题，不请自来回答一下先说一下抑郁症的一些表现：1.一般来说比较悲观消极，看一些事情也只会看到事情消极的一面，甚至还会放大那一面。2.得了抑郁症不会像平常人那样体会到高兴，在很多事情上他都不能体会到那种快乐以及兴奋等等。3.另外一方面会有自我贬低，他们会看低自己，不相信自己。自己的自尊心方面也低，容易自责，对自己苛刻抑郁就如同丧失了生命力，会感到自己的荒芜，没有生命力。但是他们也是和我们一样的活生生的人啊，需要我们的鼓励和关心！当他们周围一片黑暗的时候，会觉得世界上所有的光明离他而去。说到这里，在我身边也是存在抑郁症的人，但还是有人在关心着他们的，如家人也有朋友们。因为抑郁而自杀的人，他们在他们自己世界的黑暗里。以为光明离他远去，其实光一直都在。请打开那道门，光会顺然进入。最后，我想说的是：他们和我们一样，没有区别。请关爱生命存在的百态,0,0
JayFunk,之前失恋得过，很可怕，很多往坏的想法，心里很难受，浑身无力有自杀的冲动，然后我出去晒晒太阳运动运动，找好友，寻求正能量后来渐渐走出来了，,0,0
血涸,双相情感障碍（躁郁症）噩梦，悔恨曾经做过的事我准备高考了，两年半没得去学校就这样咯诶吃了两年的药还胖了40斤,0,0
怡怡n,我不知道自己这种算不算抑郁症 但是现在回想起来 真的很像。那段时间刚好是上学 两周休一次假期 我已经回想不起那段时间发生了什么 有什么有趣的事情 有什么难过的事情 只知道自己每天都在按部就班的完成事情 没有多余的感情 没有下课 没有交流 整天整天的低着头所幸我是半宿生 晚上可以回家 晚上回到家也没有交流 拿出课本背书 背累了就睡觉 其实这么看也挺好的对吧 可是 我好像没有情感了 我也不知道我是怎么了我不想交流 我不想出门 我不想见人我只想活在自己的世界里 出现转折的是 那天 我自己一个人在家 一整个上午 在玩手机 不知道在看什么好像被魇住了一样然后就感到害怕 开始发抖不知道在害怕什么 就莫名其妙的哭很难过很难过 哭累了 萌生出了一个想法我想死我好想死 这无疑对于我来说是致命的我在之前一直是怕死的可能是之前仅存的一点理智吧给我妈打了电话 说不出什么话就在啜泣 妈妈好像也感受到了什么一直在问我怎么了 我没有告诉她我说我没事 然后挂了电话后来是怎么回事我记不清楚了我妈来找我了我好像濒死的人抓住了稻草死死的抱住了我妈 我没有告诉她我想死 我刚才想自杀我只是跟她说我情绪不稳定不能自己在家里待着 很难过高中的放假周日是需要返校的我好像上个学期一直都没去过返校我畏惧人 畏惧学校 畏惧交流后来 每逢放假 我妈总会想办法把我带出去想办法让我多出去我好像个精分的人在学校里没有感情 在家里很黏我妈我只想和我妈交流 只想和我的家人说话我班主任找过我很多次说我这样不行 我不可能一辈子只和我妈交流可是我做不到 我做不到 我不敢 我不想和别人说话后来我意识到我妈太累了 她又要照顾我爸还要照顾我我家是属于那种没有时间点的小生意看着她很累 我也开始慢慢强迫自己走出去走出去我开始慢慢尝试交流一点一点 也可以和别人说几句话了慢慢的就变成现在这样了虽然回不去以前那么活泼了 但总归聊胜于无 生活还要在继续不知道跑没跑题 但那段时间确实是我最难熬的时候了很多事情写不出来 就埋在心里吧只是想努力生活吧。,0,0
小阳,没有抑郁过，所以不能切身体会到抑郁病患者的痛苦。回答这个问题只是想说，人们往往更容易体察外在的病症，因为伤害可见，而内在的精神方面的缺失很容易被人忽略，而且因为种种原因，类似抑郁症等精神方面的疾病被视为“富贵病”，患者和家属羞于说出口，更不说去寻找专业人士治病了，这样前期忽视、后续讳疾忌医、全程伴随歧视和不理解的循环更加深了患者的痛苦。作为一个暂时没有这方面疾病的普通人，勉强说同理心可能真的牵强，但还是希望不幸患病的朋友寻求专业人士的帮助，呵护精神世界，早日康复吧。,0,0
Virgo,我在笑，我心里确想着死,0,0
匿名用户,嗯……在正月初二大致了解她的想法并进行劝解（作为家人，我劝的方向是为自己而活，其他家人劝的方向是为他们活着）她依旧选择自杀，在正月十三后半夜结束了自己。在十一月的时候，她喝农药自杀，那时候我妈每天中午休息都要去那做饭或打扫，所以及时送了医院。在重症二十多天，听说毒素已经清了，然后拉回了家。当时人插着氧气管，肉挂在骨头上，手是水肿的，脚冰凉，怎么用手捂，放暖水袋，都热不起来。但是人能交流（说自己不知道为什么睁开眼在医院）意识不清楚（说墙上的空调掉了，灯掉下来了，燃气没关）认人没有问题。输的液是医生单独列出来的药，治疗肺感染。当天，排尿困难，咳痰困难不管怎样，第二天状况明显好转不知道多久人可以自己坐起来，可以正常进食，可以吃米饭和馒头（之前只能喂水，米汤，营养汤），最终可以走路。最理想的恢复效果了吧。正月初二那天，她的想法是：我是个麻烦，我什么都不能为你们做，你们为救我花了很多钱，我是不是又做错事了，我是个累赘，我总让你们担心直到她去世，才知道，从可以走路开始，自杀过很多次，乱吃药，喝84。家人一直都在看着她，去世前几个小时家人还在陪她玩牌。就这样吧，如果可以加强干预力度是不是就行了,0,0
匿名用户,每天都想结束自己的生命不是一时兴起，有想到死去的后果，还是想死,0,0
呆瓜斜眼,可怕在你不深感同受根本不了解抑郁的可怕，只是靠文字和图影你根本感受不到那种绝望和孤独，而你又尝试了解并开导他们！,0,0
MoonCake,你明白那种活着就能感受到死亡的感觉吗？,0,0
匿名用户,好想爱这个世界啊,0,0
一戍,不知道，可能一般吧。毕竟这年头，听首歌就能治愈，说出去还能当营销点。,0,0
深海,到底多可怕也不知从何说起，每天太阳升起于我而言便是煎熬的开始，脑子里有无数个怪兽把我逼到角落，轻轻说着：“去死吧！”可我不想听却也躲不掉，拼命地跑都无处藏身，小怪兽们不断肆意占据我的大脑和身体，让我恨不得撕开自己把它们掏出来灭得干干净净。不知何时起，仿佛被剥夺了快乐的能力，被莫名的难过和绝望压得喘不过气。有着不甘和倔强，仍然会在挣扎中努力地活着，于是隐藏着汹涌起伏的情绪，戴着积极乐观的面具在世上小心翼翼地游走。不断地寻找各种事情把生活填满，曾经有那么些忙碌的时光，让人有了种摆脱纠缠的错觉，殊不知在某些沉睡或闲暇的时刻，怪兽们会卷土重来，一切反抗付诸东流，以至于这样反反复复后，更加触动了同归于尽的念头。就这样拖着一副灵魂被抽空的躯壳，浑浑噩噩，不知所终。也有会有快感的时候，曾经想象着拿着尖刀把自己捅得血肉模糊，心底涌起一阵解脱的慰藉，继而浮现久违的笑。看到许多因意外巧合死亡的人，人们在扼腕痛惜时，我则祈祷自己是事故的主人公。因为仅存的理智和过于在乎身边人的感受，至今都没有勇气做出什么极端的行为。对于我的逃避给某些人所谓冷漠、无情，不希望得到理解，却也不想承受指责或埋怨。积极乐观和哭泣崩溃仍在交锋，也不知要困在这样绝望的深渊到何时？世人皆苦，反正只要活着就会有希望吧，只能这样安慰自己了。,0,0
深海未眠,看似跟我们没有很大的区别 其实大得很。,0,0
星汝,可怕！医生诊断是抑郁状态，也算是在边缘试探过吧现在已经基本没什么事了，但是在压力比较大的时候，感觉还是有点遗留我最严重的时候也没达到抑郁症的程度，医生判定的是处在抑郁状态。但是那时候整个人已经处在崩溃边缘了，也不能正常上课和睡觉了，中度或者重度抑郁症的痛苦不敢想象！大二的时候有段时间和学生会里的同学闹矛盾，闹的挺凶的，这事儿成了我精神状态变化的导火索你问我就和同学闹矛盾就抑郁了？不是！是多年来积压在心里的石头，只是压死骆驼的最后一根稻草终于来了那段时间就觉得做什么都没劲，倒也不想去死，也找不到自己存在的价值和意义。吃饭睡觉上课，像个行尸走肉心情：感觉每天的情绪都是以灰色为基调的，“不开心，无聊”是心情的主线，偶尔会有情绪的波动，会突然的开心，然后又会突然因为太开心而更有反差感的失落（如果你看不明白也没关系，说明你的情绪很健康）我画了个灵魂拷问过的解释图↓图解：我的“正常”情绪比正常人的“正常”情绪低落，我开心的时候也不一定能到达常人的正常心情，而我不开心的时候就更是低至更低，简直生命里充满了灰黑色还会伴随一点就着的暴躁，一点看不惯的就可能引发一场情绪的火山爆发相信做过抑郁症测试人都被问过这样的问题：一天中你会在什么时候感觉情绪低落？我：最害怕早上醒来和傍晚的日落时分。早晨醒来想到又要面对无聊郁闷的一天，分分钟就把心情扼杀到最低点；傍晚最怕自己一个人走在路上看见太阳落山，有种我也要跟着太阳去了的感觉想哭：天气晴朗想哭，阴天也想哭，看见树叶落了也想哭。最严重的时候，是晚上上课上不下去了，从教室里溜出来，自己跑到操场上坐着哭。10月底的风已经有点冷了，我到现在都记得坐在操场的看台上哭到泪眼模糊，鼻涕眼泪混着流的惨状。那时候家里只有我妈妈知道，那段时间很让她担心，但是她也是我最坚强的后盾见过心理医生的都知道有个东西叫心理疏导，就是把自己令人难过的过去再翻出来给医生说一遍。超级无聊就好像曾经很中意的衣服压在箱底了，再拿出来晒晒霉味，又臭又丑，还要给别人一一解释每件衣服的来龙去脉太累了，果断放弃治疗最让人头大的是医生get不到我的点，也解不了我内心的死结话说回来，解铃还需系铃人，只能通过自己内在的力量把心结化解还好，我只是心病了，还没有达到生理上的失衡抑郁症患者之所以会产生残伤身体，是因为心理的痛苦已经和生理痛联合在一起了。真正发作的时候，即使没有伤身，患者也会感受到皮肤的撕扯或者其他的疼痛抑郁症并没有社会上吐槽的人那么多也不是不懂的人口里的矫情抑郁症真的很可怕，当抑郁症患者和你微笑的时候可能这只是出于他对这个世界最后的礼貌下一秒，他就可以去死这不是死亡，而是解脱最后，真心呼吁！不能理解抑郁症的人可以表达你的疑惑，但是请不要说“真矫情”“看不下去了”这种表达鄙视和讨厌的话。抑郁症患者内心本就敏感，如果你不愿意表达关爱，也请你不要表达伤害，你无法理解抑郁症患者的“矫情”，就像你无法理解这些话对他们造成的伤害是一样的！原回答https://www.zhihu.com/question/356337268/answer/1026910010,0,0
匿名用户,已经无法表达了，我想各种死，可是死了也怕丢人，前几年因为太严重已经没有能量支持无法正常工作，这几年在外面租房，所以有欠债没还，不会回家的，就是因为他们得得，死也要死在外面，,0,1
南山少叟,我只是稍微有点倾向，然后就会莫名其妙的哭，烦躁，会一次删几百好友,0,0
我是风,从2019的下半年开始，不知道自己有没有抑郁症，又或者得了却不知道，经常消极的心态看什么什么都让我难受，极少有心情好的时候，有好几次心情崩溃痛哭，过年这段时间特别想死，但是想到自己的父母又忍了。,0,0
匿名用户,我觉得抑郁症应该受到人们的善待，毕竟世界还是很美好的。可是。有一个抑郁症女生天天天天来找我男朋友（她已知我们恋爱），让男朋友给她疏解心情两人在那讨论人生。后来？后来和傻逼前男友分手了。为啥？傻逼前男友有一句经典名言:她来找我是她的事，和我没关系。她喜欢我是她的事，和我有什么关系。（嗯呢，真好）当时也是被洗脑了，后来想想，自己真的像是被洗脑了，还单纯的相信他。我可..算了，不说脏话,0,0
