匿名用户,感觉马上要窒息而亡从人群里快速逃离，没有什么地方感觉到安全，于是缩在旅馆里夜里又是一场噩梦，凌晨四点半，心里仿佛空了一块，不安，不安，焦虑，焦虑。想用快乐的事来代替，回忆里是没有的，要靠白日做梦。总是不断道谢，不断说抱歉，一位朋友发来消息，我说谢谢。看到这两个字，一瞬间就崩溃了，莫名其妙。我有什么沉重的压力吗？比起很多人我似乎轻松的多，那为什么会这样？感觉存在的无意义。想逃离一切不必要的关系。痛哭过后，“生的痛苦要生着解脱。”想到这里，觉得好些，拿起笔，继续工作。冬天还是要常喝热水，不要太凉。我觉得最好加点糖。,0,0
当当当当,不知道自己是不是抑郁症之前患过精神疾病 后治愈   在与人相处的过程中别人常常说我的眼神特别看不起人，然后呢常常被骂，有时候一天做两次兼职，都会遇到这种情况，然后会很冲动直接走人了，路上又会忍不住哭了，好多次了，我在想自己是不是得抑郁症了，有时候会很难过，会想着把世界上一切打理好了就不活了，这种想法出现了好多次,0,0
匿名用户,无缘无故就想死，被窝上浸满了的都是泪水。生活没什么意思，浑身都痛，连走路都难。,0,0
马马,现在已经不影响生活了。记得当时就是很累，想动，感觉自己的灵魂支配不了身体，每次都从肉体上划过去，躺在那可能很久才能起来。另外就是心情破碎感，无时无刻都心痛，心碎，想哭，承受力极差。一点儿小事儿都能让我花几倍的精力去平复心情。,0,0
匿名用户,我会疼。心脏一阵一阵的疼，但会连着全身。就好像所有的神经传递速度都变慢了一样，心脏先疼，慢慢地传到指尖。我会哭。我会走着走着就流泪，但自己不知道为什么，只是止不住的流泪，只是呆呆看着眼前不知道是什么的物品，就在那里绝望地等着眼泪停下来。我每天都睡不着，睡不着的时候就想，求求你明天别醒来了。同时也苦笑，现在睡着都是个问题。我最想说的是，抑郁症最难受的地方不是上面说的那些症状，是身边所有人都不理解你。我是好不容易鼓起勇气才告诉了妈妈，她只觉得我压力太大了，“你要释怀，那些东西不要去想就好了” “你睡不着就是因为压力大，脑子里想一大堆东西” “你不要听那些医生说的，我女儿活泼开朗怎么就抑郁了呢” “你寒假回来妈妈再带去你别的医院，这些诊断主观性很强的，你只是失眠，心情不好了一些，你不要就给自己套上抑郁症的帽子”可是妈妈，医院是排名前三的医院，转院手续也是学校教授带着我做的，且不说这些，妈妈，我是真的觉得想要离开了，我是真的很难熬。可我从来不敢跟妈妈说这些话，我只是嗯嗯我知道了。可是电话这头我已经哭了好久了。,0,0
可还行吧,一夜瘦五斤，160，37公斤。看到这个数字的时候，当场崩溃……,0,0
乎而今夏流年,发作的时候：会有另外一个自己，不停地告诉自己：这样活着有什么意义，为什么不去死呢？不断想起之前遭遇的所有的不幸运、让自己难过、羞愧的事、让自己自卑的事、不停回想别人对自己说的恶意的话、中伤自己的话、回想自己失败的事情、自己说错的话、做错的事。各种负面的情绪、负面的话、负面的事情、负面的信息综合一起，全部由另外一个自己不停的数落自己。还可以回想起当时指责自己的人的语气和话语，身临其境。可以想象一下这种感受。一下子自尊心和自信心都没有了。觉得自己一无是处，是个制造垃圾的废物、除了浪费粮食其余什么也贡献不了，觉得自己身边的人看清了自己的样子都不爱自己，带着鄙夷和不屑，说着嘲讽、谩骂的话。,0,0
匿名用户,我也想救我自己 可是我救不过来,0,0
匿名用户,就是现在，和妈妈坐在沙发上看电视，我的脸上毫无波澜，很正常，甚至还能和她一起笑，可是我心里好乱，好难受，真的就是好难受，既有心理上的，也有身体上的，脑子里像山洪暴发一样，各种事情，想法乱窜，停不下来，有我不愿意回想的事，有令我心烦的事，有今天刚发生的事。告诉自己不要想了不要想了，想点其他的事，可是越这样，想得越深。然后本来早就要做的事今天又没做，自我厌恶感又加深了一层。老实说两个小时之前还挺正常的，忽然一下就这样了。情绪化，脾气会变得很暴躁，哭，我很怕白天，清晨到来的时候，我就很害怕，很烦躁。以前不知道，觉得懒是几乎每个人都会有的，怎么懒就成了抑郁的病症之一了。现在我才知道，正常人的懒不会有心理负担，它只算是自己给忙碌生活的调剂，而抑郁的懒则是让你懒得心力交瘁，明知不该这样，可自己的大脑和身体却控制不住，等那个点过了之后，又会为自己的懒感到无比厌恶和唾弃，心里会想已经这么废柴了怎么能像这样毫无意义地度过，然后一再自我否定，恶性循环。虽然一天天看似正常地度过，偶尔也会有情绪非常高涨的时候，觉得有好多事想做，好多话想说，可是就橡皮绳被狠狠拉扯一样，当时有多亢奋，过后情绪就能跌多深。真的好想要偷偷死掉哦。,0,0
匿名用户,,0,0
匿名用户,想哭哭不出来，想叫叫不出来，从大脑到胸腔没有源头的爆发出痛意，无法思考，就像头被按进没有一丝光亮的黑水里，往日里一直压抑的负面心思交织在脑海中，只有痛意才能使我从深渊中清醒过来以上,0,0
隐形人,嗯，今天早上第一次崩溃，这么多年了，第一次，下面是我自己记录的，也就是今天：12月18日：第一次崩溃，真正意义上的崩溃，哈哈哈，你终于来了，不知道以前是否是你，但是我知道这次才是你真正的样子，从初中就已经开始的病，居然隔了这么久才开始到来，（本人现已高三女生）我害怕了，感到了恐惧，害怕某一天就这么不明不白地死了，第一次感到这个病的恐怖。我克制不了自己，想哭，想发泄，身体不受控制的发抖，冷。地震过后（四川内江今天又地震了），我站在教室门口，还在发抖，在这期间一直试图克制自己，发现根本办不到，而后看见走廊边的围台，脚不自觉地向前挪了一点，瞬间我意识到了，退了回来，第一次死亡的气息围绕着我，然后就很想哭，一直深呼吸控制眼泪，也控制身体，情绪很不稳定。直到第一课上课终于忍不了了，眼泪一下就出来了，我发抖着拿出纸，幸好今天早上拿了纸，不然我就真的孤立无援了，我把眼泪偷偷的擦掉，发现它没完没了，我心头慌了，一直流可怎么办，现在还在上学，不能这么对我，我平时可是很好强，很活泼的形象啊，不能让别人看见我的另一面，我努力控制自己的眼泪，幸好，止住了，再次把所有的不好的情绪压制起来。没关系，反正不过多久，我又是一个正常的人。（我讨厌自己，讨厌这个虚伪的世界。）,0,4
匿名用户,我是半夜浑身难受，就想开闸放血，疼了也就舒服了。,0,0
永远吃不饱,1.失眠 任凭怎么努力就是睡不着 只要不躺在床上就特别困 想睡觉 但是一躺下就睡不着2.一夜会醒很多次 早上也会很早醒3.会突然间木僵 怎么也无法动弹 注意力无法控制的呆住 感觉陷入了一个黑洞 别人进不来 自己出不去 4.想要求救 想要被理解被陪伴 但是想来想去身后空无一人 想哭又哭不出来 在心底里无声的嘶喊5.脑子很沉很痛 闭眼都觉得很困难 闭上了就再也不想睁开看到这个世界正在和抑郁症抗争 不知道未来自己会怎么样 只希望不要再真的被病魔折磨了 实在太痛苦,0,0
柔荑战斗机,那天健完身，洗完澡，站在镜子前准备把头发吹干，一如往常。那段时间没有暴食没有变胖，身材是在可控范围内的（因为变胖对我的情绪影响非常大），生活上也没有什么不顺利的事情，可以说任何能导致我抑郁情绪的原因都没有。但当我站在更衣室的大镜子前时，我突然觉得呼吸困难，有什么东西压在我身上，我深呼吸，眼圈开始泛红，我想大哭，对着镜子前的自己放声大哭。那一刻我脑海浮现的是一串问题，为什么是我，为什么这一切发生在我身上，我是不是不好，我配不上这样平淡的顺利的生活……然后我不断地在心里和自己对话，它又来了，负面的情绪又来了，我要接受它跟它和解，放松放松。因为更衣室还有其他人，所以最终我没有哭，只是红着眼圈做深呼吸，这样的情绪大概持续了一两分钟。,0,0
南巷猫主没有猫,疼，止不住的疼，疼的无法呼吸，我自己知道这样是不对的，但是我不能控制，就好像我的大脑里突然出现了另一个恶魔，他控制着我。每次发作都好像突然被丢下了一个无边无际的深渊，你看不到任何东西，听不到任何声音。只有无尽的绝望。每次发作都想要去死。而且你不能对任何人讲，就拿我来说我鼓起勇气跟爸妈说我抑郁症重度了，我控制不了我的思维我的行为，可他们觉得我是在无病呻吟，他们说你也老大不小了你就是闲的你想太多了，你要的都给你呢也没强逼你做什么你去哪能得抑郁症，那玩意儿都是唬人的你也信。好吧你们说的都对，我就是闲的，所以我想闲着没事儿死一次。这就像自己跟自己打一场没有硝烟的战争，赢了活下去，输了就离开这个世界。我不太想赢，若真的输了下辈子请不要在遇到了，或者别再有下辈子了，我不想再来这人间走一遭了,0,0
周冬雨Vo,犹豫、然后删除文字，这就是我了,0,0
小陈小陈吃饭用盆,很想杀了自己觉得活着太累了，明明什么都没做就觉得太累了，抗拒社交，抵触和别人见面，就连最亲近的家人和朋友都很抵触，每天就想一个人锁在房间里。朋友鼓励自己其实身边有很多美好的事物，或许生活真的很美好但我察觉不到。我以前很喜欢看天空，我觉得南方的天空实在太好看了，我还开玩笑和同学说等我有钱了就把这片天空买下来。后来确诊为重度抑郁，我再度看天空的时候它在旁人依然很蓝很澄澈，但我总觉得和以前看到的不一样，看起来有些灰暗，可能是我自己内心太阴暗了体会不到美好的事物。,0,0
匿名用户,,0,0
匿名用户,1.喘不上气 ，感觉喉咙堵住了，我大口大口的呼吸，但是就是感觉喉咙那个被塞住了，喘不过气2.高赞的痛是真的，真的痛，无缘无故的痛，心绞着绞着的痛 ，使劲锤它感觉好一点3.无缘无故的哭，突然就感觉很难过4.经常想自己的死法，各种死法都想过，想看看自己死了之后身边亲人和同学的反应，呵，但是不敢死，想了很多遍，但是我一点都不敢死，我就是个怂b5.思维混乱，高中的时候抑郁症 ，呵，学习是个什么狗屎，我连正常的思考都不会，随便想点啥就把自己绕进我是个渣渣，我不配活着的死循环里面，就解不出来个题，都能感觉世界崩溃，我就是个垃圾6.没办法正常社交，害怕和别人交流，说一句话都要反思说的好不好，会不会让别人感到不舒服，会不会显得我很奇怪，经常说着说着表面还保持微笑，内心又开始，我就是个垃圾，我不配和别人说话，话都说不好，死了算了的死循环…每天的日常起床洗脸刷牙学习（内心我就是个垃圾，我学不好，我心脏疼，真tm疼，感觉呼吸不过来了，我是不是要死了，死了也好，反正也没人在乎，自杀我也不敢哈哈哈哈）社交（我是个垃圾，我是个垃圾 ，我是个垃圾）睡觉（睡不着，又想死，睡着了，半夜惊醒，抓自己的头发，一把一把的掉，哈哈哈感觉要死了，熬不下去了）,0,0
jesslele,肩颈会痛，会呼吸困难，总体physical上的疼痛不是很明显。其他，我有那种掉进深沟里的感觉，又湿又冷还脏，想愤力爬起来的时候总是被压下去。累到实在爬不动了，就闭着眼睛躺在底下。感觉周围的氧气越来越少，哭也没用，睡也没用，顶上的人还会路过看几眼，大多数人只是看过就走了，少数人尝试着带你出去，但是没有人有能力带你出去。巨无敌爆炸难受。这是我目前感受到最难受的事情了，可能每个人感觉不一样。希望大家都能坚持住，自己也快点走出来。,0,0
匿名用户,是真的难受。会呼吸困难感觉下一秒就被憋死了会心跳加速会心慌然后腿软。就跟你害怕的感觉是一样的。全身都疼，腰   背    脖子   脑袋        腿都疼没理由的烦躁烦躁的时候恨不得立刻去死     没有自残因为怕疼但是难受的时候用手抓自己胳膊知道把自己胳膊抓出血为止走在路上就会想怎么没有车把我撞死不爱笑了，每天基本都是一个表情感觉现在活着就是一个没有灵魂的机器。不想动，只想躺在床上。记忆力变的特车差最近耳朵也不太好使。也可能是发呆太久了。还有好多想不起来了，等想起来在写。现在记忆力真的是越来越差了。,0,0
就是那个日月茗,忽然间的麻木，然后难受，难受到什么程度呢，就是自己想把自己的心抓出来。悲伤的情绪一下子涌出来，自己怎么都抑制不了，然后只能痛苦的大喘气，流泪，但却找不到忽然这样的原因，有的时候还会伴随着慌张，恐惧，不知所措……,0,0
长安归故里,不请自来2019.12.14今天是我确认抑郁的第两个月龄一天，也是我患抑郁症大约4年刚刚发病了…妈妈被吓得半死，我哭的不停甚至想死的心情来了…我用理性尽量控制住不想这个想法还是哭的不行比之前哭的更厉害了…妈妈在房门说“我给陈老师（补习班老师）请假了我截图给你看了”隔了一会说“…我真的好害怕你…你怎么办…你别再这样了好吗？让华靖（发小）陪你好吗？”  我回答说“…算了让我安静一下，叫老爸别拼命给我打电话好吗？” …我妈就下楼骂我爸说…你女儿发病别打电话了给她安静一下吧…我没有想到过把爸妈吓得这么严重，在发病时候还发了一条朋友圈自己真的是不争气…家庭情况又不好自己又患上抑郁症…还要补习还要…上学各种费用，负债累累…并且还有我去医院的医药费……有时候真的好想死，但是又不敢死…活的浑浑噩噩的…我甚至计划好从读书到工作的人生，甚至出国读书都在安排好了…甚至自己在省钱在为出国做准备…我现在不知道怎么办了…准备中考了…成绩不好，然后选择读卫校…我打算高一入学时候就休学一年好好养病…补回初中基础、学德语，借姐姐的书看（我有个姐姐也是读卫校出来工作几年了）自学，一年过后好好读书出来工作实习完，出国读很想读的心理学，计划是计划好但是…实际情况不允许…我也会强迫自己学习…我的人生还很美好…不能放弃，加油…。。。。。。分界线。。。。2020.1.15时隔一个月，我又复发了em…好难受…我真的好怀疑自己有没有真正的朋友，活的好累…今天期末出成绩了班主任是历史老师…我不及格…被老师说了半天…真的好累啊…我有时候怀疑自己是不是没有一个人懂我，我有时候会觉得我在班里面真的好像一个被孤立的人一样像个异类一样…为什么我不是一个正常人…我是多么不争气了…让父母失望…有时候…真的真的…好想挂…好累啊…成绩不好，干事情帮倒忙，真心喜欢一个人却被他狠狠抛弃，没有一个真心朋友和闺蜜，现在又感觉有躁郁症倾向…真的真的…活的好失败…,0,0
匿名用户,现在是凌晨1.44，我的头好痛啊，今天痛了一天了，就好像要炸掉了一样，嘴巴一整天都是苦的，浑身上下哪都不舒服，但又说不出来到底是什么样，除了控制不住的流泪也没别的事可以做了。头好痛啊，心里好像被东西压着，怎么这么喘不过气来，既然这么难受，那我死一死好了吧。,0,0
少女喝奶茶,什么感受…当你四肢麻木的时候，你睁眼一看，你在水里，你没办法挣扎，你的感觉越来越模糊，你不想挣扎了。然后，感觉又突然回来了，你感到了窒息，你想挣扎，你在挣扎，但是没用…大概就是这样吧。今天下午发作了一次。大概是这两个月来最严重的一次。室友去考六级了，我一个人在寝室刷网课，突然开始莫名其妙的害怕，手发抖，眼泪一直流，趁自己还有知觉给前任（他没有对象且知道我的病症）发了消息，然后把门窗锁好，窗帘拉起来，就那样直接坐在地板上开始哭，一边哭一边拿修眉刀划胳膊，划着发现没地方划了，就往手腕上划，后来前任给我打电话，听见他声音我才好一点，他大概也不知道他对我的作用有多大。,0,0
匿名用户,12.7重度焦虑、重度抑郁怎么形容呢?最难受的怕就是整天看起来像个没事人一样，但其实对着他人笑过之后自己却又是无尽的沮丧、无奈。现在请假在家治病了，但其实也没有多大作用。新的问题还是会出现，脑海里还是以前的画面。我自己也一直活在无尽的自责与自卑之中。好累啊啊……,0,0
盛峡星空,睡三个小时，连续几天，想逃离，世界那么大，没有我容身的地方，未来好迷茫，极度崩溃，为什么活着，活着太痛苦了。我为什么没有死。死解脱多好。,0,1
哈哈,真的真的很痛苦，无法用语言描述的痛苦，痛苦到只有靠身体的伤害来缓解一些。平时的表现就是:1.很空洞，好像没有灵魂般。内心很空洞，眼神很空洞，空洞到像个行尸走肉般，脑袋里空空如也。(比如:舍友和我说话说我没有走心听他说什么，只是像设定好的程序一样的应付和他的聊天。爸爸妈妈也说感受不到我的能量了）2.失眠。渴望睡眠，却又无法入睡，大脑一片混沌（最近一天只睡一个多小时，感觉快不行了）3.反应非常缓慢。工作的效率越来越低，和同事沟通的顺畅度也减弱，回到家想看会书，结果一行很简单的字摆在眼前却始终不知道是什么意思4.完全不想说话，不想见人，任何人，但是每天上班，或是逼不得已外出，还要带笑对每一个人，这种笑又很无力，因为你根本什么都没看，时时刻刻在演戏5.真的没有活下去的欲望，因为真的看不到未来，想着如何从这个世界解脱情绪不可控时的表现:1.哭，不停的哭。可惜哭了也发泄不了2.头痛（但不是那种物理性的痛，是无法描述的痛苦，这种痛会逼着你自残，自杀）3.自残。毫无保留的扇自己耳光，用头撞墙，握拳打自己的头，用刀割自己的手，我现在两只手从手臂到手腕、手掌都是刀疤4.摔东西。偶尔会像失了智一样，什么都不在乎，电视、手机、都可以摔,0,0
匿名用户,我来回答一个吧断断续续从15年到19年，16年做的检查。从最开始心情不好一个月不讲话，到后来慢慢脾气变差，自残，写好遗书，计划自杀。手腕上还是有疤，也总是有齿印。分手之后，整个人精神状态好了很多，八月份碰到一个部队里的男生和我的状态就像近期北大女生自杀的事，抑郁症复发，他也是抑郁症吧，不过我挺过来了。还是会熬夜，有时候想着想着天就亮了，脑子就像被蚂蚁在咬，眼睛不自觉就哭了。被两个朋友骂过，你就是矫情玩手机玩的。不敢把情绪传染给别人，不敢谈恋爱，自己很没用，不知道哪天就没了，就这样吧。我在努力变好，变开心，变阳光。摘掉你们给我安上所谓的无病呻吟的帽子，因为我很羡慕你们，真的。,0,0
空心者憩芸,莫名其妙的感觉这个世界都开始压向你，有一种窒息的感觉，灵魂深处开始颤抖。然后就是疼痛和痛苦，源源不断的痛苦向你涌来。也不知道是为什么，有一种莫名的愁绪笼上心头，紧紧地缠住你的心脏，拉紧。开始觉得这个世界是多么悲哀，自己是多么绝望。“所有人都不可能理解我的”“我好累”这些想法萦绕心头。续更。,0,0
日内瓦办事处,现在就好难受 ，说不出来,0,0
柠檬小琬子,现在清醒想到昨晚发病，很惨很孤独。想到昨晚发病的我所想的，是个罪人或是废人，感觉自己没用，陷入了自卑和自我贬低无法抽身，哭的很惨，那种惨还夹杂着些些绝望和无奈，也许我没有救了，也许我这一辈子就是这样了。,0,0
kkk,害怕 除了害怕就是无尽的担心和恐惧 原本轻轻松松可以做到的事情 也做不到了昨天晚上到四点都不敢睡觉今天早晨九点就爬起来就算打开了所有的灯还是害怕 就算医生和我说 平躺不能玩手机我也只敢坐着 不敢躺下刚才打开音乐 逼迫自己躺下我感觉旁边的沙发缝隙里有鬼他们随时会把我揪到沙发底下那个黑暗有狭窄的空间里想到就吓的喘不过气还是坐起来吧。总是听到 有钥匙开门的声音 但是家里已经换成密码锁了无论如何也不发出开锁时金属碰撞的声音心里无数遍告诉自己 就是幻听 熬过去这段时间就好了但是还是害怕 无尽的害怕总是感觉身后有人 抱着电脑不时地就要回头检查一下分明家里连狗都出去玩了我知道这些日子会过去 清清楚楚的知道 肯定会过去但是我不知道要过多久才能过去只能在这个黑暗又充满恐惧的空间里忍受这漫长的煎熬。,0,0
Andopen,好像自己的存在没有意义。,0,0
匿名用户,大概就是，动不了。我想喝水，我想把锁上的门打开，我想转头，我想收拾房间，我想下床走走。我想和父母朋友聊天，我想收拾枕头旁边的刀片，我想发出声音，我想拉开窗帘……等等也仅仅是想。只是想，只能想,0,0
匿名用户,活着就是在遭罪，试图过找别人拯救自己发现却没有用。想过去看医生，但是直到现在一直也没去。会因为一点小事突然情绪崩溃流眼泪。想过无数种解决自己的方式，但是一想到家里人又觉得自己还是再坚持一下吧。不想麻烦别人，也不想靠近别人。觉得好像被世界抛弃了一样。自残时觉得痛楚很真实，能让我感觉到自己还活着伤口刚愈合一点的时候我喜欢把他又划开来，洗澡时把温度开最大去淋伤口。今天装热水喝时不小心淋到手上，我却没有第一时间缩回来。面无表情的看了一眼，调整好水杯又继续装水喝。不是觉得不烫，只不过我好像不知道为什么不想缩回来。真不知道我还能再撑多久呢。,0,0
阿阿阿谦谦,其实我有些难过，抑郁症这两年大家都在关注，好像成为了一种可以被理解的东西，但是我悲哀的发现，文笔表达好的、情感显露强烈和故事曲折的、自拍好看的抑郁症患者获得了更多关爱，我无意否认任何患者，或者指责任何人，我只是悲哀的认为是不是只要我们人类活着一天，就一定会有高低贵贱之分，有压迫，有被忽略，即使一样的病痛，大家关注的也只是他们想关注的那部分，正如同性恋一般，大家提到同性恋，都是长相好看的人和凄美的爱情，但是乡村里满脸冒痘，肥肉裹身的人就被人们忽略了，好似不存在一般，看到后便是一脸嫌弃，或者背后议论，大家关注一些小众，拣选着符合自己口味的表达来进行对话，满足自己的情感需要，或是让自己认为自己善良，会共情，或是让自己觉得自己还幸福，要好好生活，但好像不符合大众口味的人便成为了隐性的东西，但被忽略掉的才是大部分吧，我们构建了一个媒介环境，让大家误以为自己理解了某个群体，获得了对自身良知的救赎与自我美好想象的满足，但被忽略掉的才是大部分吧，我并不是想指责谁，或者认为关爱是虚假的，只是有些难过，为什么被爱这么难，始终是有条件的，也难过我也是其中一员，并且无力改变,0,0
Dansa,已经一点了，我在等待独属于夜晚的美妙的肢体僵直，这样可以让我安静一些。至少没人会发现，她们会以为我只是进入了美梦。,0,0
仰望星空,难受……自残……有时候真的想结束生命……,0,0
