布福惠斯啦,  你好好地在食堂吃饭，或者只是在上课，没有任何刺激，你突然就开始发病。  就像进入一片无边无际的湖，水不深，只到你腰那。可是水底全部都是滑得诡异的鹅卵石，不论你如何努力的站稳，不出几秒你还是会再跌入水里。  口鼻进水，呼吸困难。你告诉自己要努力，慢慢站起来。扑腾了好久，你做到了！  三秒后你又跌回去了，刚才精神的放松让你呛入了更多的水，身体像被水撕开一样疼。  这次你总结经验再试着站起来，可是没用，总结的经验没有，尝试新的方法也没用，你怎么也站不起来。  你在水里扑腾，呛入了更多水，水像火蛇一样，钻入你的肺部和大脑，终于你受不了了，没有力气了，放弃挣扎了，结果你呛入的水变少了，不过也窒息得感觉死亡正在逼近。  你很痛苦，希望这份痛苦结束，即使是以生命为代价。浑浑噩噩中你被冲到了岸边，你庆幸自己没有被淹死。  可是你不知道下一次折磨会什么时候来，而且发病不是你控制的，发病结束和你的痛苦挣扎完全没有关系。你无能又弱小，一次次在痛苦里沉溺，拼命挣扎着给自己加油打气，却一点用都没有。—————分割线—————啊谢谢大家的鼓励和关心，昨晚我睡得很好，因为想到了你们，有一点令人害羞的开心。也看到了其他仍在挣扎的战友，希望你们去正规医院检查，按时服药。  吃药的副作用真的比抑郁折磨好受很多，按个人体质不同和医生沟通好，寻找最适合自己的药，共勉。,4370,541
十四,1.痛，感觉身上痛，但是什么问题都没有，就是痛。2.流泪，无缘无故的流泪3.懒，不是懒，就是觉得被封印了，动不了，记忆力不如从前。好多事情反应不过来……4.晚上睡前和早上起来特别难受，觉得活着没意思。5.不能调动快乐和开心情绪，如果把人比作一个机器，就是主管快乐的那个键坏了，不管怎么按都按不下去。会情绪突然高涨，但是不是发自内心的开心。6.失眠并且伴随着早醒，惊醒，梦里也经常流泪。7.会发呆，就是愣住了8.想死是常态了，天天琢磨怎么当场去世。9.最可怕的是，我白天装作正常人，到晚上那只黑狗就出来咬自己。上面几种严重的情况比如痛，惊醒，想死我现在已经好多了。每天和自己说的最多的就是:14啊，站起来吧，来我们慢慢站起来，一切都会好起来的，没有什么过不去的。就像心里住着一个特别胆小的孩子蹲在一个角落一直哭，一直哭，想把她拉起来。回想之前又笑又闹的自己，每天从床上弹起来的自己，热爱运动，上进拼搏的自己就和上辈子的自己一样。我不认识那个人，她好像离我那么近又那么远。好几个年轻的朋友们给我点赞了，我就多说几句。我经常在知乎浏览关于抑郁症的话题，那么多回答，大家真的都太辛苦了。抑郁症的话请即使就医，抑郁情绪的话赶紧找心理医生聊一聊。请相信并且热爱生活，永远抱有希望，每次我状态好的时候都是这样想的；但是实在难受想死的时候有一个小方法也好用。呼吸，呼吸，呼吸， 然后默数1 2 3给自己一个缓冲的时间。放空那么一会儿。我爱你们，也爱自己。———————————————————————————假装分割——(∂ω∂)——(づ￣ ³￣)づ——知乎小透明因为这样的回答获得了很多的赞，开心又难过，因为我之前真的是非常温暖开朗的憨憨来着，现在变成了抑郁的憨憨了，我多么希望这是一个抖机灵的回答呀！也有很多胖友，很认真的鼓励我啦!非常感谢，鞠躬致意~感谢你们赤忱的善意，比心心。很多朋友在纠结怎么和抑郁症的好朋友相处，在这里我统一回复大家一下，我的好朋友们是这样做的:他们不会经常问我你好了吗？你怎么样了?反而是对于这个词不会提起，就和不知道一样，还是平时一样就瞎扯，抖机灵，会和我说他们自己的烦恼，就是一直在身边从未离开。抱歉很多评论不能一一回复，祝好~——2020.1.22更新————————————各位朋友们大家好呀！，我还活着，嘿嘿嘿，我没有忘记和大家的新年之约（见评论）。距离上次回答这个问题已经过去了三个多月，情况一如既往，每天生死挣扎。收到了很多知友的鼓励，真的很多，你们很暖，谢谢！因为你们我更爱小破乎了。生病以后唯一的好处就是，我居然一年瘦了12斤。因为我表现为厌食，有的人则表现为暴饮暴食。生病的原因我也忘记了，小宇说过:很多不开心的事情接踵而至，雪崩时没有一片雪花是无辜的。我猜，就是很多不顺心把我压垮了吧。抱抱你们，辛苦了。我不知道说什么了，就接受小心心(⑉• •⑉)‥♡,4913,658
一隻鹿,"01“抑郁的感觉是怎样的？那像是自己快要被溺死，但你身边的每个人都在正常呼吸。”是的，严重的抑郁就像是在绝对的孤寂中，被禁锢在插翅难逃的沼泽地里，无法动弹，独自一人经历从恐慌无助到灰暗麻木。你被困住了，虽然不一定出于自愿，但还是得被迫见证其他人看似幸福的生活。你有些生气，因为所有人似乎都对你的情况漠不关心，于是怒火开始烧灼你的肺、你的心，乃至你的灵魂。02“抑郁的时候，你无法控制自己的念头，而是你的念头控制你。”抑郁会让一个人觉得他或她的念头已经接管了自己的整个人生，自我攻击的想法一个接一个地翻腾，像是火山熔岩一般喷薄而出: 我真是太没用了；所有人都在嘲笑我的愚蠢；我身上永远不会有好事发生……对于被这种慢性精神折磨所困扰的人来说，这一个接一个的消极想法，无论多么不合常理，似乎都是完全真实而可信的。03“抑郁的感觉就好像你弄丢了一样东西，但是对于你是在什么时候或是哪里丢的一点印象都没有。然后有一天你忽然发现你弄丢的其实是你自己。”人们依然能够叫出你的名字，认出他们自以为认识的那个人。但从镜子里，你看到的却是一个陌生人，脸上的表情迷惘而绝望。你记得曾经有过的理想和快乐，但那些感觉就像是产生自一个遥远的星系，那些情感发生在一个永远无法再次涉足的遥远星系。你能想起来的快乐的记忆就像电影画面一样，不像是自己的亲身经历。不止一个抑郁症患者曾说过类似的话——“我知道自己曾经笑过、闹过，也快乐过，但现在我唯一想做的只有睡觉”。04“我嘴里说着‘最近挺好的，谢谢关心’，但我眼里透露出的是另一个版本的故事，我心里回响着的是完全不一样的旋律与调性，而我的灵魂则在一旁黯然垂泪。”处于深度抑郁中时，人的感觉真的就像是行尸走肉——身体还活着，但内里却毫无生气。当你强迫自己进食，再美味的东西尝起来都如同嚼蜡。你感觉太阳的光和热如同子弹一样射向你的皮肤，却半点没有要点亮你灵魂的迹象。无论你的眼睛是张开还是闭着，从精神层面上，你看到的只是全日食般的漆黑一片。05“有人觉得抑郁就是悲伤；有人觉得抑郁就是哭泣；还有人觉得抑郁就是爱穿黑色衣服。但他们错了。抑郁是持续性的钝感与麻木——感觉不到喜怒哀乐，也感受不到人间烟火的热闹——你早上起床只是为了晚上能再次躺下。”人类变化多样的情绪就像一个旋转的万花筒，而悲伤就是这个万花筒中一种很常见的感受。它往往由某种糟糕的经历触发，比如一次令人心碎的分手，或者在新闻里看到对重大灾难幸存者的采访。悲伤的时候，你可能会哭，也许还会推拒一些社交邀请，一度感到陷入了灰暗之中。但是，这种灰暗或早或晚将被其他更为明亮的情绪所替代。然而，对于全球3.5亿的抑郁症患者来说，这种灰暗无休无止地蔓延在生活的每一个角落——天天如此、全年不断。一个在临床确诊为抑郁症的人往往已经进入了悲伤的下一阶段——麻木——他们的所有感受，包括悲伤在内，都被麻木所取代。06“抑郁时候感到的“累”是一种永无止境的累，睡得再久也于事无补。这时候的睡觉不是为了休息了，而是为了逃离。”一夜好眠醒来后的神清气爽、为新的一天而蓄势待发的感觉已经不知道多久没有过了。抑郁的时候，情感上的疲惫更甚过于身体，无论多少小时的睡眠，醒过来也只是又一阵的心塞：“啊...离再次回到床上躺下还要再过整整一个白天”抑郁的人，无论年龄大小，灵魂仿佛都已经苍老得像是百岁老人——拖着沉重的脚步处理日常琐碎，唯一关心的是还有多久才能再次躺下，回到只有自己的世界。07“唯一比抑郁更消耗人的，是假装你没有抑郁。” 演员们以角色扮演为职业；严重抑郁的人们则通常是别无选择，只能拿出奥斯卡级别的演技，表演一个在这平凡世界里乐享生活的人。然而，隐藏自己的真实情况却会付出巨大的情感耗损，比如与你生命中重要他人的疏离感加剧。你一日无法在人们面前活成“真实的”自己，你就一日无法从痛苦和孤独中解脱出来。继续伪装下去的同时，被包裹在抑郁中的疲惫感也在呈指数级增长——每骗人一次说自己还好，距心衰力竭也就更近一步。“抑郁症的可怕之处在于: 一个人几乎可以在任何情况下生存，只要她目之所及处能看到希望。然而抑郁却好似在日复一日地加重，让人看不到一切的尽头。置身其中就好像是进了一个没有钥匙孔的笼子里。”原文发自【鹿鸣心理】：“唯一比抑郁更消耗生命的，是假装你没有抑郁”补充阅读：1. 什么性格的人容易得抑郁症？ - 一隻鹿的回答 - 知乎 2. 九类常见抑郁汇总：重度抑郁、心境恶劣、双重抑郁、非典型抑郁，以及其他 - 一隻鹿的文章 - 知乎3. Amatenstein, S.(2019, Sep 13). Quotes About Depression &amp; What Depression Feels Like. PSYCOM. ",613,49
